,날짜,기사제목,기사내용
0,2021.11.02. 오후 3:28,"한국건강관리협회, ‘장애인특화차량 전달식’","한국건강관리협회(이하 건협부산)(본부장 조승진)는 지난 1일 ‘한국건강관리협회 장애인특화차량 지원사업’의 일환으로 영도구청(구청장 김철훈)에서 영도구보건소(소장 박성률)관계자와 함께 장애인 특화차량 전달식을 가졌다.중증장애인 이동권보장과 의료서비스 접근성을 위해 제작된 해당차량은 휠체어 1대가 탑승가능하며 차량내부에는 고정벨트, 안전바등이 설치되어 있어 장애인의 탑승과 안전성을 높여 제작 되었다.건협부산 조승진 본부장은 이번 제작한 특화차량을 통해 장애인들의 건강증진과 재활에 도움이 되기를 바란다면서 앞으로도 다양한 기부를 통해 시민의 건강증진에 빛이 되는 사회공헌 활동을 펼쳐 나가겠다고 언급 했다.자료제공 : 한국건강관리협회 부산광역시지부"
1,2021.11.09. 오후 12:36,'누구나 편리하게'…부산 무장애 교통서비스 고도화,"부산시·정보산업진흥원 스마트시티 챌린지 본격 추진 (부산=연합뉴스) 신정훈 기자 = 부산시와 부산정보산업진흥원은 '2021년 부산 스마트시티 챌린지 사업'을 본격 추진한다고 9일 밝혔다.    스마트시티 챌린지사업은 누구나 편리하고 안전하게 이용할 수 있는 '무장애(Barrier-Free) 교통 환경'을 구현하는 교통서비스 고도화 사업이다.    시와 진흥원은 국내 최초로 광역시 전역을 대상으로 무장애 교통 서비스를 확산하고, 교통약자를 포함한 모든 시민이 체감할 수 있는 '스마트 교통혁신 도시'를 구현하는 것을 목표로 하는 서비스와 구축 범위를 제시했다.    실내에서 쉽고 빠르게 길을 찾아주는 배리어프리 내비게이션, 대중교통 및 승차 공유플랫폼의 거점 역할을 하는 배리어프리 스테이션, 배리어프리 승차 공유 플랫폼 등의 서비스를 구현한다.    또 노인과 장애인 보호구역 등 보행자 안전 서비스를 제공하는 배리어프리 세이프티존, 특별교통수단(두리발, 자비콜, 마마콜 등) 통합 서비스를 제공하는 특별교통수단 통합 플랫폼을 구축한다.    교통약자와 시민으로 구성된 '리빙랩' 운영을 통해 사용자 의견 중심의 서비스가 구축될 수 있도록 한다. 'BF(Barrier-Free) 디자인' 도입을 통해 서비스 접근성을 높이는 방안도 추진한다.    정문섭 부산정보산업진흥원장은 ""교통약자를 포함한 모든 시민의 이동권 확보를 위한 서비스 구축 및 확산뿐만 아니라 시민 행복과 지속 가능한 스마트시티 구현에 앞장서겠다""고 말했다.    스마트시티 챌린지 사업은 국토교통부 공모사업이다.     부산시가 주관하고 부산정보산업진흥원이 총괄 수행하며, 올해부터 내년(2년간)까지 200억원이 투입된다.    시와 진흥원은 지난해 5월 스마트시티 챌린지 예비사업 기관으로 선정됐다.    예비사업 기간 실증지역인 부산 동구에서 관련 기관, 기업과 컨소시엄을 구성해 시민들과 함께 서비스를 실증해왔다.     또 실증에 이은 본격적인 사업 추진을 위해 최근 스마트시티 챌린지 사업 착수 보고회를 했다.부산 스마트시티 챌린지 사업 착수보고회[부산정보산업진흥원 제공. 재판매 및 DB금지] sjh@yna.co.kr"
2,2021.11.10. 오전 10:37,"부산정보산업진흥원-부산시, '스마트시티 챌린지' 본사업 추진 박차","부산 스마트시티 챌린지 본사업 착수 보고회 전체 사진(사진=부산정보산업진흥원 제공)부산시(시장 박형준)와 부산정보산업진흥원(원장 정문섭)은 지난 5일 누구나 편리하고 안전하게 이용할 수 있는 ‘무장애(Barrier-Free) 교통 환경 구현’ 서비스를 구축하는 '2021년 부산 스마트시티 챌린지 본사업 착수보고회'를 개최하고 사업 추진을 본격화한다고 밝혔다.‘스마트시티 챌린지 사업’은 국토교통부 공모사업으로 부산시가 주관하고 부산정보산업진흥원이 총괄 수행하고 있으며 ‘21~22년(2년간)까지 200억원 규모로 추진된다. 부산시는 지난해 5월 스마트시티 챌린지 예비사업 기관으로 선정되어 예비사업 기간 동안 실증지역인 부산 동구에서 관련 기관, 기업들과 컨소시엄을 구성하여 시민들과 함께 서비스를 실증해왔다.이날 착수보고회에서 부산시와 부산정보산업진흥원은 국내 최초 광역시 전역을 대상으로 무장애(Barrier-Free) 교통 서비스를 확산하여 교통약자를 포함한 모든 시민이 체감할 수 있는 ‘스마트 교통혁신 도시 구현을 목표’로 21년 서비스와 구축 범위를 발표했다.기존 예비사업 서비스는 실내에서 쉽고 빠르게 길을 찾아주는 ▲‘배리어프리 내비게이션’, 대중교통 및 승차 공유플랫폼의 거점 역할을 하는 ▲‘배리어프리 스테이션’, 교통약자를 위한 편리한 교통수단을 제공하는 ▲‘배리어프리 승차공유 플랫폼’이며, 신규서비스 노인장애인 보호구역 등 보행자 안전 서비스를 제공하는 ▲‘배리어프리 세이프티존’, 특별교통수단(두리발, 자비콜, 마마콜 등) 통합 서비스를 제공하는 ▲‘특별교통수단 통합플랫폼’이다.뿐만 아니라, 교통약자 및 시민으로 구성된 ‘리빙랩’ 운영을 통해 사용자 의견 중심의 서비스가 구축될 수 있도록 하고, ‘BF(Barrier-Free) 디자인 도입’을 통해 서비스의 접근성을 높일 계획이다.부산정보산업진흥원 정문섭 원장은 “교통약자를 포함한 모든 시민의 이동권 확보를 위한 서비스 구축 및 확산뿐만 아니라, 시민 행복과 지속 가능한 스마트시티 구현에 앞장서겠다.”고 말했다."
3,2021.11.04. 오후 1:45,"""도시철도 무임승차 손실 국비로 지원해야"" 부산 등 6개 특·광역시 촉구","지자체 협의회 차원 공동건의문 채택, 정부 특별회계비로 지원 가능점 부각급격한 고령화로 전국의 도시철도 무임승차 보전에 대한 지자체 부담이 가중되고 있어 정부 차원의 지원이 필요하다는 목소리가 높아지고 있다. 부산, 서울, 대구, 인천, 광주, 대전 6개 특‧광역시로 구성된 ‘전국 도시철도 운영 지자체 협의회’는 도시철도 법정 무임승차 손실에 대한 국비 보전을 촉구하는 ‘공동건의문’을 채택했다고 4일 밝혔다. ▲ 부산 도시철도. ⓒ부산시 공동건의문에는 '도시철도법' 개정안 등 정부의 손실보전 근거 마련을 위한 관련 입법안의 연내 처리, 정부가 법정 무임승차 손실을 보전하고 있는 ‘한국철도공사’와의 형평성과 정책 취지를 고려한 도시철도 예산의 국비 지원요청 등이 핵심 내용으로 담겼다. 도시철도 무임승차는 정부가 지난 1984년에 도입한 이래로 대표적인 대국민 교통복지 정책으로 자리매김했지만, 정부의 국비 보전은 이뤄지지 않아 법정 무임승차로 인한 적자와 손실이 도시철도 운영기관과 지방자치단체에 그대로 전가되어 왔던 상황이다. 그러나 최근 급격한 고령화로 인한 노인 인구 급증, 도시철도 노선 광역화에 따른 법정 무임승차 수요가 지속적으로 증가하면서, 도시철도를 운영하는 6개 지자체 운영기관의 법정 무임승차 손실은 매년 누적돼 총 23조 원의 누적적자를 기록했다. 이는 지자체 재정만으로는 감당하기 어려운 수준으로, 앞으로도 계속 늘어날 것으로 전망된다. 고령화가 가속화되고 있는 부산의 경우 이미 누적적자가 2조726억 원으로 서울을 제외하고 가장 높은 금액이다. 또한 수년간 동결된 요금, 코로나 19 장기화로 인한 지하철 이용객 감소, 전동차 등 노후시설에 대한 재투자 수요까지 겹치면서 지난해 전국 도시철도 운영기관의 당기순손실은 전년 대비 약 70% 증가한 1조8000억 원을 기록했다. 이에 따라 올해 6개 도시철도 운영기관은 부족 자금을 마련하기 위해 상‧하반기에 걸쳐 약 1조4000억 원의 공사채를 발행한 바 있다. 부산과 서울의 도시철도는 개통한 지 30~40년이 지나 전동차 등 노후시설에 대한 재투자가 필요한 시점이지만 이러한 운영기관의 재정난으로 노후시설 교체‧보수를 위한 재원 마련에 어려움을 겪고 있는 상황이다. 협의회는 도시철도 무임수송은 지난 1984년 노인과 장애인, 유공자들의 보편적 이동권을 보장한다는 취지 아래 대통령 지시로 시작한 서비스로, 국가가 책임지고 지원해야 하며 매년 수조 원의 여유 재원이 쌓이는 정부 교통시설특별회계(총 21조3430억 원)를 활용하면 기존 사회기반시설(SOC) 예산 영향 없이 국비 지원이 가능하다고 주장했다. 특별회계 내 도시철도 지원 목적의 교통체계관리계정 비율을 현행 3%(6606억 원)에서 6%(1조3019억 원)수준으로 늘리면 지자체의 연간 무임손실액(2019년 기준 약 6200억 원)을 지원할 수 있다고 설명했다. 지자체 재정 손실에 따른 정부 지원 공감대에 대해 협의회는 과거 여러 차례 논의와 지난 '2020년 정기국회에서 도시철도 공익서비스 비용 지원을 위한 법안이 긍정적으로 검토됐던 점을 고려하면 공감대는 긍정적으로 형성됐다고 봤다. 박형준 부산시장은 “부산뿐 아니라 서울, 광주, 인천 등 지하철을 운영하는 모든 지자체에서 무임승차 손실로 인한 적자로 도시철도 운영에 어려움을 겪고 있다”며 “서민의 발인 지하철이 안전하고 중단없이 운영될 수 있도록 정부와 국회에서 대승적 차원의 결단을 내려야 한다”고 밝혔다. 한편 이날 채택된 공동건의문은 정부와 국회, 각 정당 대표 등에게 전달될 예정이다."
4,2021.11.04. 오후 3:36,"[대구24시] ""도시철도 무임승차 손실 국비보전 하라""","대구시, '대구스케일업허브' 개관…민간주도 스케일업 본격 시동달성군, '2021 달성혁신성장포럼' 개최대구도철도공사 직원들이 지난 1일 반월당 환승역에서 법정 무임승차 손실액 국비 보전을 촉구하는 대시민 홍보를 펼치고 있다. ⓒ대구도시철도공사 제공도시철도 무임승차 손실액에 대한 국비 보전을 촉구하는 목소리가 높다. 정부의 법정 무임승차 시행으로 인한 도시철도 운영기관의 재정난이 한계에 봉착해서다. 도시철도를 운영하고 있는 전국 6개 지방자치단제장들은 정부가 결자해지 차원에서 이를 수용해야 한다고 촉구했다. 대구를 비롯해 서울·부산·인천·광주·대전 등 도시철도를 운영하고 있는 전국 6개 자치단체장들은 지방자치단체장들은 4일 이같은 요구를 담은 공동건의문을 채택해 정부와 국회에 전달했다.6개 특·광역시로 이뤄진 '전국 도시철도 운영 지자체 협의회'는 이날 공동건의문에서 무임승차 손실 보전 입법안 연내 처리와 한국철도공사와 형평성을 고려한 예산 지원 등을 촉구했다.협의회는 건의문에서 ""초고령화 사회로 진입하는 상황에서 정부의 법정 무임승차로 인한 손실액을 더 이상 감당할 수 없다""면서 ""여기에 코로나19 장기화와 노후시설 재투자 등으로 도시철도는 최악의 경영난을 겪고 있다""고 토로했다.도시철도 무임수송이 노인과 장애인, 유공자들의 보편적 이동권을 보장한다는 취지로 1984년 대통령 지시로 시작된 것인 것 만큼 국가가 책임지고 손실을 보전해야 한다는 게 협의회 입장이다. 손실액 지원은 매년 수 조원의 여유재원이 쌓이는 정부 교통시설특별회계를 활용하면 된다는 것이다.협의회에 따르면, 6개 지자체 도시철도 운영기관의 법정 무임승차 손실 등으로 인한 누적 적자는 23조원에 이른다. 지자체별로는 서울 16조5441억원, 부산 2조726억원, 대구 1조6323억원, 인천 1조6094억원, 광주 6209억원, 대전 6774억원 규모다. 지난해 전국 도시철도 운영기관의 당기순손실액도 전년 보다 약 70% 늘어난 1조8000억원에 이른다.      권영진 대구시장은 ""서민의 발인 지하철이 안전하고 중단없이 운영될 수 있도록 정부와 국회는 대승적 차원의 결단을 해야 할 것""이라고 촉구했다.◇ 대구시, '대구스케일업허브' 개관…민간주도 스케일업 본격 시동대구지역 최대 창업보육센터인 '대구스케일업허브(DASH)'가 5일 개관과 동시에 본격 운영에 들어간다. 대구시는 DASH 개관을 시작으로 민간 주도의 확고한 스케일업 생태계를 조성해 나간다는 방침이다.대구스케일업허브(DASH) 전경 ⓒ대구시 제공4일 대구시에 따르면, DASH는 대구시가 2016년 중소벤처기업부 창업보육센터 신규 건립사업에 선정되면서 시작한 사업이다. 구 관세청 부지에 연면적 1만3958㎡, 지하 4층·지상 11층에 보육공간 100여 개가 들어서는 지역 최대 규모의 창업보육센터다.당초 건물명은 동대구벤처밸리 기업성장지원센터로 했다. 하지만 대구(DAegu) 창업기업이 스케일업(Scale-up)으로 도약하는 데 필요한 투자유치와 R&D지원, 네트워킹 등을 제공하는 거점(Hub)기능을 하겠다는 의미를 담아 현재 이름으로 변경했다. 지난 6월 준공을 마친 DASH는 시설 운영 전문위탁기관으로 대구창조경제혁신센터를 선정해 지난 7월부터 사전 운영을 시작했다. 현재  41개 사가 입주 중이다. 권영진 시장은 개관에 앞서 ""대구는 전국 최초로 대구창조경제혁신센터를 출범시키는 등 다양한 창업 인프라를 확대해 왔다""면서 ""이를 바탕으로 지난해 기준 3103개 벤처창업기업을 발굴· 지원했으며, 올해부터 매출· 고용·투자유치에서 스케일업 기업들의 괄목할 만한 성과가 가시화되고 있다""고 말했다. 그러면서 ""앞으로 DASH를 중심으로 유니콘(기업가치 1조원 이상의 비상장 벤처창업기업) 2개 사 이상, 코스닥 상장(IPO) 5개 사 이상 배출 등 실질적인 대구 경제 성장과 양질의 일자리 창출에 기여할 방침""이라고 밝혔다.김문오 달성군수가 지난 3일 호텔 아젤리아 대강당에서 열린 '2021 달성혁신성장포럼'에서 환영사를 하고 있다. ⓒ달성군 제공◇ 달성군, '2021 달성혁신성장포럼' 개최 4차 산업혁명 시대 대구 달성군의 산업구조 고도화와 미래 비전을 제시하는 포럼이 열렸다. 달성군은 지난 3일 호텔 아젤리아 대강당에서 '2021 달성혁신성장포럼'을 열었다고 4일 밝혔다.이날 포럼에선 '대전환기, 달성지역 산업발전 전략'에 대한 주제발표와 지역 혁신기업 사례발표가 있었다. 또  '글로벌 기업의 혁신 전략' 특강과 '달성군의 성장 가치와 기업 발전 전략'에 대한 발표가 이어졌다.김문오 달성군수는 환영사에서 ""우리는 변혁의 시대를 살고 있다. 코로나19는 이러한 변혁의 속도를 더욱 빠르게 만들었고, 새로운 환경에 적응하지 못하면 도태될 수밖에 없다'고 지적하며 지역기업의 선제적 대응을 강조했다.이재하 대구상공회의소 회장은 ""지금 세계는 한치 앞도 예견할 수 없는 변화의 소용돌이 속에 있다, 이런 시기일수록 현재에 머무르지 말고 변화와 혁신을 통해 경쟁의 우위를 점해야 한다""고 강조했다."
