,날짜,기사제목,기사내용
0,2022.07.24. 오후 6:47,[편집국에서] 우영우 효과,"이호진  편집국 부국장요즘 드라마 ‘이상한 변호사 우영우’가 영상 콘텐츠 시장 최고 인기 작품이다. ‘우 to the 영 to the 우’, ‘기러기 토마토 스위스 인도인 별똥별, 똑바로 읽어도 거꾸로 읽어도 우영우’ 등 대사에서부터 우영우와 친구 동그라미의 독특한 인사법까지 세대를 초월했다.‘우영우’는 다큐멘터리가 아닌 판타지와 허구가 허용되는 드라마다. 드라마니까 국내 최고 법학부 출신 아버지의 후배가 대표로 있는 대형 로펌에 장애인임에도 들어가고, 일부 ‘권모술수형’ 동료를 제외하고는 조직 내에서 비장애인과 동등하게 대우 받는다. 무엇보다 우영우처럼 한 번 본 것은 절대 잊지 않는 서번트 증후군을 가진 자폐 장애인을 현실에선 만나기가 쉽지 않다. 이런 점 때문에 자폐 장애를 포괄하는 상당수 발달 장애인 가족들에게 ‘우영우’는 비현실적으로 다가온다. 장애인은 우영우처럼 뛰어나야만, 세상에 도움이 되어야만 세상 밖으로 나올 수 있냐는 서늘한 비판도 있다.세계에서 주목하는 드라마 ‘우영우’비현실적이라도 장애 인식은 개선후천적 장애 90% 현실 생각하며‘누구나 잠재적 장애인’ 고려해야15년 묵은 차별금지법 국회 통과사회 시스템 개선으로 나아갈 때우리 주변에도 발달 장애인이 꽤 있다. 고리핵발전소 소송으로 유명한 부산 기장군의 균도 씨도 1급 발달 장애인이다. 아버지 이진섭 씨와 세상 걷기를 하던 청소년은 어느새 서른을 넘긴 장년이 되었지만 여전히 가족의 보살핌이 필요하다. 영화 ‘말아톤’에서 초원이보다 하루만 더 살게 해달라던 엄마의 소원은 점점 노쇠해져 가는 진섭 씨 부부의 불안과 맞닿아 있다. 발달장애 국가책임제를 요구하는 장애인 가족들의 목소리에 정부는 몇 시간 주간활동서비스 보조뿐이다. 가족의 영혼을 갈아 넣지 않고는 사회에 나올 수도, 독자적인 생활도 거의 불가능한 발달장애인 가족들에게는 ‘우영우’가 얼마나 허무하게 비칠까. 판타지에 잠시 웃고 울다 돌아온 현실의 괴리는 얼마나 공허할까 싶다.그럼에도 불구하고, ‘우영우’는 자신이 장애와 무관하다고 믿는 훨씬 더 많은 ‘비장애인’들에게 장애에 대한 거리감을 좁히는 데 큰 역할을 한다고, 기자는 생각한다. 최근 종영한 드라마 ‘우리들의 블루스’에 나온 다운증후군 작가 정은혜 씨처럼 장애인을 직접 출연시키지는 않았지만, ‘우영우’는 비장애인이 받아들이기 쉽도록 단맛을 덧씌운 ‘당의정’같은 역할을 했다고 본다.국내 최고 로스쿨 수석 졸업과 만점에 가까운 변호사 시험 성적에도 우영우는 장애 때문에 취업 시장에서 차별 받았고, 그런 차별적 시각의 비장애인을 대변하는 동료도 등장한다. ‘우영우’는 장애인 차별이 옳지 않다는, 그들도 동등하게 대우받을 권리가 있다는 주제를 내세우지 않는다. 행동을 그렇게 하는 동료 이준호·정명석·최수연을 통해 그렇지 않은 주변인이 허접해 보이는 대비효과를 만든다. 이런 점 때문에 일각에선 우영우의 부족한 점을 기꺼이 메우고, 늘 이해하고 지지하는 동료들이 있어 우영우의 활약이 가능하다는 점에서 그 동료들이 더 판타지에 가깝다고 말하기도 한다.지난해 보건복지부 장애인 실태조사 결과 장애를 갖고 태어난 장애인 비율은 불과 10.6%뿐이다. 장애인 10명 중 9명은 후천적 장애인이라는 얘기다. 자신은 장애와 무관할 것이라 믿는 비장애인도 산업재해, 교통사고, 질병 등 언제 어떤 이유로 장애를 입을지 모르는 ‘잠재적 장애인’이다. 하지만 장애인 이동권을 비롯한 장애인 권리 예산 확보를 호소하며 전국장애인차별철폐연대 소속 활동가들이 출근길 지하철 시위를 벌인 데 대해 정부·여당은 눈도 깜빡하지 않았다. 장애가 나와 멀지 않다, 장애인도 사회의 동등한 구성원이며 차별받지 않을 권리가 있다는 인식이 사회 전반에 자리잡는다면, 온갖 욕 들어가며 출근길 지하철 지연 시위를 굳이 할 필요도 없이 장애인의 자립을 돕는 정부 예산과 사회 시스템도 자연스럽게 구축될 것이다.차별하지 않아야 할 대상이 어디 장애뿐일까. 국가인권위원회는 종교, 인종, 장애, 학력, 지역, 외모, 성적 지향과 정치·사상적 신념 등 거의 모든 사유의 차별을 금하고 있다. 5년간 깎인 임금 30%만 복원해달라는 노동자의 평화적인 시위에 온갖 혐오의 언어를 쏟아내던 사람들은 겨우 4.5% 임금 인상을 해주고는 수천 억 파업 손실 책임을 노동자들에게 떠민다.방역까지 개인이 책임져야 하는 각자도생 시대, 주변을 돌아볼 여유도 없이 오로지 내 안위만 챙겨야 겨우 손해보지 않을 것만 같은 각박한 시대에 ‘우영우’가 던진 메시지에 조금이라도 마음이 푸근해졌다면 거기에서부터 차별 철폐는 한 걸음씩 시작되어야 한다. 드라마 한 편에 너무 큰 의미 부여라 해도, 점점 위험 속으로 빠져드는 세상에 조용히 저항하는 작품에 공감하는 그들이, 우리가 희망이다."
1,2022.07.12. 오전 5:07,"시장님, 장애인 이동권 공약은 어디 있나요 [장애인 이동권, 갈등 넘어 연대로]","<중>17개 시도지사 공약 분석대규모 교통개발 공약만 ‘봇물’지자체·정부 적극적 협업 필요홍준표 장애인 정책 ‘제로’… 김동연 콜택시 시스템 통합“경북의 장애인 이동권은 전국 최하위권입니다. 그나마 경북 경산시나 안동시, 구미시에서는 이틀, 사흘 전에 예약하면 경북장애인택시(부름콜)를 탈 수 있는데, 현실적으로 탈 수 없는 지역도 있습니다.”(이종광씨)“경기 김포시에서는 예약하면 장애인 콜택시를 타고 서울이나 인천 등 다른 지역으로 이동할 수 있습니다.”(박민규씨)서울신문이 비영리 공공조사네트워크 ‘공공의창’, 숙의토론 전문기관 ‘코리아스픽스’, 장애인 협동조합 ‘무의’와 지난달 25일 주최한 ‘장애인 이동권 숙의토론회’에서 장애인과 비장애인 참가자 36명은 지역에 따른 장애인 이동권 격차가 심각하다고 입을 모았다. 장애인 1만 5058명이 사는 경산시는 장애인 콜택시가 21대뿐이지만 장애인 인구가 경산시보다 1.2배(1만 8394명) 많은 김포시에는 장애인 콜택시가 40대 있다. 경북 울진군에서 대구로 가려면 두 달 전에 예약해야 한다.이러한 장애인 이동권 격차를 해소하기 위해선 광역자치단체의 적극적인 예산 투입이 필요하다. 그럼에도 이달 닻을 올린 17개 광역지자체장은 각종 고속도로나 철도, 지하철 연장 등 ‘교통 공약’을 내면서도 장애인 이동권 공약이 없거나 선언적 수준에 그치는 경우가 적지 않았다.11일 서울신문이 6·1 지방선거로 당선된 17개 광역지자체장의 선거공보와 5대 공약을 살펴본 결과 홍준표 대구시장과 이철우 경북지사는 장애인 이동권은 물론 장애인 관련 공약을 찾아볼 수 없었다. 박형준 부산시장, 박완수 경남지사, 김태흠 충남지사는 장애인 공약이 일부 있었으나, 장애인 이동권 보장을 위한 공약은 보이지 않았다. 반면 대규모 교통 개발 공약은 빠지지 않았다. 홍 시장은 후보 시절 “국비를 확보해 대구통합신공항을 건설하고 대구 도시철도 노선을 확대하겠다”고 공약했다. 이 지사도 동서횡단철도 추진, 영일만횡단도로 등 교통망 확보를 주요 공약으로 내걸었다.교통 약자가 겪는 이동권 제약을 한꺼번에 해결하려다 보니 한계도 드러났다. 김진태 강원지사는 “장애인 콜택시를 늘려 조기에 도입률 100%를 달성하겠다”고 약속하면서도 “이용 대상자를 임산부를 포함한 교통 약자로 확대하겠다”고 밝혔다.정다운 전국장애인차별철폐연대(전장연) 정책실장은 “법적으로 지켜야 하는 도입률은 휠체어 사용자를 위해 리프트를 장착한 차량을 기준으로 계산한 것”이라면서 “공급보다 이용 수요 증가가 커서 대기 시간이 급증해 자칫 교통 약자가 불편함을 겪을 수 있다”고 짚었다.그는 오색케이블카 설치를 통한 ‘장애인 등 보편적 문화향유권을 보장할 수 있다’는 공약 역시 “기본적인 대중교통 체계부터 갖추는 방향이 적절하다”고 꼬집었다.공약집에서 구체적인 목표나 수치를 밝히지 않은 경우도 있었다. 김영환 충북지사는 선거 당시 사회적 약자의 이동권 강화를 위해 저상버스 확대를 약속했고, 김영록 전남지사는 교통 약자를 위한 바우처 택시의 확대 시행을 공약으로 냈다. 바우처 택시는 휠체어 이용자가 아니지만 이동의 제약을 겪는 시각장애인 등이 탈 수 있는 대체교통수단이다.장애인 유권자들의 요구를 반영한 공약도 눈에 띄었다. 김동연 경기지사는 장애인 콜택시 광역통합 시스템을 구축하기로 했다. 서울은 25개구의 운행체계를 정비했지만, 경기는 시군마다 다른 요금 체계나 이동 거리 등 운행 규정을 통합해야 한다. 오세훈 서울시장은 ‘장애인 버스비 무료’를 추진하기로 했다.장애인 관련 단체에선 장애인 콜택시 같은 특별교통수단의 운영비를 국비로 지원하도록 하는 제도 개선이 필요하다고 지적한다. 장애인 이동권은 보편적으로 누려야 하는 인권 문제인데도 장애인마다 사는 지역에 따라 이동권 격차가 나타나기 때문이다. 그동안 보조금법 시행령에서 장애인 특별운송사업 운영비는 보조금 지급 제외 사업으로 정해 지자체가 운영을 부담했다.2021년 ‘교통약자의 이동편의 증진법’이 개정돼 국가가 운영비를 지원할 수 있게 됐지만 기획재정부는 적정한 국비 지원 비율에 대한 연구 용역을 우선 진행해야 한다며 제도 시행에 소극적인 태도를 보이고 있다. 전장연은 서울은 국비 50%, 그 외 지역은 국비 70% 지원을 요구하고 있다.전지혜 인천대 사회복지학과 교수는 “장애인이 이용할 수 있는 광역버스나 저상버스도 필요하지만 현실적으로 지자체별 장애인 콜택시나 바우처 택시 기준을 통일하면 거주 지역에 따른 이동 격차를 줄일 수 있다. 지자체장의 적극적 의지만 있으면 충분히 가능하다”고 말했다.		"
2,2022.07.27. 오후 4:07,"올 여름 가기 전, 부산 사람이라면 한 번은 봐야 할 기사 [부산 지역언론 톺아보기]","[부산 지역언론 톺아보기] 2022년 2분기, 놓칠 수 없는 보도 소개합니다2022년 2분기 우리 사회에는 다양한 현안들이 있었습니다. 2년 1개월만에 사회적 거리두기 조치가 모두 해제됨에 따라 일상회복에 대한 기대감이 커졌고, 20대 대선 3개월 만에 지방선거를 치르기도 했습니다. 또 장애인 이동권 투쟁, 화물 노동자·대우조선하청지회 노동자 파업과 같이 권리를 찾기 위한 목소리도 이어졌습니다. 그런 가운데 사상 처음으로 부산에서는 롯데백화점 광복점이 일일 폐쇄되는 일이 있었던가 하면, 북항재개발 랜드마크 구상안이 발표돼 난개발 우려를 낳기도 했습니다. 그 어느 때보다 경제·정치·행정 권력에 대한 감시기 필요했던 시기였습니다. 부산민주언론시민연합은 2분기 지역언론의 보도 중 널리 공유하고 싶은 부산지역 언론의 보도 3편을 선정해 공유합니다.부산 긴급복지 신청 10만 건의 흔적데이터로 그려낸 코로나19 불평등의 모습               ▲  KBS부산 위기가구 추적 보고서            ⓒ KBS부산   첫 선정작은 KBS부산 <위기가구 추적 보고서, 코로나 2년 빅데이터>입니다. KBS부산은 4월 18일부터 22일까지 이를 6차례 보도했습니다. 2년 1개월만의 사회적 거리두기 해제로 일상 회복에 대한 기대가 높은 시기에, 코로나19가 남긴 불평등의 흔적을 데이터로 드러내 모두가 바로 일상으로 돌아갈 수는 없음을 공론화 했습니다.   아주 어려운 상황을 겪고 마지막으로 잡는 밧줄 같은 제도, 긴급복지 지원. KBS부산은 최근 3년간 부산의 긴급복지 10만여 건을 전수 분석했습니다. 코로나19를 거치며 지원금액이 2배 가까이 증가했을 뿐 아니라 지역별, 연령별로 살펴 부산의 위기가구 지형이 변화했음을 짚었습니다. 이를 통해 이전과 같은 일시적, 한정적 지원만으로는 코로나19 위기가구가 일상으로 돌아갈 수 없음을 지적했습니다.  불평등은 보이지 않습니다. ""너무 힘들다"", ""어렵다"", ""불평등이 심화됐다""는 목소리가 공허한 한탄으로 끝나지 않게 하기 위해 KBS부산이 선택한 건 데이터였습니다. 전대미문의 재난이 남긴 가혹함의 흔적을 시각화하자 10만 개인의 위기가 공동체의 문제로 드러났습니다. 코로나19로 깊어진 불평등의 문제를 공론화하고 '함께' 일상으로 돌아가기 위한 대안까지 모색하고자 한 KBS부산의 위기가구 추적 보고서를 꼭 한번 보시길 추천합니다. 언론이 따져 묻지 않으면 세상에 없는 일이 된다 정치권력에 대한 독립적 감시자 역할 빛난 부산MBC 보도              ▲  부산MBC <'사회 환원' 약속...알고 보니 '가족 재단' 기부>            ⓒ 부산MBC   부산MBC는 4월 4일 <'사회 환원' 약속…알고 보니 '가족 재단' 기부>를 보도했습니다. 해당 보도는 한 건에 불과하지만 지역민의 알권리를 충족했고, 정치권력 감시의 정수를 보여줬습니다. 지난해 보궐선거 당시 후보자 재산신고 내역 검증을 통해 건축물 신고 누락을 지적한데 이어, 박형준 부산시장의 대시민 약속을 검증함으로써 1년여에 걸친 보도의 퍼즐이 맞춰졌습니다. 집념이 빛을 발한 보도였습니다.  공직자 재산공개 내용을 단순 전달하는 데 그치지 않고, 박형준 시장의 재산 변동 내역과 기부처를 상세히 취재했습니다. 이를 통해 지역사회에 기부를 약속한 것과 달리, 임원에 자녀 이름이 올라와 있는 가족재단에 기부했다고 알렸습니다.  선거 과정에서 불거진 문제에 대한 정치인의 약속 혹은 후보의 공약. 유권자는 그 약속을 지킬 것이라 믿고 후보에 한 표를 행사합니다. 하지만 이는 법적 테두리 밖 약속이기 때문에 언론이 보도하지 않으면 영영 잊히거나, 시민과의 약속은 보도할 가치가 없는 사안이라 생각하게 됩니다.  보궐선거 후보자 재산신고, 정치인의 약속, 국정감사 발언, 공직자 재산공개를 하나로 연결해 낸 제4부 권력, 부산MBC. 위의 보도 또한 한 번 보시길 추천합니다. 대선 직후 치러진 지방선거초유의 상황에 한 표 가치 알리기 부터 나선 부산MBC 선거기획               ▲  부산MBC <2022 6.1 지방선거 기획보도>            ⓒ 부산MBC   부산MBC는 5월 9일부터 30일까지 지방선거 기획보도를 이어갔습니다. 대선 이후 3개월만에 치러지는 지방선거에 좀처럼 분위기가 모아지지 않고 있던 시기였습니다. 그런 가운데 위의 기획은 지방선거 기간 부산 유권자의 선거 길잡이 역할을 톡톡히 해냈습니다.  시작은 '투표를 안한다구요?'였습니다. 이를 통해 지방선거에 대한 이해를 높이고 유권자의 한 표 가치를 강조했습니다. 이어 지방선거에서 등한시되는 기초의원 선거에 주목해 기초의원 무용론을 반박하고 부산에서 처음으로 도입된 4인 선거구제를 부각했습니다. 선거구 쪼개기 문제, 거대 양당 중심 선거 판세와 이로 인한 공천제도의 문제점을 지적했습니다. 당면한 선거뿐 아니라 4년 후를 기약하며 더 나은 선거제도를 위한 제언이 돋보이는 선거기획이었습니다. 지방선거를 일주일 앞두고는 광역단체장 후보 3인의 공약과 의혹을 검증해 유권자에게 실제로 도움이 되는 선거방송을 보여줬습니다.  지방선거의 의미, 기초의원 선거 강조, 헛구호에 그친 개혁공천, 무투표당선 문제, 광역단체장 후보 검증까지. 후보자 선거운동 동정보도가 빠진 자리에 유권자 중심 선거보도를 채워 넣은 부산MBC 지방선거 기획. 이러한 시도가 지속해서 이어지길 기대하며 한 번 보시길 추천합니다. "
3,2022.07.11. 오후 6:07,"시장님, 지역 간 장애인 이동권 격차 줄일 공약 어디 있나요?","서울신문-공공의창 공동 기획장애인 콜택시  - 장애인들의 주요 이동 수단인 장애인 콜택시는 현행법상 장애인 150명 당 1명 꼴로 확보해야 하는데, 실제로는 180명 당 1대가 운영 중이다. 서울시설공단 제공“경북의 장애인 이동권은 전국 최하위권입니다. 그나마 경북 경산시나 안동시, 구미시에서는 이틀, 사흘 전에 예약하면 경북장애인택시(부름콜)를 탈 수 있는데, 현실적으로 탈 수 없는 지역도 있습니다.”(이종광씨)“경기 김포시에서는 예약하면 장애인 콜택시를 타고 서울이나 인천 등 다른 지역으로 이동할 수 있습니다.”(박민규씨)서울신문이 비영리 공공조사네트워크 ‘공공의창’, 숙의토론 전문기관 ‘코리아스픽스’, 장애인 협동조합 ‘무의’와 지난달 25일 주최한 ‘장애인 이동권 숙의토론회’에서 장애인과 비장애인 참가자 36명은 지역에 따른 장애인 이동권 격차가 심각하다고 입을 모았다. 장애인 1만 5058명이 사는 경산시는 장애인 콜택시가 21대 뿐이지만 장애인 인구가 경산시보다 1.2배(1만 8394명) 많은 김포시에는 장애인 콜택시 40대가 있다. 경북 울진군에서 대구로 가려면 두 달 전에 예약해야 한다. 대구와 인접한 경북 고령군은 관내 이동조차 한 달 전에 예약해야 한다.이러한 장애인 이동권 격차를 해소하기 위해선 광역자치단체의 적극적인 예산 투입이 필요하다. 그럼에도 불구하고 이달 닻을 올린 17개 광역지자체장은 각종 고속도로나 철도, 지하철 연장 등 ‘교통 공약’을 내면서도 장애인 이동권 공약이 없거나 선언적 수준에 그치는 경우가 적지 않았다.11일 서울신문이 6·1 지방선거로 당선된 17개 광역지자체장의 선거공보와 5대 공약을 살펴본 결과, 홍준표 대구시장과 이철우 경북지사는 장애인 이동권은 물론 장애인 관련 공약을 찾아볼 수 없었다. 박형준 부산시장, 박완수 경남지사, 김태흠 충남지사는 장애인 공약이 일부 있었으나, 장애인 이동권 보장을 위한 공약은 보이지 않았다. 반면 대규모 교통 개발 공약은 빠지지 않았다. 홍 시장은 후보 시절 “국비를 확보해 대구통합신공항을 건설하고 대구 도시철도 노선을 확대하겠다”고 공약했다. 이 지사도 동서횡단철도 추진, 영일만횡단도로 등 교통망 확보를 주요 공약으로 내걸었다.교통 약자가 겪는 이동권 제약을 한꺼번에 해결하려다 보니 한계도 드러났다. 김진태 강원지사는 “장애인 콜택시를 늘려 조기에 도입률 100%를 달성하겠다”고 약속하면서도 “이용 대상자를 임산부를 포함한 교통 약자로 확대하겠다”고 밝혔다. 정다운 전국장애인차별철폐연대(전장연) 정책실장은 “법적으로 지켜야 하는 도입률은 휠체어 사용자를 위해 리프트를 장착한 차량을 기준으로 계산한 것”이라면서 “공급보다 이용 수요 증가가 커서 대기 시간이 급증해 자칫 교통 약자가 불편함을 겪을 수 있다”고 짚었다. 그는 오색케이블카가 설치를 통한 ‘장애인 등 보편적 문화향유권을 보장할 수 있다’는 공약 역시 “기본적인 대중교통 체계부터 갖추는 방향이 적절하다”고 꼬집었다.공약집에서 구체적인 목표나 수치를 밝히지 않은 경우도 있었다. 김영환 충북지사는 선거 당시 사회적 약자의 이동권 강화를 위해 저상 버스 확대를 약속했고, 김영록 전남지사는 교통 약자를 위한 바우처 택시의 확대 시행을 공약으로 냈다. 바우처 택시는 휠체어 이용자가 아니지만 이동의 제약을 겪는 시각 장애인 등이 탈 수 있는 대체교통수단이다.장애인 유권자들의 요구를 반영한 공약도 눈에 띄었다. 김동연 경기지사는 장애인 콜택시 광역통합 시스템을 구축하기로 했다. 서울은 25개구의 운행체계를 정비했지만, 경기는 시군마다 다른 요금 체계나 이동 거리 등 운행 규정을 통합시켜야 한다. 오세훈 서울시장은 ‘장애인 버스비 무료’를 추진하기로 했다.장애인 관련 단체에선 장애인 콜택시 같은 특별교통수단의 운영비를 국비로 지원하도록 하는 제도개선이 필요하다고 지적한다. 장애인 이동권은 보편적으로 누려야 하는 인권 문제인데도 장애인마다 사는 지역에 따라 이동권 격차가 나타나기 때문이다. 그동안 보조금법 시행령에서 장애인 특별운송사업 운영비는 보조금 지급 제외 사업으로 정해 지자체가 운영을 부담했다. 2021년 ‘교통약자의 이동편의 증진법’이 개정돼 국가가 운영비를 지원할 수 있게 됐지만 기획재정부는 적정한 국비 지원 비율에 대한 연구 용역을 우선 진행해야 한다며 제도 시행에 소극적인 태도를 보이고 있다. 전장연은 서울은 국비 50%, 그 외 지역은 국비 70% 지원을 요구하고 있다.전지혜 인천대 사회복지학과 교수는 “장애인이 이용할 수 있는 광역버스나 저상버스도 필요하지만 현실적으로 지자체별 장애인 콜택시나 바우처 택시 기준을 통일하면 지자체 간 이동의 장벽을 허물 수 있다. 지자체장의 적극적 의지만 있으면 가능하다”면서 “광역망 단위로 장애인 이동 수요를 조사하고 중앙정부에서 예산을 지원해야 한다”고 말했다.※공공의 창은?2016년 문을 연 비영리 공공조사 네트워크다. 리얼미터·리서치뷰·우리리서치·리서치DNA·조원씨앤아이·코리아스픽스·티브릿지·한국사회여론연구소·한국여론연구소·피플네트웍스리서치·서던포스트·세종리서치·소상공인연구소·PDI·지방자치데이터연구소 등 15개 여론조사 및 데이터분석 기관이 우리 사회를 투명하게 반영하고 공동체에 보탬이 되는 조사가 필요하다는 뜻을 모아 출범시켰다. 정부나 기업의 의뢰를 받지 않고, 매달 ‘의뢰자 없는’ 조사 분석을 실시하고 있다.		"
