,날짜,기사제목,기사내용
0,2022.04.19. 오전 10:41,"부산장애인단체, 보행약자 이동권 개선 촉구","""낙동강 생태공원 화장실 이용도 불편"" 지적울퉁불퉁 보행로 자료사진[촬영 차근호·재판매 및 DB 금지]    (부산=연합뉴스) 김재홍 기자 = 장애인의 날(4월 20일)이 하루 앞두고 부산에서도 장애인 이동권 개선을 요구하는 목소리가 높다.         부산뇌성마비장애인부모회, 부산참여연대, 사회복지연대는 19일 부산시청 앞에서 기자회견을 열고 부산지역 16개 구·군청 주변 보행환경 조사 결과와 해당 지자체의 후속 조치 답변을 공개했다.     이들 단체는 '보행약자 이동권 개선 시민추진단'을 구성해 지난해 9월 27일부터 10월 17일까지 유효보도폭, 보도 턱 높이, 점자블록 위치, 점자블록 파손 및 훼손, 저상버스 정차가능 공간, 불필요한 볼라드 설치, 보행도로 불편사항 등을 조사했다.     그 결과 15개 지자체에서 유효보도폭과 건널목 앞 점자블록 위치가 지적됐고, 보도블록 파손 등 보행 도로 불편 사항은 14개 지자체에서 확인됐다.  11개 지자체에서는 점자블록 파손 및 훼손이 지적됐다.     조사대상 중 유효보도폭의 넓이가 1.3m 이상을 충족한 곳은 31.6%, 점자블록을 횡단보도 경계석으로부터 30㎝ 앞에 설치한 곳은 12.9%에 불과했다.     시민추진단은 이런 조사결과를 토대로 해당 지자체에 개선을 요청했다.     시민추진단 관계자는 ""16개 지자체 중 14개 지자체가 시설 개선을 긍정적으로 검토한다고 답했으나 나머지 2개 지자체는 회신조차 하지 않았다""고 설명했다.     그러면서 ""보행 약자의 보행환경은 좀처럼 개선되고 있지 않다""며 ""개선계획을 지속해서 모니터링해 개선될 수 있도록 할 것""이라고 말했다.      낙동강 일대 생태공원에 설치된 화장실도 장애인 접근성이 떨어지는 것으로 나타났다.     부산장애인자립생활센터와 사상구장애인자립생활센터는 이날 오전 부산 사상구 삼락생태공원 인근 화장실 앞에서 기자회견을 열고 삼락생태공원과 화명생태공원 화장실을 조사한 결과는 발표했다.     삼락생태공원은 화장실 16곳 중에서 장애인 화장실이 설치되지 않은 곳은 4곳, 장애인 화장실이 있어도 리프트가 제대로 작동하지 않는 곳은 4곳, 장애인 화장실 자체가 고장나 아예 사용할 수 없는 곳이 2곳이었다.     화명생태공원은 전체 화장실 9곳 모두에 리프트가 설치돼 있었으나 이 중 4곳은 전동휠체어가 접근할 수 없었다.     센터 관계자는 ""리프트 자체가 전동휠체어의 중량을 감당하지 못하는 저용량""이라며 ""낙동강의 다른 생태공원인 을숙도생태공원, 맥도생태공원, 대저생태공원의 사정도 비슷할 것""이라고 우려했다.     기자회견 참석자들은 부산시 낙동강관리본부에 생태공원 내 화장실을 전수조사하고, 생태공원 안내 홈페이지에 장애인과 이동약자를 위한 편의시설 안내 정보를 추가하는 등 적극적인 개선에 나서달라고 당부했다.  pitbull@yna.co.kr"
1,2022.04.18. 오전 5:03,“버스도 택시도 없어서 못탄다”…장애인이동권 지역마다 제각각,"‘교통약자 이동권’ 지역마다 제각각장애인콜택시 기준 충족 ‘단 2곳뿐’저상버스 보급률, 농어촌은 10%대지방정부, 대체수단 모색에도 한계문경희 세종보람장애인자립생활센터 소장(앞줄 가운데)이 11일 대전시청 북문 앞에서 열린 ‘충청권 특별교통수단 광역이동체계 확립’을 촉구하는 기자회견에서 “장애인콜택시 법정 대수 도입과 휠체어 탑승 버스 운영을 확대해 장애인 이동권을 보장해달라”고 호소하고 있다. 송인걸 기자지난 3월 말 이준석 국민의힘 대표가 연일 장애인단체의 지하철 승하차 시위를 비판한 뒤 ‘교통약자 이동권’이 사회 관심사로 떠올랐다. 논란은 이 대표의 혐오표현, 혐오정치를 어떻게 볼 것인지로 ‘승화’되기도 했다. 그렇다면 논의의 본질인 우리 사회 교통약자의 이동권 보장 상황은 어느 정도일까. 이를 파악하기 위해 지방자치단체들의 교통약자(장애인) 교통수단 확보·운영 현황을 살펴봤더니, 지자체별 격차가 커 균등하고 실질적인 이동권 보장을 위한 정부 차원의 고민과 대책 마련이 필요한 것으로 나타났다.■ 장애인콜택시 기준 충족 시·도 2곳교통약자 이동권 보장을 위한 수단으로는 장애인콜택시와 저상버스가 대표적이다.이 가운데 장애인콜택시는 교통약자의 이동편의 증진법(교통약자법)에서 규정한 운용 대수 기준은 4694대지만, 실제는 3914대(83.4%)가 운용되고 있는 것으로 나타났다.(국토교통부, ‘2020년도 교통약자 이동편의 실태 조사 연구’, 2021년 5월) 교통약자법에서는 보행장애 정도가 심한 장애인 150명당 1대꼴로 장애인콜택시를 확보하도록 규정하는데, 실제로는 180명당 1대꼴로 운용 중인 셈이다.지역별로는 경기(112.8%)와 경남(105.9%)이 기준치를 충족했을 뿐, 나머지 15개 시·도는 기준에 미달했다. 그나마 제주(97.1%), 광주(89.9%), 서울(85.1%) 3곳은 평균을 웃돌았고, 부산(56.4%), 인천(57.3%) 등은 기준치의 절반 규모로 장애인콜택시를 운영하고 있었다.장애인콜택시 요금과 운영 방식도 지자체별로 천차만별이었다. 서울은 장애 1~3등급, 광주·대구·세종은 장애 1~2등급과 3등급 가운데 일부, 대전·부산·울산·인천·제주는 장애등급 대신 ‘보행상 장애가 심한 사람’을 이용자로 규정했다.기본요금은 서울이 5㎞까지 1500원, 10㎞까지 2900원에 시간·지역 할증은 없었다. 광주는 2㎞까지 660원이고 150m당 30원, 36초당 30원씩 요금이 추가됐다. 야간·시외지역 운행 때는 20% 할증이 적용된다. 대구는 3㎞에 1천원, 10㎞까지 ㎞당 300원을 받는데 시내는 3300원, 시외는 6600원 한도가 정해져 있다. 대전은 대구와 기본요금은 같지만 이동거리가 3㎞를 넘으면 440m·107초당 100원씩 요금이 추가되고, 시외요금은 20% 할증된다. 밤 미운행시간대, 관외까지 운행하는지 여부 등도 지자체마다 달랐다.장애인콜택시를 이용하는 장애인은 기본요금과 이용요금만 부담하면 된다. 일반 요금과의 차액은 지방정부가 부담한다. 관련 재원은 복권판매수익금과 지자체 예산으로 마련된다. 대전시의 경우 지난해 장애인콜택시 구입비·인건비·유류비·유지비로 66억원가량을 사용했다. 장애인콜택시는 승합차량을 사 리프트 시설 등을 설치하는데 대당 비용은 약 4600만원, 운전 직원 연봉은 1명당 평균 3800만원이라고 한다.적정 수준의 장애인콜택시가 확보되지 않은 곳에서는 대기시간 등 서비스 관련 불만이 많을 수밖에 없다.노경수 부산사상구장애인자립생활센터 소장은 “지난 3일 해운대에서 (장애인콜택시를 호출했다가) 1시간 넘게 기다렸다. 교통약자에 맞춰 부족한 차량과 기사 확보를 몇년째 요구하고 있지만, 달라지는 건 없다”고 혀를 찼다. 부산시 장애인콜택시 확보율은 56.4%(기준 321대, 운행 181대)로 전국 최하위다.김동효 광주장애인차별철폐연대 활동가도 “대당 운전 직원 수와 운행시간을 늘리고, 궁극적으로는 차량을 증차해야 2~3분에서 1~2시간까지 들쑥날쑥한 대기시간을 정상화할 수 있다”고 말했다.■ 저상버스 도입률, 시-도 격차 커출입구에 계단이 없고 차체가 낮아 유아차를 끌거나 장애인들이 휠체어를 탄 채 탑승할 수 있는 저상버스는 2000년대 초반 서울과 경기도를 중심으로 도입되기 시작한 이래 꾸준히 퍼져, 전체 시내버스 30%가량을 차지한다. 국토교통부 자료를 보면, 저상버스는 2020년 말 현재 전국에 9840대(전체 시내버스 3만5445대의 27.8%)가 운행 중이다.다만, 인구밀도가 높은 도시 지역인 특별시·광역시의 저상버스 보급률은 40% 수준으로 높지만, 농어촌 복합버스 운행 비율이 높고 도로 사정이 상대적으로 안 좋은 도 지역의 평균 저상버스 보급률은 10%대에 그친다.이와 관련해 김관동 충남도 교통정책팀장은 “국토부 저상버스 도입률 통계는 준공영제 기준인데, 시·도는 개별 운수업체가 운영하는 농어촌 버스가 대부분”이라며 “농어촌 도로 특성상 도로 굴곡과 요철이 심해 저상버스는 운행이 어렵고, 운행 비용도 일반버스보다 더 들어 업체에서 도입에 소극적일 수밖에 없다”고 말했다. 위문일 전남도 도로교통과 주무관도 “22개 시·군 가운데 17개 군 지역엔 저상버스 도입 의무가 없는 농어촌 버스가 운행되고 있다”고 말했다.이런 가운데서도 강원도는 올해 저상버스 29대를 증차하기로 했다. 김상호 강원도청 교통복지팀장은 “대형 전기저상버스 1대 구매비가 2억3천만원인데 사업자가 1억원을 부담해야 한다”며 “사업자에게 장애인 이동권 보장 정책의 공공성을 알려 협조를 얻고 도와 시·군도 예산을 확보해 증차할 수 있었다”고 전했다.이 밖에 부산시가 올해 저상버스 도입률을 38.9%(2517대 가운데 853대)까지 끌어올리겠다고 밝혔고, 대전시는 대전역~세종~오송역 구간 비아르티(BRT) 노선에 올해 10월까지 2층 전기저상버스 2대를 투입하기로 했다.반면에 울산시는 광역시 가운데 유일하게 저상버스 보급률이 10%대(12.3%·844대 중 104대)에 그쳐 눈에 띄었다. 이와 관련해 울산시 버스택시과 쪽은 “예산도 10억원에 불과해 저상버스 확충에 애로가 있다”며 “도농복합지역이라 운행거리가 길고, 도로 상황도 여의치 않아 버스업체 쪽에서 운행을 기피하는 경향도 있다”고 말했다. ※ 이미지를 누르면 크게 볼 수 있습니다.■ 바우처택시·임차택시 등 대체수단도 장애인콜택시와 저상버스만으로는 모자라는 교통약자의 이동권 보장을 위해 세종·경남·경북 3곳을 제외한 14개 광역단체는 바우처택시·임차택시 같은 대체교통수단도 운영하고 있다.장애인 바우처택시는 일반택시로 영업을 하다 콜을 받으면 비휠체어 장애인을 태워 이동시켜주는 서비스로, 장애인에게 일정 횟수나 시간 이용권을 주고 지자체가 요금을 부담하는 방식으로 운영된다. 임차택시는 일반택시를 아예 일정 기간 동안 장애인 전용택시로 운용하는 방식이다. 시각장애인협회에서 회원들을 위해 운영하는 시각장애인 지원차량 운영 비용을 보조해주는 방식도 있다.바우처택시는 부산·대구·인천·강원·충남 등 10개 시·도가, 임차택시는 서울·광주·대전 등 10개 시·도가, 시각장애인 지원차량은 서울·경기 등 10개 지자체가 각각 도입해 운영 중이다.장애인콜택시와 함께 지자체 교통약자이동지원센터나 산하 시설공단, 장애인협회, 사회서비스원, 택시운송사업조합 등이 위탁운영하는 바우처택시와 임차택시의 장점은 장애인콜택시가 운행하지 않는 심야시간대 대체수단으로 구실 할 수 있다는 점이다. 부산시 택시운수과는 “장애인콜택시 법정 보급률은 낮지만 대체이동수단으로 장애인 바우처택시 1천여대를 운행하고 있다”고 했다. 경남은 지난해 12월 김해에서 시범운행을 시작한 바우처택시를 올 연말 375대까지 늘릴 예정이다.엄삼용 서울시 장애인편의증진팀장은 “장애인콜택시는 도입 첫해 대당 1억원가량이 소요돼 확대가 쉽지 않다. 민간 콜택시를 이용한 ‘장애인 바우처택시’를 도입해 예산도 절감하고 장애인콜택시 이용 대기시간도 크게 줄였다”고 전했다.전남도 여수·순천·나주·광양시와 해남군도 지난해 하반기부터 장애인 바우처콜택시 91대를 도입해 장애인들의 평균 콜 대기시간이 30분대에서 20분대로 줄어들었다. 전남장애인차별철폐연대 이창준 집행위원장은 “장애인콜택시의 경우 대기자가 많으면 2시간 정도 걸릴 때가 있다. 5개 시·군에서 비휠체어 장애인을 위한 바우처택시가 운행되면서 상황이 좀 나아지긴 했다. 다른 시·군으로 확대해야 한다”고 말했다.다만 바우처택시와 임차택시는 휠체어를 이용하는 중증장애인은 이용이 불가능하다. 문경희 세종보람장애인자립생활센터 소장은 “장애인 바우처택시는 리프트 시설을 갖추지 않은 차량이 대부분이다. 휠체어가 필요 없는 장애인에게는 대안이 될 수 있지만, 휠체어 이용자에게는 대안일 수 없다”고 말했다.제도 개선이 필요하다는 지적도 있다. 정진일 대전시민인권센터 운영위원은 “최근 코로나19로 승객이 줄어들자 택시회사들이 임차·바우처택시로 지정받아 안정적인 수입을 내고 싶어 하는 추세”라며 “그러나 장애인콜택시 대체수단으로서 필요한 교육을 하거나 시설은 갖추지 않고 요금을 더 받으려고 목적지까지 우회해 운행하고, 항의하면 해당 장애인의 콜은 받지 않는 등 문제도 적지 않아 개선이 필요하다”고 전했다.지자체마다 제각각인 교통약자 이동권 보장 수준을 전반적으로 제고하기 위해서는 중앙정부 차원의 노력이 필요하다는 목소리도 나온다. 이재민 전국장애인차별철폐연대 정책국장은 “장애인 등 교통약자 이동권은 당연히 보장돼야 할 기본권인데 지방정부 자율에 맡기다 보니 지역 간 차별 등 문제가 발생한다. 지난해 교통약자법이 개정돼 국가가 특별교통수단의 운영을 지원할 수 있게 된 만큼, 중앙정부가 더 적극적으로 나서야 한다”고 말했다.충북 청주의 인권단체 ‘인권연대 숨’의 이구원(32·가운데) 활동가가 지난달 12일 충북 오송역에서 장애인 이동권 보장을 촉구했다. 팔다리 없이 태어난 그는 저상버스, 터미널 등의 교통 장애 현실을 고발해왔다. 인권연대 숨 제공"
2,2022.04.20. 오후 6:15,"""동등한 이동권 보장을"" 부산 장애인단체, '자립생활' 정책 제안","20일 오후 부산시청 앞에서 부산지역 장애인 단체들이 장애인 자립생활 권리보장을 위한 기자회견을 열고 있다. 부산장애인자립생활센터총연합회 제공42번째 장애인의 날을 맞아 부산 장애인단체가 동등한 이동권 보장 등 내용을 담은 장애인 자립 생활 관련 정책을 부산시에 전달했다. 부산장애인자립생활센터총연합회는 20일 오후 2시 부산시청 앞에서 기자회견을 열고, ""장애인이 기본권을 보장받으며 지역사회에 참여하기 위해서는 비장애인과 동등한 기초 위에서 장애인이 원하는 삶의 형태를 스스로 결정할 수 있어야 한다""고 주장했다. 이들은 특히 장애인의 이동권 향상을 위해 여러 정책이 추진되고 있으나, 여전히 부산지역 장애인의 이동권 확보는 미흡한 실정이라고 지적했다. 이들 단체에 따르면, 지난해 기준 부산시의 저상버스 보급률은 전체의 28.9%인 728대에 불과하다. 이는 서울 66.3%, 대구 48.7%과 비교하면 크게 낮은 수치다. 운행지역도 전체 노선의 절반에 그치고 있고, 부산 장애인 콜택시 '두리발'도 206대에 불과해 지하철이나 저상버스가 없는 지역에 거주하는 장애인은 대중교통 이용에 큰 불편을 겪는 실정이다. 이들은 ""부산시는 2년 전부터 장애인 탈시설 자립 지원 5개년 계획을 추진하고 있지만, 속도는 더디고 예산도 충분히 뒷받침되지 않고 있는 실정""이라고 지적했다. 이어 ""장애인도 다른 사람들처럼 '보통의 삶'을 살아야 하지만, 아직도 비장애인 중심으로 시스템이 설계돼 있다""며 ""중증장애인이 스스로 할 수 없는 일에 대해 부산시와 정부가 적극적으로 나서야 자립생활이 가능하다""라고 덧붙였다. 이들 단체는 기자회견을 마친 뒤 장애인 이동권 확충, 중증장애인 일상생활 지원, 자립생활 지원정책 확립 등 8개 분야 21개 세부정책이 담긴 제안서를 부산시에 전달했다.※CBS노컷뉴스는 여러분의 제보로 함께 세상을 바꿉니다. 각종 비리와 부당대우, 사건사고와 미담 등 모든 얘깃거리를 알려주세요.이메일 : jebo@cbs.co.kr카카오톡 : @노컷뉴스"
