,날짜,기사제목,기사내용
0,2015.04.13. 오후 9:17,인권위 “고속버스에도 장애인 편의시설 설치” 권고,"			국가인권위원회가 지체장애인도 고속버스를 이용할 수 있도록 관련 시설을 설치해야 한다는 권고안을 의결했습니다. 인권위는 오늘 낮에 열린 제6차 전원위원회에서 ""휠체어를 타는 장애인도 시외버스와 고속버스를 안전하게 탈 수 있도록 시설과 구조를 단계적으로 갖춰야 한다""며 국가와 지방자치단체에 '교통약자 이동편의 증진계획'을 마련하라고 권고했습니다. 지난 2005년 '교통약자 이동편의 증진법'이 제정됐지만 예산 부족으로 시외버스와 고속버스 노선에는 저상버스와 휠체어 승강 설비를 전혀 도입하지 못 해 장애인들이 이용하기 어려웠습니다. 이에 대해 운수회사들은 ""버스 한 대당 수천만 원의 비용이 들고, 휴게소에 머무는 시간도 길어진다""며 인권위의 권고안을 반대했습니다.신지혜기자 (new@kbs.co.kr)▶ [취재후] 방송에서 못한 현장 이야기▶ KBS뉴스 SNS [트위터][페이스북][카카오][저작권자ⓒ KBS 무단복제-재배포 금지]		"
1,2015.04.21. 오후 10:50,[노인이 웃는 도시 부산] 2. 교통 약자 노인  -그들을 편안하게 하라,"부산진역 앞 건널목에서 신호등이 바뀌는 바람에 미처 길을 다 건너지 못한 한 노인이 도로 중간에 서서 다음 신호를 애타게 기다리고 있다.  이재찬 기자 chan@    ""아프니까 노인인데… 난폭운전에 화나고 건널목은 무섭다"" 오늘도 시청 등대 광장에 출근 도장(?)을 찍었다. 내가 이곳에 거의 매일 출근 도장을 찍다시피 한 지도 벌써 5년. 한데, 오늘은 내가 타고 온 버스 때문에 화가 치민다. 버스에 오르기 무섭게 차가 움직이는 바람에 평소 안 좋았던 허리 병이 도졌다. 승객이 자리에 앉은 후, 출발해도 될 텐데. 뭐가 그리 바쁜지. 이게 끝이 아니다. 난폭운전에 급정거까지…. '기사 양반'이라고 외치며 나무라고 싶었지만, 입에서만 맴돌았다. 말이 나온 김에 건널목 얘기도 좀 해야겠다. 도로를 건널 때 정지선을 넘어온 차들을 보면 불안하다. 때론 생명의 위협마저 느낀다. 젊은이들이야 '뭘 그럴까' 하겠지만, 천만의 말씀! 노인의 걸음걸이는 젊은 사람보다 느리다. 그렇다 보니 건널목을 중간 정도 건널 때면, 이미 파란불이 깜빡거린다. 때론 신호가 바뀌어도 건널목을 다 못 건널 때도 있다. 그땐 차들이 여지없이 빵빵거린다. 걷는 게 불편한 노인의 맘을 알기나 할까? 누군가는 '아프니까 청춘이다'라고 했지만, 정말이지 아프니까 노인이다. -김 노인의 고백교통과 관련해 노인이 겪는 불편함을 '김 노인의 고백' 형태로 재구성해 본 것이다. 김 노인의 고백을 통해 알 수 있듯이 노인이 웃는 도시, 노인이 살기 좋은 도시의 한가운데에 바로 교통이 있다.청각·시각 떨어지는 노인들 ""타고 내리는 것도 위험하고 길 건너기도 전에 신호 바뀌어 낙상 사고 골절 사고 다반사 약자 위한 교통 정책 펼쳐야""교통은 노인들의 발이다. 노인에게 교통은 바깥세상과 소통하는 문이다. 노인 인구 14%로 '고령 사회'에 진입한 부산은 이런 점을 고려해 교통 정책을 펼쳐야 한다. ■교통 편의 환경 너무 열악대중교통이 없다면, 노인들의 발이 묶인 것과 같다. 그만큼 노인들은 버스나 지하철(도시철도)을 자주 이용한다. 하지만, 노인들의 대중교통 이용 환경은 너무나 열악하다. 노인이 되면, 특히 청각이나 시각 기능이 현저히 저하되기 때문에 서로 보완 작용을 할 수 있는 안내가 이루어져야 한다. 현재 부산지역 시내버스의 경우 노선 안내 방송은 비교적 잘 이루어지고 있으나, 전자문자를 통한 안내는 이루어지지 않고 있는 실정이다. 부산시 교통국 관계자는 ""운행 중인 시내버스 2천517대 중 버스 내부 전자문자 안내는 시범 운영을 제외하곤 현재 시행되지 않고 있는 실정이다. 하지만 오는 7월부터 민자 방식을 통해 단계적으로 시스템을 구축해 나갈 방침이다""고 말했다. 버스와 인도 바닥의 높이 차이가 많은 것도 교통 약자인 노인들의 위협이 된다. 급하게 내리다 낙상사고, 발목 골절 등 다치는 경우가 종종 발생하기 때문이다. 그나마 저상버스가 이를 보완하고 있지만, 부산 시내에는 현재 51개 노선에 399대의 저상버스가 운행, 시내버스(2천517대) 대비 저상버스 보급률은 고작 15.8%에 머물고 있다. 지하철 역시 위험하거나 불편한 게 한둘이 아니다. 지하철에 엘리베이터가 있다고 해도 개찰구에서 너무 멀리 떨어져 있어 이용하기에 불편한 곳도 많다. 부산시에 따르면 부산지역 지하철 내 엘리베이터는 2015년 4월 현재 285대, 에스컬레이터는 239대가 설치돼 있다. 잔여 시간 표시가 없는 건널목 신호등도 노인의 통행을 불안하게 하는 요인이다. 부산 시내 8천844개 건널목 보행등 중 잔여 시간이 표시(도형형, 숫자형 등)되는 신호등은 2천318개로 26% 수준이다. 이렇다 보니 노인들은 교통사고에 무방비로 노출돼 있다. 2010년부터 2014년까지 부산지역에서 교통사고로 사망한 노인의 수는 매년 70명 안팎이다. 지난해 부산의 교통사고 사망자 185명 중 37.8%인 70명이 65세 이상 노인이었다.■'어르신' 위한 교통 정책 어떤 게2010년 기준 부산시의 교통 약자는 81만여 명으로 전체 부산시 인구의 22.5%에 달한다. 하지만 노인, 장애인, 어린이 등 교통 약자를 위한 부산시의 교통 정책은 너무나 미흡한 실정이다. 교통 약자를 위한 부산시의 정책으로는 2006년 10월 처음 도입된 '두리발'을 비롯해 '장애인 콜택시 운영', '교통 약자를 위한 저상버스 운영'이 고작이다.부산복지개발원 초의수 원장은 ""교통 약자를 위한 시의 지원서비스가 절대적으로 부족하다. 이에 대한 이해 자체가 잘 안 돼 있는 것 같다""고 꼬집었다. 나아가 초 원장은 ""노인이 집에 있으면 오히려 국가적으로 요양비 부담이 늘어난다. 따라서 일부 지자체에서 시행하는 '택시이용권'과 같은 제도를 활용해 노인의 이동권을 보장하는 방안을 찾아야 한다""고 충고했다. 고령자에 대한 체계적인 교통안전 교육도 필수적이다. 버스를 타면, '내리실 때는 버스가 정류소에 완전히 정차한 후 자리에서 일어나서 안전하게 내려달라'는 안내 문구가 걸려 있지만, 이를 따르는 승객은 거의 찾기 힘들다. 백(74) 모 씨는 ""승객이 내리고 타기 무섭게 곧바로 버스가 출발하기 때문이다. 행동이 느린 노인들의 마음은 심리적으로 불안해지고 더 조급할 수밖에 없다""고 말했다. 부산시 교통국 관계자는 ""노인을 위한 운전과 안전 교육을 강화하고, 시민 점검단을 구성해 노인 등 시민이 만족하는 교통수단이 되도록 유도해 나가겠다""고 말했다.정달식·김상훈 기자 dosol@busan.com※ 이 기사는 부산시 지역신문발전지원 사업의 지원을 받아 취재했습니다."
2,2015.04.16. 오전 11:35,"서울시, 지하철 250원·버스 150원 인상 추진(종합)","서울시 대중교통 요금이 이르면 6월부터 최대 300원 오를 예정이다. 7일 서울시 도시교통본부는 시내버스 요금을 150원~200원, 지하철 요금을 200원~300원 인상하는 방안을 다음 주 발표, 시의회에 제출할 계획이다. 사진은 이날 오후 서울역 버스환승센터 모습. 2015.4.7/뉴스1 © News1 유승관 기자서울시의회에 의견청취안 제출…물가委 등 거쳐 6월말 인상 예정(서울=뉴스1) 차윤주 기자,고유선 기자,정혜아 기자 = 서울시가 지하철과 버스요금을 각각 250원, 150원 인상하는 방안을 추진한다. 서울시는 16일 이런 내용을 담은 '대중교통 요금조정을 위한 의견청취안'을 서울시의회에 제출했다고 밝혔다. 안건이 시의회 본회의와 버스정책시민위원회·물가대책심의위원회를 거쳐 확정되면 대중교통 요금은 6월말부터 각각 1300원과 1200원으로 인상된다. 지하철과 버스요금이 각 150원씩 올랐던 2012년2월 이후 3년4개월 만의 요금 인상이다.  시는 요금 인상에 대해 상대적으로 낮은 요금 수준과 서비스 질 향상을 위한 것이라고 설명했다. 서울 대중교통 요금은 현행 1050원으로 부산(1200원), 대구·대전·광주(1100원) 보다 낮다. 서울 지하철 요금은 외국과 소득수준(GDP)을 비교해도 런던(약 3560원), 뉴욕(약 2729원) 보다 1.27~2.24배 저렴하다. 시는 요금조정 요인을 분석해 우선 지하철 250원, 버스 150원을 상향하는 첫번째 안을 추진하겠다고 밝혔다. 시의회 등과 조율을 거쳐 지하철, 버스를 각각 200원, 150원을 인상하는 두 번째 안이 채택될 수도 있다.  서울 지하철 요금은 2007년 이후 버스와 동일한 요금 수준을 유지해왔다. 이번에는 원가 차이(지하철 1185원/인당, 버스 928원/인당)와 노후 전동차 등 시설투자를 위해 차등 인상을 택했다. 또한 지하철 거리 추가운임을 현재 40㎞ 초과 시 10㎞당 100원에서 50㎞ 초과 시 8㎞당 100원으로 조정하기로 했다. 요금 조정안에 따라 광역버스는 1850원→2300원, 순환버스 850원→1100원, 심야버스 1850원→2200원, 마을버스 750원→850원으로 오르게 된다.  시는 현실적으로 안전·서비스분야를 개선하고 원가를 보전하며 누적적자를 해소하기 위해서는 지하철은 508원, 버스는 296원의 요금 인상이 필요하나 시민 부담을 최소화하기 위해 현재 74% 수준인 원가보전율(운송원가 대비 요금 수준)을 85%으로 개선하는 선에서 조정안을 확정지었다고 설명했다. 나머지 부족한 부분은 운송업계의 자구노력과 시의 재정투입을 통해 개선할 예정이다.  어린이와 청소년 요금은 경제여건을 고려해 동결하기로 했다. 어린이는 현금 할증을 폐지해 교통카드·현금 동일한 요금을 부과한다. 청소년은 버스 이용시 신분확인 등으로 인한 운행지연·사고 등을 예방하기 위해 교통카드를 사용해야 할인요금을 적용받을 수 있다.  시는 오전 6시30분 전에 카드를 태그한 승객은 기본요금의 20%를 할인해주는 조조할인을 도입한다. 조조할인 적용시 지하철은 1040원, 버스는 960원에 이용할 수 있다. 수도권 지하철과 서울 버스, 경기 광역버스에 우선 시행하고 경기·인천 버스 등으로 조조할인제도를 확대하는 방안을 검토하고 있다.  서울 거주 65세 이상 영주권을 가진 외국 출생 노인(2014년 8월 기준 2181명)도 요금조정 후부터는 내국인과 똑같이 지하철 무임승차가 가능해진다. 시는 운송기관의 자구노력으로 원가를 절감하고 2018년까지 총 4015억원을 투입해 전체 지하철 역사에 엘리베이터, 화장실을 확충하는 등 대중교통 서비스를 향상시키겠다고 밝혔다. 버스는 LED 조명 설치, 차내 공기질 개선, 저상·전기버스 등 차량고급화에 297억원의 예산을 투입할 계획이다. 시는 수도권 대중교통 요금 조정을 위해 지난해부터 경기도·인천시·수도권 철도운영기관(코레일·서울메트로·서울도시철도공사·인천지하철 등)과 10여 차례 협의를 진행했고 지난 1일 인상률 안을 확정했다. 정효성 행정1부시장은 ""그동안 시민 부담을 고려해 요금 조정을 미뤄왔으나 안전과 서비스 분야 재투자를 위해서는 인상이 불가피하다""며 ""서울 지하철과 버스가 시민의 기대에 부응하는 안전과 서비스 수준을 갖출 수 있도록 최선을 다하겠다""고 말했다.   서울 대중교통 요금(교통카드 사용 기준)은 2004년 7월 650원에서 800원으로, 2007년4월 900원, 2012년 2월 1050원으로 150~200원씩 올랐다. 김경호 도시교통본부장은 이번 조정안의 인상폭(지하철 250원, 버스 150원)이 크다는 지적에 대해 ""새로 도입하는 조조할인, 청소년·어린이 요금동결 등을 감안하면 실질 인상률은 16.7% 수준으로 과거 인상폭과 비슷하다""며 ""요금조정을 정례화할 경우 시민들의 정책 수용성이 높아질 수 있어 2년마다 정례적으로 요금을 올리는 방안도 검토하고 있다""고 전했다. 지하철 만성적자를 유발하는 노인 무임승차 문제에 대해선 ""국가적인 복지사업으로 시행하는 것이라 정부 지원이 필요하다""며 ""정부가 코레일에는 무임승차 적자분을 지원하는 만큼 서울시도 마찬가지 지원을 받아야 하는데 기획재정부에서 꿈쩍하지 않고 있다""고 어려움을 호소했다.chacha@[© 뉴스1코리아(news1.kr), 무단 전재 및 재배포 금지]"
3,2015.04.19. 오후 8:34,아찔한 순간의 연속 '험난한 외출'…270만 장애인의 현실,"			[뉴스데스크]◀ 앵커 ▶ 그런데요, 이 뉴스를 접하면서 여행은커녕 대중교통을 타고 그냥 이동하는 것도 쉽지 않다는 장애인들 많을 겁니다.얼마나 불편할지 저희 이정민 기자가 직접 체험해 봤습니다.◀ 리포트 ▶ 휠체어를 타니 작은 장애물도 혼자 힘으로 넘기가 쉽지 않습니다. 속도가 빨라지는 내리막길에선 손에 땀이 납니다.이번엔 눈을 가린 채 지팡이 하나에 의지하려니 발을 떼기조차 쉽지 않습니다.""올라가야 돼요?""발을 헛디디거나 인도가 아닌 차도로 돌진하는 아찔한 상황들이 속출합니다.도로 안내석이나 휠체어 전용통로 등이 턱없이 부족하기 때문입니다.기자들에겐 잠깐의 체험이었지만 270만 장애인들에겐 매일의 현실입니다.[장희진/지체장애인 ]""저상버스 같은 경우는 운전하시는 분들께서 사용법을 모르셔서 못 내려주시는 경우가 있고…""복지부가 장애인 3만 9천 가구를 조사한 결과 교통수단 이용에 불편을 호소한 경우는 3년 전보다 오히려 더 늘었습니다.'버스나 택시 같은 대중교통을 이용하는 게 불편하다'는 의견이 61%로 가장 많았습니다. '지하철의 엘리베이터 등 편의시설이 부족하다'(17.2%), '장애인 전용 교통수단이 부족하다'(14.3%)는 의견이 뒤를 이었습니다.불편한 이동여건 외에도 일반인의 절반 수준인 낮은 취업률도 장애인의 자립을 더욱 어렵게 하는 것으로 조사됐습니다.MBC뉴스 이정민입니다.(이정민 기자 aquarhee@mbc.co.kr)[저작권자(c) MBC (www.imnews.com) 무단복제-재배포 금지]		"
4,2015.04.08. 오후 10:53,[노인이 웃는 도시 부산] 1. 노인들의 수다-청년 못지않은 부산 노인이 입을 여니…,"지난 3일 부산시노인종합복지관에서 '노인들의 수다'가 열렸다. 왼쪽부터 문승숙, 권흥순, 류충근, 황창수, 이영애, 류정근, 이수귀 씨. 김경현 기자 view@    ""노인이 이해가 안 간다고? 니 늙어 봤나, 나는 젊어도 봤다"" 궁금했다. '노인이 살기 좋은 도시'에 대한 어르신들의 속마음은 어떨지.지난 3일 부산시노인종합복지관 2층 회의실에서 '노인들의 수다'가 열렸다. 노인이 편안하고 행복하게 살 수 있는 도시에 대한 '날 것 그대로'의 생각을 엿볼 수 있었다.""소변 참기 힘든데 공중화장실 적어 급정거 잦고 승·하차 위험한 버스 제발 노인들 좀 배려해 줬으면…"" ""먹고살기 바빴던 게 우리 노인들 소통 기술 배우고 몸 관리 잘 해서 이제 '노인 짓' 아닌 '어른 짓' 해야""이날 권흥순(72·여), 류정근(72), 류충근(67), 문승숙(81·여), 황창수(68) 씨와 노인 관련 활동을 활발하게 펼치는 이수귀(63·여), 이영애(59·여) 씨가 수다에 참석했다. 김수영 경성대 사회복지학과 교수가 사회를 맡았다.-젊은 세대와 소통하기 위해 뭐가 필요한가황창수=지하철 경로석을 없애야지. 경로석이 따로 있어 젊은 애들과 얘기할 수가 없어. 좌석 중간에 경로석 만들면 젊은 애들과 편하게 얘기할 수 있잖아.류충근=경로석 없애는 데 찬성! 경로석을 중간에 둔다면 노인들도 깨끗이 씻고 몸 관리 잘할 거야. 고령자의 권리만이 아니라 의무도 중요하지. 물론, 젊은이들 인성 교육도 강화해야 하고.이영애=노인이 신체·정신적·사회적으로 건강해야 합니다. 노인이 같은 노인은 물론 아이들도 배려해야 존경받아요.문승숙=골목에 쓰레기 보면 내가 주워. 복지관 마당에도 컵이나 휴지가 많아. 내가 다니면서 쓰레기통에 넣지. 나이 든 사람이 먼저 나서야 해.류정근=우리가 '노인 짓'이 아닌 '어른 짓'을 해야지. 솔직히 우리 세대는 협력과 소통에 대한 교육을 못 받았지. 먹고 살기 바빴어. 노인들이 고집이 있고 남의 말을 잘 안 듣지.이수귀=노인들도 젊은이들의 눈높이에 맞춰 대화해야 합니다. 상대방을 존중하면서 소통하는 기술을 갖춰야 해요.-일상에서 불편한 점은이수귀=연세 드신 분들은 문턱에 걸려 넘어지는 경우가 많아요. 그 충격으로 대퇴골에 탈 나면 큰일입니다. 기존 아파트의 문턱을 없애고 화장실도 노인 친화적으로 바꿔야 합니다. 노인분들 잘 미끄러지기 때문에 손잡이도 있어야 합니다.류정근=걷는 것을 좋아해 밖에 자주 나가는 편이지. 그런데 공중화장실이 부족해. 사회가 나이 많은 사람들의 불편을 잘 몰라. 나이가 들면서 소변 참기가 쉽지 않아.황창수=노인 건강을 위해 운동 공간이나 쌈지공원이 많아졌으면 해. 노인들이 젊은 시절 서서 일하는 경우 많아서 하지정맥류를 많이 앓고 있어. 그런데 건강보험 적용이 안돼 치료비가 수백만 원에 달해. 보험혜택이 필요해.-교통여건에 대한 의견은이영애=버스와 인도 사이의 높이를 줄여야 해요. 버스가 인도와 많이 떨어져서 정차하면 노인들이 힘들어합니다. 저상 버스면 괜찮은데 그렇지 않을 경우 높이 차이가 커요. 노인들이 급하게 내리다 다치는 경우가 있어요. 이수귀=버스 기사들이 급정거하는 경우가 많아요. 물론 시간에 쫓기는 것을 알지만, 노인을 위해 좀 더 부드럽게 운전해줬으면 해요. 류정근=횡단보도 신호등 표시를 보면 시간이 나오는 게 있고 깜빡깜빡하는 게 있지. 어떤 것은 한참 있다가 빨간 불로 바뀌고, 또 어떤 것은 깜빡깜빡하다가 바로 빨간불로 바뀌지. 뭐가 맞는지 헷갈려. 통일하면 좋겠어.류충근=신호대기 때 멈췄다가 파란불이 되기도 전에 슬금슬금 움직이는 차들이 있어. 아찔해. 황창수=지하철 무료 연령을 70세로 올리는 것은 괜찮아. 유료화에는 반대야. 지하철 돈 받으면 노인들 발 묶는 거야. 노인들이 여기저기 다니면 건강해져. 의료비 줄어드니까 국가에도 도움이 돼.권흥순=노인들 지하철 유료는 나도 반대야. 노인을 이해하지 못하는 사람들에게 해주고 싶은 말이 있어. 니 늙어봤나. 나는 젊어도 봤다.-노인 일자리·사회참여에 대한 생각은황창수=2년간 식약청 실버 불량식품 감시요원으로 활동했어. 잘 몰라서 복지 혜택을 못 받는 사람이 많더라고. 부정수급자 적발도 중요하지만, 혜택을 꼭 받아야 할 사람을 찾는 것도 중요해. 복지사들 일손이 부족하니까 이 일을 노인들에게 맡긴다면 일자리 창출이지.류충근=한국노후생애설계전문가협회를 월회비 1만 5천 원을 받고 운영하고 있어. 회원 수가 120명에 달해. 노인 일자리 수행기관 지정을 받으려고 하는데 잘 안되네. 행정기관에서 전례가 없다고 하네. 노인들이 스스로 책임 다하면서 봉사하려는 취지를 몰라줘서 섭섭해.이수귀=노인들은 많은 돈을 원하지 않아요. 지역사회 참여·봉사를 통해 아직도 사회에 뭔가 역할을 할 수 있다는 점이 중요하죠.정달식·김상훈 기자 neato@busan.com"
5,2015.04.20. 오전 8:17,"오늘은 '장애인의 날'…""외출 여전히 불편하다""","			[뉴스투데이]◀ 앵커 ▶우리나라 사람들 20명 중 한 명은 몸이 불편한 장애인이라고 합니다.오늘은 장애인의 날인데요.장애인 복지가 나아졌다고 생각하기 쉽지만 아직까지 외출조차도 마음 편히 하지 못하는 장애인들이 많습니다.김나리 기자입니다.◀ 리포트 ▶휠체어를 타니 작은 장애물도 혼자 힘으로 넘기가 쉽지 않고, 속도가 빨라지는 내리막길에선 손에 땀이 납니다.눈을 가린 채 지팡이 하나에 의지하려니 발을 떼기조차 쉽지 않고, 발을 헛디디거나 인도가 아닌 차도로 돌진하는 아찔한 상황들이 속출합니다.도로 안내석이나 휠체어 전용통로 등이 턱없이 부족하기 때문입니다.270만 장애인들에겐 매일의 현실입니다.[장희진/지체장애인 ] ""저상버스 같은 경우는 운전하시는 분들께서 사용법을 모르셔서 못 내려주시는 경우가 있고…""복지부가 장애인 3만 9천 가구를 조사한 결과 교통수단 이용에 불편을 호소한 경우는 3년 전보다 오히려 더 늘었습니다.'버스나 택시 같은 대중교통을 이용하는 게 불편하다'는 의견이 61%로 가장 많았습니다.한편 보건복지부는 오늘 장애인의 날을 맞아 서울 여의도 63빌딩에서 장애인과 가족 등 500여 명이 참석한 가운데 기념식을 개최합니다.기념식에선 장애의 한계를 극복하고 장애인 인식 개선에 기여한 공로로 유공자 16명을 선정해 포상할 계획입니다. MBC뉴스 김나리입니다.(김나리 기자 narikim@mbc.co.kr)[저작권자(c) MBC (www.imnews.com) 무단복제-재배포 금지]		"
6,2015.04.08. 오후 2:13,"장애인단체 ""市, 이동권보장·생활지원체계 마련해야""","			【광주=뉴시스】신대희 기자 = 광주장애인철폐연대가 장애인의 이동권 보장과 발달장애인들이 자립할 수 있는 지원 체계를 마련해줄 것을 광주시에 촉구했다.    장애인철폐연대는 8일 오전 광주시청 앞에서 기자회견을 열고 ""광주시는 올해 저상버스 156대를 운행해야 하지만 117대에 불과하다""며 ""장애인들의 이동권 보장을 위해 30대를 추가 도입해야 한다""고 주장했다.  또 ""부족한 장애인 콜택시는 배차 지연 등의 민원이 급증하고 있다""며 ""장애인 콜택시 증차 등을 논의할 간담회를 정기적으로 개최해야 한다""고 강조했다.  이들은 ""발달장애인의 가족들이 삶을 포기하는 사건이 끊이질 않고 있다""며 ""시는 공약으로 내세운 '장애아동·발달장애인지원센터'를 조기 설립하고 구체적인 지원 방안을 제시하라""고 요구했다.  이어 ""시는 예산 축소 등의 이유로 장애인종합지원센터를 복지재단 내 장애인 지원팀으로 축소하려 한다""며  ""체계적 지원이 가능한 센터 설치 계획을 마련해야 한다""고 덧붙였다. sdhdream@newsis.com★ 뉴시스 뉴스, 이젠 네이버 뉴스 스탠드에서도 만나세요★ 손 안에서 보는 세상, 모바일 뉴시스<저작권자ⓒ 공감언론 뉴시스통신사. 무단전재-재배포 금지.>"
