,날짜,기사제목,기사내용
0,2016.04.19. 오전 11:31,이동편의증진법 10년…오지 않는 '저상버스',"2006년 제정된 교통약자이요편의증진법 불구 저상버스 도입률 낮고, 지하철역 통행 불편, 장애인콜택시 태부족...장애인단체 ""법 개정해 의무화해야"" 촉구 휠체어를 탄 장애인. 아시아경제DB[아시아경제 김봉수 기자, 문제원 수습기자, 김민영 수습기자] 2006년 교통약자이용편의증진법(이동편의증진법)이 시행된 지 10년이 지났지만 여전히 장애인, 노약자 등 교통약자들의 이동권이 외면받고 있다. 저상버스 도입률은 저조하고, 지하철역도 휠체어가 다닐 수 없는 곳이 수두룩하다. 장애인콜택시도 숫자가 턱없이 부족해 한시간 가까이 기다리기 일쑤다. 장애인단체들은 대책 마련을 촉구하고 있지만 정부ㆍ지방자치단체 등은 여전히 예산을 핑계로 뜨뜻미지근한 반응을 보이고 있다.19일 장애인단체, 서울시, 국토교통부 등에 따르면, 전국 시내버스 중 저상버스의 비율은 2015년말 기준 20.7%에 불과하다. 정부는 2012년 제2차 교통약자 이동편의 증진계획을 세워 올해까지 저상버스 비율을 41.5%로  높이겠다고 했지만 목표의 절반에도 못 미치는 수치다. 이동편의증진법은 시행령을 통해 광역시ㆍ특별시는 시내버스의 2분의1 이상, 시ㆍ군은 3분의1 이상을 저상버스로 운행하도록 해놓긴 했다. 하지만 이는 버스운송사업자의 면허 우선순위와 관련된 조항일 뿐 강제 사항이 아니어서 실제 시내버스 사업자들은 저상버스 도입을 꺼리는 경우가 대부분이다. 특히 먼 곳을 오가는 광역버스, 시외ㆍ고속버스 등에는 단 한 대의 저상버스도 없다. 현재 경기도~서울간 휠체어리프트가 구비된 저상버스가 시범운영 중이긴 하지만 수동 휠체어에 맞게 설계돼 요즘 대부분의 장애인들이 이용하는 전동 휠체어를 타고서는 탑승하기가 몹시 불편하다.이에 따라 장애인 단체들은 법을 개정해 시내버스의 100% 저상버스화, 시외ㆍ고속ㆍ마을버스의 저상버스 도입 등을 의무화해야 한다고 요구하고 있다. 이정훈 전국장애인차별철폐연대 정책국장은 ""장애인들은 시외버스나 고속버스를 아예 탈 수가 없다고 보면 된다""며 ""국토부에 여러번 요구했지만 연비나 안전 문제로 안 된다는 얘기만 들었을 뿐""이라고 말했다. 그는 ""누워서 갈 수 있는 항공기급 프리미엄 고속 버스를 운행한다면서 장애인들을 위한 저상버스는 안전이 문제라며 확충을 꺼린다는 것은 말이 안 된다""고 지적했다. 이와 관련 이권환 국토부 교통안전복지과 사무관은 ""시외버스와 고속버스의 저상버스는 현재 연구개발 중이며 내년부터 다시 3년 동안 연구를 해 2019년부터는 시범운영이 가능하도록 할 계획""이라고 말했다. 지하철도 장애인들에게는 '도심 속 밀림'이다. 지난해 기준 서울시내 지하철역 307개 가운데 엘리베이터 미설치 등으로 휠체어를 제대로 사용할 수 없는 역은 37개에 달한다. 서울시는 이중 14개 역에 2017년까지 엘리베이터를 설치할 예정이지만, 구조 상 설치에 어려움이 있는 23개 역은 내부구조 변경, 주변 건물ㆍ토지 매입, 신기술 도입 등 2022년까지 대안을 마련한다는 계획이다. 지하철 전동 리프트도 사고의 위험성이 커 장애인들이 이용을 꺼리고 있다. 실제 2002년 서울 지하철 5호선 한 역에서 전동 리프트 사용 중 고장으로 인해 장애인 이용자가 사망했고, 2006년에도 인천 지하철 한 역에서 전동 리프트 추락하는 사고가 발생했다. 장애인콜택시 확충도 시급한 과제다. 정부는 2010년부터 일반인들의 택시 이용 빈도수와 동일하게 각 지자체 별로 1ㆍ2급 중증 장애인 200명당 1대 수준으로 장애인콜택시를 운영하도록 하고 있다. 현재 대부분 지자체들이 이 기준을 충족하고 있긴 하다. 그러나 장애인들은 턱없이 부족하다는 입장이다. 이용 예약은 접수가 시작되자 마자 10분도 안 돼 마감되는 게 보통이고, 몇 시간 전에 전화해도 대기 순번이 10~20번 대 이후로 밀리는 경우가 대부분이다. 해당 지역 외에 타 지역으로 이동하지 못하는 것도 단점으로 지적된다.이에 대해 이 국장은 ""현재 서울과 경남 등 법정 도입대수를 달성한 지역에서도 장애인의 대기 시간의 문제가 해소되지 않아 법정 기준을 초과해 도입하고 있는 실정""이라며 ""이용 대상 장애인 100명당 1대로 도입 기준을 대폭 늘려야 한다""고 말했다. 김봉수 기자 bskim@asiae.co.kr문제원 수습기자 nest2639@asiae.co.kr김민영 수습기자 mykim@asiae.co.kr▶ ""밥은 먹고 다니니?"" 혼밥족을 위한 아시아경제 '나홀로 요리 공모전'▶ 아시아경제 제휴, 무료 민간자격증 취득 이벤트<ⓒ세계를 보는 창 경제를 보는 눈, 아시아경제 무단전재 배포금지>"
1,2016.04.20. 오전 11:30,[장애인의 날 ‘서글픈 현실’] 운전교육에만 한달 이상 대기…면허증 따는 길 곳곳이 ‘장애물’,"			“양쪽 귀가 전혀 들리지 않는데, 그래도 운전을 할 수 있을까요?” 운전을 하고 싶었지만 청각장애 때문에 망설이기만 했다는 조용선(38ㆍ여) 씨의 질문에 상담사는 “소리가 들리지 않는다는 스티커만 차에 붙이면 2종 면허도 딸 수 있으니 걱정하지 마세요”라며 자신감을 불어 넣어줬다. 수화로 십여분간 이어진 조용한 대화 후 조 씨의 얼굴에는 화색이 돌았다. 장애인들의 이동권이 최대 관심을 모으고 있는 가운데, 최근 서울 영등포구 여의도공원에서 열린 한 체험행사에서 사람들이 특수 차량을 둘러보고 직접 체험도 하고 있다.20일 장애인의 날을 맞아 지난 18일 관련 행사인 ‘함께서울 누리축제’가 열린 서울 영등포구 여의도공원은 각종 체험부스를 찾은 장애인과 보호자들로 붐볐다. 공원 한켠엔 장애인 시설 마크가 붙은 승합차와 버스가 가득했다. 공원 한복판에서 장애인들을 위한 법률상담부터 공공후견인 신청과 같은 상담 창구와 함께 각종 생활 복지 체험관을 비롯한 20여개 부스는 오후 내내 손님들로 꽉 찼다.그 중에서도 단연코 가장 큰 인기를 끈 곳은 장애인들의 ‘이동권’과 관련된 부스였다. 20여개 부스 중 장애인 이동권과 관련된 부스만 다섯 곳이었다. 교통면허 기능시험 상담 부스에서 일하는 봉사자들은 끊이지 않고 찾아오는 방문객들로 인해 눈코 뜰 새 없이 바빴다. 실제 교통면허 시험용 특수차량을 직접 체험해볼 수 있도록 구성된 곳에선 이를 체험해보려는 사람들로 장사진을 이뤘다. 시승용 차량에는 다리가 불편한 이용객을 위해 손으로 작동하는 가속페달, 오른손만으로도 모든 조작이 가능한 특수 레버 등 다양한 편의 장치가 설치됐다.그러나 일부 상담객들은 아쉬운 표정으로 돌아가기도 했다. 면허를 따기도 어렵지만 운전교육을 받기 위해서는 한 달 이상 기다려야 한다는 대답 때문이었다. 전국에 장애인용 특수차량이 구비된 교육장이 서울 강서장애인지원센터를 비롯해 용인, 부산, 광주 등 네 곳 뿐인데, 지원자는 많다보니 대기자가 늘어나고 있다는 것이 이신재 도로교통공단 강서장애인지원센터장의 설명이다.서울 강동구에 사는 박선화(55ㆍ여) 씨도 “남편이 오른손을 잘 쓰지 못하는데 운전면허 교육을 받을 곳이 없어 항상 대신 운전해왔다”며 “이 차라면 남편도 운전을 할 수 있겠지만, 운전교육만 한달 이상 대기해야 한다니 속상하다”고 했다.장애인들의 여행을 지원한다는 사단법인 ‘그린라이트’가 마련한 장애인 여행 지원 부스도 방문객들의 눈길을 받았다. 전동 휠체어를 실을 수 있도록 개조한 승합차를 시운전하자 관람객들은 가던 길을 멈추고 구경하기도 했다. 장애인 방문객들은 진행 요원을 붙잡고 이것저것 문의하며 여행 지원 신청서를 작성하기도 했다. 두 다리가 불편해 휠체어를 타고 온 김병욱(49) 씨는 “여행을 가려면 어쩔 수 없이 장애인 콜택시를 대절해야 하는데, 서울 시내에서도 2시간 이상 걸릴 때가 많고 대절은 더 어렵다”며 “출퇴근길에 항상 만원인 저상버스는 엄두도 못 낸다”고 했다. 그는 “이 단체 역시 한달에 다섯 가족 밖에 지원해주지 못한다고 해서 일단 신청부터 했다”고 했다. 무료로 차량과 기사, 유류비까지 지원해 장애인들의 관심은 높았지만 역시 수요에 비해 공급은 턱없이 부족했다. 주최 측도 “2012년부터 시작해 약 2만명을 지원했지만 일정이 빠듯해 가까운 곳으로 여행가는 경우가 많다”며 “전국에서 거의 유일하다보니 대기자가 너무 많아 우리도 안타깝다”고 했다.장애인들의 이동권이 최대 관심을 모으고 있는 가운데, 한 체험행사에서 사람들이 특수 차량을 둘러보고 직접 체험도 하고 있다.행사장에서는 이들 부스 뿐만 아니라, 장애인용 특수 LPG차량 구매 상담, 전동 휠체어 관련 상담 부스 등 이동권과 관련된 부스에 사람들이 몰렸다. 그러나 높은 수요에 비해 현실은 녹록치 않다. 작년 한해 동안 강서에서 장애인 운전면허에 도전한 사람은 45명으로 이중 28명만이 면허를 딸 수 있었다. 이 센터장은 “다양한 장애 유형에 맞는 차량을 수배할 수 없어 교육을 중도 포기하는 경우도 많다”며 “현재 용인에 특수차량이 한대 있는데, 우리도 어떤 장애 유형에 맞는 차량을 구입해야 할지 고민하느라 시간이 지체되고 있다”고 했다. 행사를 기획한 서울특별시 지체장애인 협회 관계자도 “장애인들도 편하게 이동하고자 하는 욕구가 상당한데, 실상은 너무 힘들다”며 “생각보다 많은 장애인들이 기본적인 이동권조차 보호받지 못하고 있다”고 말했다. 유오상 기자/osyoo@heraldcorp.com▶ 새누리당 100% 몰표 진주갑…선관위 결국 재검표▶ 전경련-어버이연합‘후원금’의혹 확산▶ 중학생 6명, 여중생 불러내 고시원서 집단 성폭행 ‘충격’[글로벌 인재들의 필수 역량, SKEC 영어글쓰기대회] [주니어 영어 신문의 가장 효율적인 학습 서비스][헤럴드경제] [SUPERICH] [REAL FOODS] [헤럴드증권방송] [HOOC]- Copyrights ⓒ 헤럴드경제 & heraldbiz.com, 무단 전재 및 재배포 금지 -		"
2,2016.04.16. 오전 7:31,"'노선 적고 배차 길고'…광주저상버스 ""불편해요""","【광주=뉴시스】신대희 기자 = 뇌병변 1급 장애인 윤정표(33)씨가 15일 오후 광주 북구 효동초교 정류장에서 광주장애우권익문제연구소 활동가들과 저상버스 승·하차 환경 점검을 벌이고 있다. 2016.04.15. sdhdream@newsis.com휠체어 탑승 어려운 정류장도 있어 출·퇴근시간대 저상버스 이용 불가   1일 평균 휠체어장애인 2명만 이용 【광주=뉴시스】신대희 기자 = ""저상버스는 노선이 적고, 배차 시간도 들쭉날쭉이예요. 장애인을 위한 대중교통 정책 마련이 시급합니다.""   지난 15일 오후 2시 광주 동구 충장로 충장치안센터 시내버스정류장. 전동휠체어를 탄 뇌병변 1급 장애인 윤정표(33)씨와 고명진(30·여)씨가 광주장애우권익문제연구소 활동가들과 저상버스 승·하차 환경 점검에 나섰다.  이들은 7번 저상버스를 타고 북구 효동초교 정류장에 내린 뒤 27번으로 갈아 타 북구 두암주공 정류장까지 이동하는 경로를 택했다. 윤씨와 고씨는 정류장에서 7번 일반버스 4대를 보냈다. 30분쯤 지나 7번 저상버스가 정류장 뒤편에 멈췄다. 【광주=뉴시스】신대희 기자 = 광주장애우권익문제연구소 활동가들과 저상버스 승·하차 환경 점검에 나선 뇌병변 1급 장애인 고명진(30·여)씨가 15일 오후 7번 버스를 타고 광주 북구 효동초교 정류장으로 이동하고 있다. 2016.04.15. sdhdream@newsis.com 승객들이 탑승한 뒤 활동가들이 달려가 버스 운전기사에게 장애인들의 승차를 요청했다. 이어 저상버스 뒷문에서 리프트가 도로로 내려왔다.  윤씨와 고씨가 버스에 오르는 과정에 승객들과 뒤섞이면서 정차한 지 6분이 지나서야 자리를 잡았다. 이들은 곡선도로 등지에서 휠체어가 쏠리는 현상을 막으려고 장애인탑승구 옆 의자를 손으로 잡은 채 이동했다. 버스가 급제동할 때면 윤씨의 휠체어는 어김없이 앞으로 쏠려 불안불안한 상황이 이어졌다. 장애인 탑승구에 안전벨트가 마련돼 있지만, 운전기사나 다른 승객의 도움 없이는 착용할 수 없기 때문이다. 오후 3시께 효동초교 정류장에 내린 이들은 환승을 하기 위해 다음 노선인 북구차량등록민원실 정류장까지 이동했다. 27번 저상버스를 타기까지는 다시 15분을 기다려야 했다. 하지만 이번엔 인도가 문제였다. 정류장 앞 인도의 턱이 높아 탑승이 불가능했다. 결국 버스가 정류장 옆 영화관 주차장 출입구 쪽으로 후진한 뒤 리프트를 내렸고, 윤씨 등은 30m 가량 이동하고서야 버스에 오를 수 있었다. 활동가들은 ""휠체어를 탄 장애인들이 버스에 승·하차할 수 없는 정류장이 서구 버들마을 등 곳곳에 있다""고 설명했다. 노선마다 저상버스 대수가 달라 배차 시간이 들쭉날쭉하고 출·퇴근 시간에는 이용이 어려운 것도 문제다. 실제 고씨는 지난 12일 오전 7시40분께 일터인 농성동 장애인자립생활센터까지 출근하기 위해 자신의 집 인근 광주대입구 정류장에서 저상버스를 기다렸지만 붐비는 탑승객들로 버스 3대를 보낸 바 있다.  퇴근시간대에도 저상버스 이용이 어려워 장애인콜택시를 부르지만 평균 2~3시간이 지나서야 오곤 한다. 출·퇴근이 1~2시간 가량 늦어지는 셈이다. 【광주=뉴시스】신대희 기자 = 뇌병변 1급 장애인 윤정표(33)씨와 고명진(30·여)씨가 15일 오후 광주 북구차량등록민원실 정류장에서 광주장애우권익문제연구소 활동가들과 저상버스 승·하차 환경 점검을 벌이고 있다.    이 정류장은 인도의 턱이 높아 탑승이 불가능했다. 결국 버스가 정류장 옆 영화관 주차장 출입구 쪽으로 후진한 뒤 리프트를 내렸고 윤씨 등이 30m 가량 이동, 버스에 오를 수 있었다. 2016.04.15. sdhdream@newsis.com 모든 노선에 저상버스가 있는 것도 아니다. 광주시내 98개 노선 중 29개만 저상버스가 운영 중이며 보급률도 낮은 편이다. 전체 998대의 버스 중 166대(약 17％)가 저상버스다.  저상버스를 타도 환승 구간에 갈아탈 버스가 없으면 발이 묶이는 상황이 벌어지곤 한다. 야간과 비가 오는 날에는 버스가 휠체어를 탄 장애인들을 못 보고 지나치는 경우도 더러 있다.   미흡한 시스템은 저조한 이용률로 이어지고 있다. 광주시가 지난 1월23일부터 2월5일까지 시내버스 회사 10곳을 상대로 확인한 결과 2주 동안 장애인 29명(하루 평균 2명)만 이용한 것으로 조사됐다. 고씨는 16일 ""저상버스의 노선과 대수가 적어서 배차시간이 길고, 버스 내 안전시설도 부족하다""며 ""일반벨보다 오랜 시간 작동되는 장애인용 하차벨이 작동되지 않는 버스도 많고, 중증장애인을 못 보고 지나치는 경우도 상당하다. 30분 안에 해야 하는 무료 환승도 못 할 때가 태반""이라고 지적했다.   이어 ""정류장에 기사분들이 잘 볼 수 있는 장애인 전용 탑승구가 설치돼야 한다""며 ""저상버스 보급 확대와 휠체어 승·하차가 불편한 버스정류장 시설 개선 등을 통해 교통 약자를 배려하는 정책을 펼쳐 달라""고 요구했다.  이에 광주시 관계자는 ""예산 부족과 버스회사와의 조율, 도로 여건 등 다양한 요인으로 저상버스 보급이 부족한 게 사실""이라며 ""도로 연석 등 정류장 시설물 전수조사 용역 결과가 올해 말쯤 나올 예정이다. 저상버스 운전기사 교육과 장애인 이동패턴 분석 작업을 진행 중""이라고 말했다.   또 ""관련법에 따라 12월까지 저상버스 도입률을 40％까지 높이기 위한 정책을 추진하고, 노선조정 등을 할 계획""이라며 ""교통약자 이동 편의 증진에 힘쓰겠다""고 덧붙였다.  sdhdream@newsis.com★ 세상에 이런일이 -  관악 여중생 모텔살해범 2심서 ´징역30년→40년´ ★ 오늘의 핫 포토 -  심은하, 국회의원 사모님 됐다 ★ 뉴시스 뉴스, 이젠 네이버 뉴스 스탠드에서도 만나세요★ 손 안에서 보는 세상, 모바일 뉴시스<저작권자ⓒ 공감언론 뉴시스통신사. 무단전재-재배포 금지.>"
3,2016.04.20. 오전 8:51,[라이브 이슈] 제36회 장애인의 날…여전히 높은 차별의 벽,"			[라이브 이슈] 제36회 장애인의 날…여전히 높은 차별의 벽 <출연 : 연합뉴스TV 사회부 이소영 기자>[앵커]오늘은 서른여섯번째 장애인의 날입니다. 우리나라도 지난 1981년부터 장애인의 날을 기념하고, 장애인 권리 증진을 위해 노력하겠다고 선언한 바 있는데요. 현재 상황은 어떨까요?사회부 이소영 기자와 이야기 나눠보겠습니다.이소영 기자. 그간 관련 보도를 많이 해 오셨는데요. 현재 우리나라의 장애인 권리는 어떤 수준인가요?[기자] 네. '아직 갈 길이 너무나 멀다'는 게 대체적인 평가입니다. 서울 지하철 광화문역에 가 보시면 천막과 함께 수많은 영정 사진을 보실 수 있을텐데요. 모두 사망한 장애인들입니다. 안타까운 사연을 몇 가지 설명해드리겠습니다.한 분은 심야시간 호흡보조기가 고장나면서 목숨을 잃었습니다. 국가에서 활동보조인 서비스를 제공하지만 시간이 정해져있다보니, 보조인이 퇴근한 시간에는 이 분을 도울 사람이 없었던 겁니다.다른 한 분은 화재로 숨졌습니다. 3급 장애가 있던 분인데 이 경우는 활동보조서비스 지원 대상이 아니었거든요.집에 불이 났는데 대피를 도와줄 사람이 없어서 미처 빠져나오지 못했습니다.장애인 관련 단체들은 장애 유형과 관계없이 일괄적으로 등급을 매기고 그에 따라 보조 서비스를 제한하는 장애등급제가 이런 죽음을 낳았다고 말하는데요. 시정을 요구하며 노숙농성을 시작한 것이 2012년부터인데도 아직 끝내지 못하고 있습니다.[앵커]정말 안타깝습니다. [기자]이뿐만이 아닙니다. 휠체어를 탄 장애인들은 명절에 고향에조차 갈 수 없습니다. 저상버스가 많이 들어왔지만 아직 시외버스에는 도입되지 않았거든요. 기술이 이렇게 발달한 시대에, 차를 탈 수 없어서 고향에 갈 수 없는 사람들이 있다는 것. 안타까운 일일 수밖에 없습니다. [앵커]각 지자체에서 장애인 콜택시를 운용하고 있는 것으로 아는데, 이것만으로는 부족한가요?[기자] 네, 장애인 콜택시가 있지만 이조차도 아직 부족한 상황인데요.우선 수 자체가 턱없이 부족하다보니 대기 시간이 30분을 훌쩍 넘어갑니다. 그나마도 제가 작년에 취재를 했을 때는 평균 대기시간이 58분이었는데 올해는 개선이 된 부분이고요. 서울은 그래도 나은 편인지만 지방의 경우 차가 부족해 대기시간이 더 긴데다, 장애인 콜택시인데도 휠체어를 싣지 못할 정도로 시설이 열악한 곳도 있다고 합니다.[앵커] 그렇군요. 그 외에도 일상에서 겪는 다른 불편들이 많다고요?[기자]네, 비장애인들이 일상생활에서 당연하다고 여기는 부분이 장애인들에게는 꿈같은 일이 되곤 합니다. 일례로 제가 지난해 지적했던 모바일 금융ㆍ결제 시스템에 대해 말씀드리자면요. 스마트폰 도입 이후 많은 분들이 은행 업무를 휴대전화로 하실 겁니다. 이 서비스를 처음 이용할 때나 30만원 이상의 돈을 보낼 때는 반드시 본인인증을 해야하거든요. 그런데 이 인증이 음성 ARS로 진행됩니다. 걸려오는 전화를 받아 거기서 불러주는 번호를 듣고 입력해야 하는데, 이렇게되면 청각장애인분들은 전혀 이용하실 수가 없는거죠.보도 이후 '보이는 ARS'같은 개선책이 나왔는데요. 점차 사용자가 확대되고 있는 네이버 페이, 카카오페이 같은 서비스에 가입하거나 비밀번호 찾기를 하려 할 때는 여전히 음성ARS만 지원되고요. 그 외 예를 들어 신용카드를 잃어버렸다거나 할 때 전화로 정지 신청을 하셔야하는데, 이 경우 청각장애인들은 철저히 소외되고 있습니다.기술은 새로운데 거기에 담긴 정신은 전혀 발전하지 못한 겁니다.[앵커] 아직까지 장애인이 여러 측면에서 고려되지 못하고 있는 것 같습니다.[기자]네, 그렇습니다. 사회적 인식이 부족하기 때문인데요. 장애인차별금지법이 도입된 지 8년이 지났는데 그간 인권위에 접수된 장애 관련 진정은 8천건이 넘을 정도로 차별은 여전히 심각한 수준입니다.차별이 일상적이다보니 경제활동에도 지장을 받을 수밖에 없습니다. 최근 나온 연구결과를 보면 우리나라 전체 인구 중 경제활동을 하는 사람은 10명 중 7명꼴인데, 장애인의 경우는 5~6명에에 불과한데요.장애인의 경우 임금 수준까지 낮다보니 저소득층으로 전락하고, 계속해서 사회에서 소외되는 악순환이 일어날 가능성도 높습니다. 심지어 이번 20대 국회에서는 장애를 가진 비례대표는 1명에 불과해 장애인들의 목소리를 반영시킬 자리가 더욱 줄어들었다는 평가입니다. [앵커] 사회적, 경제적, 정치적 차별까지 정말 아직 갈 길이 먼 것 같습니다. 인식의 변화가 최우선이 돼야할 것 같은데 방법이 있을까요?[기자]장애인이 거쳐야하는 문턱이 얼마나 높냐, 이것이 우리 사회의 수준을 보여주는 척도입니다. 장애는 사실 누구에게나 올 수 있습니다. 갑자기 사고가 날 수도 있지만 나이가 들어서 혹은 일시적으로 다리가 부러진다거나 할 수도 있는 것이고요. 장애인이 생활하기 어려운 사회는 노인과 어린아이같은 약자, 그리고 사실 우리 모두에게 불편한 곳이나 마찬가지입니다. 장애인이 맞닥뜨린 사회적 장벽을 낮추는 것은 단순한 '배려'의 문제가 아니라 모두가 불편을 겪지 않는 사회를 만드는 첫 걸음이라는 것을 기억하셨으면 좋겠습니다. 연합뉴스TV : 02-398-4409(제보) 4441(기사문의), 카톡/라인 jebo23(끝)▶ [핫클릭] '담배 사기 어렵게' 서초구 판매점간 거리 100m로 확대▶ [핫클릭]'성희롱은 성범죄 아니다?' 처벌 사각지대, 피해자 두 번 울려▶ [영상] 4월 건보료 폭탄…직장인 절반, 평균 13만원 더 낸다<저작권자(c) 연합뉴스, 무단 전재-재배포 금지>"
