,날짜,기사제목,기사내용
0,2021.11.28. 오후 7:21,주민발안 첫 조례 될까,"[서울 말고] 권영란 | 진주 <지역쓰담> 대표자동차를 두고, 오늘은 시내버스를 탄다. 차량이 붐비는 도심이 목적지일 때는 시내버스를 이용하는 게 훨씬 낫다. 다행히 오르내리기 쉬운 저상버스이다. 버스기사의 눈인사를 받으며 교통카드를 찍는다. 출퇴근 시간이 아니어서 좌석은 여유 있고 쉽게 자리를 잡는다. 적당한 난방으로 시내버스 안은 따뜻하다. 버스기사는 정거장마다 승객을 조심스럽게 태우고는 기분 좋게 달린다. 이미 눈치챘겠지만 이건 현실이 아니다. 시내버스가 ‘착한 이동수단’이었음 하는 바람이다.진주시 시내버스는 아직 준공영제가 아니다. 시는 현재의 제도로 충분하다는 입장이다. 그럴 리가? 진주 지역도 여느 지역과 다름없이 시내버스 이용자가 점점 줄고 있다. 버스업체는 운영난을 내세워 업체끼리 노선 경쟁을 벌이고 버스기사들을 열악한 노동환경으로 내몬다. 버스기사는 빡빡한 운행 시간을 맞추느라 서둘러 달린다. 교통카드를 찍자마자 출발하는 버스에서 승객은 휘청대며 손잡이를 찾는다. 시내버스는 불편하고, 안전하지 않다. ‘착한 이동수단’이 아니다.진주에는 4개의 시내버스 업체가 있다. 2021년 진주시는 표준운송원가에 따라 시내버스 업체에 223억5천만원을 지원했다. 시내버스의 공공성 보장을 위해 버스업체의 적자 일부를 보전해주고 있는 셈이다. 진주 시내버스 주 이용자인 학생 수는 줄어드는데 지원 금액은 최근 6년 새 점점 늘어나 3배나 증가했다. 더 납득이 되지 않는 것은 세금 수백억원을 지원하는데 진주시는 정산 및 관리·감독을 전혀 하지 않는다. 진주시 소관이 아니란다. 그 결과 개별 버스업체에서 지원금을 어떻게 쓰든 상관이 없다는 식이 되었다.현행 시내버스 준공영제는 표준운송원가제도를 따르고 있다. 버스 한대가 하루 운행하는 데 드는 비용을 인건비, 정비비, 연료비 등 항목별로 산정해서 사후 자치단체가 부족액을 보전해주는 제도이다. 물론 자치단체가 정산 등 관리·감독을 한다. 진주시도 표준운송원가제도를 시행한 지 4년이 넘었다. 하지만 현재 진주시에는 이와 관련된 조례가 없다. 시내버스 활성화 방안을 찾으려고 시민들이 노선 운영 등 전수조사를 하고 시민 설문조사를 했다. 결과분석을 들고 시장 면담을 여러차례 요청했지만 응하지 않는다. 시의원들도 꿈쩍 안 한다. 이유를 알 길 없으니, 시민들은 버스업체 사주가 진주시장 집안 어른이어서 그렇다는 설에 심증이 굳어진다.사정이 이러니 시민들이 직접 나설 수밖에 없다. 지난 5일부터 ‘진주시 시내버스 준공영제 운영 조례 발안’을 위한 서명운동을 시작했다. 법이 없으니 한마디로 ‘시민이 법을 만들자’는 것이다. 주민조례발의는 1999년부터 지방자치법에 따라 운영되어왔으나 청구 요건인 주민 연서 수가 지나치게 많고 청구 절차가 복잡해 그동안 활용이 저조했다. 다행히 9월28일 주민조례발안법 제정안이 통과돼 요건이 한결 수월해졌다. 전자서명도 가능해졌다. 진주시 주민조례발안은 4200여명의 서명을 받으면 성립된다.시민들이 마련한 조례안을 보면, 먼저 지원금 산정과 정산 등을 총괄적으로 심의하고 의결하는 준공영제운영위원회를 구성한다. 투명하고 효율적인 지원금 관리를 위해서 수익금을 공동 관리하고, 지원금을 항목별로 정산해서 목적에 맞지 않는 지출에 대해서는 전액 환수한다. 서비스 개선을 위한 기사 교육과 차량 점검을 강화하는 등 대부분의 조항이 지난 10월 국토교통부가 발표한 ‘시내버스 준공영제 운영 가이드라인’에 기초했다.현재 주민발안에 시민 호응이 꽤 높다. 지역 현실이 그리 녹록지 않음을 알면서 바람을 건다. ‘시내버스 준공영제 운영 조례’가 진주시 주민발안 첫 조례가 될 수 있기를.		"
1,2021.11.14. 오전 9:35,"""저상버스 보급률 30%뿐""…뿔난 장애인들 ""이동권 보장하라""","12일 오후 서울 여의도 이룸센터 앞 전국장애인차별철폐연대 집회 현장 /사진=조성준 기자중증 장애인들과 장애인 권리보장 활동가들이 대중교통 시설에 장애인의 이동권을 보장해달라며 단체행동에 나섰다. 전국장애인차별철폐연대(전장연)는 지난 12일 오후 서울 여의도 이룸센터  앞에서 '장애인이동권 보장과 서울시 장애인권리예산 쟁취 결의대회'를 열었다. 이날 시위에는 휠체어를 탄 장애인 등 시민 300여명이 가슴 위에 시위 문구가 적힌 스티커나 피켓을 들고 투쟁을 외쳤다. 이들은 △교통약자이동편의증진법과 장애인평생교육법 연내 개정 △장애인탈시설지원법 연내 제정 △2022년 장애인권리 예산 쟁취 등을 촉구했다.  이들은 장애인의 이동권이 편의 문제를 넘어 교육, 노동 등 기본권과 직결된다며 국가가 장애인 이동권을 보장해야 한다고 주장했다. 시위에 참가한 한 관계자는 ""저상버스 도입은 여전히 더디고 (있던 저상버스마저) 폐차 시 계단버스로 회귀하는 경우가 있다""고 말했다. 또 저상버스나 리프트가 있는 SUV택시 차량 등의 보급률이 지역별로 큰 차이를 보이고 있다고 지적했다. 전장연에 따르면 현재 서울은 보급률이 85.1%인 반면 인천은 57.3%에 그친다. 전장연 등에 따르면 2001년 1월 오이도역 휠체어 리프트 추락 참사를 계기로 저상버스 도입 등 성과가 있었지만 여전히 보급률은 30% 미만에 그치고 있다. 이들은 장애인 교육권 보장이나 탈 시설 문제 해결에 대한 논의 자체가 부족하다고 했다.  전장연 관계자는 머니투데이와의 통화에서 ""정치권에서는 장애인과 관련한 지원은 기본권이 아닌 복지혜택으로 접근하고 있다""며 ""국가 총예산에서 장애인 정책은 여력이 되면 제공하는 수준에 그친다""고 했다. 이어 ""교통약자이동편의증진법 발의 후 20년이 지났지만 인식이 변하지 않고 있다""고 토로했다.김예원 변호사(장애인권법센터 대표)도 ""정책 결정에서 장애인을 동등한 수준으로 보지 않는 것이 문제""라며 ""정책 결정을 위한 간담회에서 울분이 있고 스스로 말하기 어려운 당사자들이 아닌, 대학 교수처럼 말이 잘 통하는 사람만 초대해 형식적인 의견수렴에 그친다""고 했다. 그러면서  ""이 사회가 장애인을 비장애인과 동등한 권리주체로 보고 있는지 돌아 봐야 한다""며 ""그들이 투쟁할 수밖에 없는 현실을 봐달라""고 강조했다.이날 시위에선 한때 시민단체와 경찰이 대치하기도 했다. 국회의사당 1번 출구 유리 구조물 위에 장애인 권리보장 활동가 4명이 올라가는 등 돌발 상황이 벌어졌다.  현장 경찰관은 ""내려와달라""며 참가자들을 말렸다. 또 이번 시위로 오후 한 때 일대 교통이 마비되며 일부 운전자들이 불만을 토로했다. "
2,2021.11.10. 오후 2:55,주차장에 세워놓기만 하면 '무선충전'...미래형 무선충전버스 '올레브' 운행 현장 가보니 [현장에서],"			[경향신문] 지난 8일 오전 대전 유성구 카이스트(KAIST) 북문 앞에서 무선 충전 전기버스 ‘올레브’의 충전이 진행되고 있다. 주차장에 버스를 세워놓기만 하면 무선으로 자동 충전된다. 윤희일 선임기자시내버스는 비가 주룩주룩 내리는 주차장에 그냥 서 있기만 했다. 버스가 서 있는 주차장에는 노란색 선으로 그려진 직사각형의 구역이 있을 뿐이다. 그 안에 ‘OLEV’라는 문구가 적혀 있다. “지금 충전 중입니다. 선이 하나도 없지만, 무선으로 충전이 되고 있는 거예요.”지난 8일 오전 11시 대전 유성구 카이스트(KAIST) 북문에 있는 버스 정류장. 무선충전 전기버스 ‘올레브(On-Line Electronic Vehicle)’의 시점이자 종점으로 쓰고 있는 곳이다. ‘특구1’이라는 번호판을 달고 대덕특구일대를 순환하는 버스가 주차해 있는 상태에서 충전을 하고 있었다.대전시 관계자는 “카이스트가 대용량 전기에너지를 무선으로 안전하게 전달할 수 있는 기술(자기공진형상화 기술)을 개발했고, 이 기술을 이용한 시내버스를 제작해 운행하고 있는 것”이라고 설명했다. 올레브의 크기는 일반 시내버스보다 약간 작은 30인승이다. 이 버스는 지난 8월24일부터 승객을 태우고 하루 24차례 운행하고 있다. 카이스트를 출발해 대덕특구 일대에 있는 연구소~DCC(대전컨벤션센터)~도시철도 월평·유성온천·구암 등을 경유해 다시 카이스트로 올아온다. 요금은 일반버스와 같은 1250원이고, 무료 환승도 가능하다. 버스정류장의 바닥(주차장)에는 무선충전기의 송신부가 매설돼 있고, 전기버스에는 무선충전장치의 ‘수신부’가 설치돼 있다. 아무런 선이 없지만 차가 서 있거나 진출입할 때 무선으로 충전이 이루어진다.  유선충전 방식과 달리 별도의 충전시설이나 연결부품(커넥터)이 없어도 동시에 여러 대의 버스를 충전할 수 있는 것이 강점이다. 대전시 관계자는 “전력공급선이 땅 속에 매설되기 때문에 안전성이 높고 부지를 효율적으로 활용할 수 있는 것도 좋은 점”이라고 설명했다.이 무선충전 전기버스는 1시간에 150㎾를 충전해 150㎞를 주행할 수 있지만, 현대 대덕특구 순환노선에서는 버스기사의 휴게시간인 20분 동안 50㎾를 충전한 뒤 23.5㎞를  달린다. 대전시 과학산업과 강영옥씨는 “앞서 개발돼 카이스트 내 셔틀버스나 경북 구미시 일부 구간에 투입된 적이 있는 무선충전 전기버스에 비해 기술이 대폭 향상된 최첨단 무선충전 전기버스”라고 설명했다.   운행 중인 버스에 타봤다. 승객이나 운전기사 모두 만족한다는 표정이었다.  내부시설은 다른 저상버스(바닥이 낮은 버스)와 크게 다를 것이 없었지만, 전기차 특유의 정숙성이 우수했다. 정차했다가 다시 출발할 때는 물론 주행할 때도 소음이 적고 부드러웠다. 버스에 탄 한 학생(23)은 “대덕특구일대를 순환하는 노선이어서 버스 노선이 부족한 이 지역 주민들이 애용하는 것 같다”면서 “환경에 좋다는 점이 무엇보다 마음에 든다”고 말했다. 운전기사 김서경씨는 “충전이 너무 간편하고, 시·종점을 비롯한 모든 노선에서 배기가스가 발생하지 않으니까 쾌적하게 일을 할 수 있어 좋다”면서 “운전경력이 30년을 넘었는데 이런 최첨단 버스를 몰게 돼 영광”이라고 말했다. 현재 대전운수 소속 운전기사 8명이 교대로 3대의 무선충전 전기버스를 운전하고 있다. 대전시 관계자는 “올레브의 운행은 대한민국의 핵심성장동력인 대덕특구에서 개발된 무선충전기술을 실증화하는 사업이라는 점에서 큰 의미가 크다”면서 “2년간의 시범운행을 통해 기술적 측면과 시민 편의성 등을 검증한 뒤 이 버스의 확대운행 여부를 결정할 예정”이라고 말했다.		"
3,2021.11.04. 오후 5:27,휠체어 장애인은 거리에서 손 흔들어 택시 잡고 싶다,"‘모두를 위한 택시’ 토론회장애인콜택시 지자체마다 이용규정 달라국민 30% 교통약자 포괄하는 택시 도입 필요휠체어 장애인이 이용가능한 영국 택시 블랙캡. 런던 교통국 누리집 갈무리“장애인단체가 지하철이나 버스에서 휠체어를 탈 수 있게 해달라고 시위를 하면 ‘장애인 콜택시 있잖아, 그거 타’라고 욕을 먹곤 한다. 그러나 장애인 콜택시는 숫자가 적고, 여러 제약이 있다. 무엇보다 (장애인의 이동권을) 권리가 아닌 시혜적인 차원에서 보고 있다는 게 문제다.”(홍윤희 협동조합 무의 이사장)4일 오전 서울 여의도 한국장애인단체총연맹에서 장애인과 비장애인이 함께 탈 수 있는 ‘모두를 위한 택시서비스’ 도입을 논의하는 토론회가 열렸다. 협동조합 무의, 한국장애인단체총연맹, 법무법인 디라이트, 이용빈·장경태·진성준·최혜영 더불어민주당 의원이 공동으로 주최했다. 토론회 참석자들은 미국이나 영국 등 외국처럼 휠체어도, 유아차도 실을 수 있는 설비를 갖춘 택시의 도입이 필요하다고 주장했다. 휠체어를 탄 장애인뿐 아니라 유아차를 탄 영유아와 동반자, 고령자, 임산부, 일시적으로 목발을 짚거나 거동이 불편한 이들 등 교통약자는 전체 인구의 30%를 차지한다. 그러나 교통약자를 위한 대중교통수단은 부족하다. 지하철은 대도시에만 있고, 타인의 도움 없이 엘리베이터를 이용해 하나의 동선으로 이동하기 어렵다. 휠체어 탑승자를 위한 저상버스와 고속버스도 보급률이 낮다. 일반 택시는 트렁크에 엘피지(LPG)가스통이 실려 있어 휠체어를 싣기 어렵다. 장애인 콜택시가 있지만, 토론회 참석자들은 교통약자를 위한 교통수단으로 한계가 있다고 입을 모았다. 장애인 콜택시는 지자체마다 운영방식이 달라 즉시 이용이 가능한 곳도 있지만 이용 신청 이후 2주 이상 기다려야 하는 곳도 있다. 지역별로 운행시간과 요금도 다르며, 지역 간 이동도 일부 제한된다. 음주 후 탑승하는 것도 금지되며, 동반자와의 탑승이 필수다. 이용하려면 장애인 증명서, 복지카드 사본과 주민등록증, 직업과 소득, 가족 형태 등의 개인정보가 담긴 서류를 제출하고 2년마다 갱신을 해야 한다.참석자들은 장애인과 교통약자가 자유롭게 이용할 수 있는 택시가 필요하다고 주장했다. 홍윤희 협동조합 무의 이사장은 “휠체어를 타는 외국인 지인이 있다. 한국 배우를 좋아해 7번이나 한국에 왔지만 왜 휠체어가 탑승 가능한 택시를 길에서 잡을 수 없냐고 의문을 표하더라”고 말했다. 온라인 생중계로 진행된 토론회의 댓글 창에도 “ 나이 드신 어머님 모시고 병원 가기 너무 어렵다 . 다양한 형태의 교통수단이 있어 선택하여 이용할 수 있으면 좋겠다”는 글이 올라왔다. 장애인 콜택시. <한겨레> 자료사진토론회 참석자들은 ‘장애인도 거리에서 손만 흔들면 편하게 잡을 수 있는 택시’를 도입하기 위해 법을 개정하고 택시 사업자들을 지원하는 제도가 도입돼야 한다고 제안했다. 배융호 한국환경건축연구원 이사는 교통약자법에서 정의하는 교통수단에 ‘택시’를 신설하고 휠체어 탑승 설비 등을 장착한 택시를 정부의 ‘교통약자 이동편의 증진계획’에 추가해야 한다고 주장했다. 또한 교통약자가 사용하는 택시와 관련된 사업에는 정부 재정을 지원할 수 있는 조항을 추가해야 한다고 제언했다. 홍 이사장은 미국 뉴욕의 경우 플랫폼택시 사업자에게 휠체어가 들어갈 수 있는 운송수단을 갖추고, 해당 수단이 뉴욕 내 어디서든 15∼30분 이내에 도착할 수 있는 비중을 80∼90%로 늘리도록 하고 있다고 설명했다.토론회에 참석한 김민정 국토교통부 사무관은 “이동 약자에 대한 복지 서비스와 모빌리티 산업을 어떻게 결합할까 국토교통부에서 지속해서 고민 중이다”고 말했다. 4일 서울 여의도 한국장애인단체총연맹에서 장애인 등 교통약자가 이용할 수 있는 ‘모두를 위한 택시서비스’ 개선 방안 마련 토론회가 열렸다. 협동조합 무의 제공"
4,2021.11.18. 오후 6:01,"""요소수대란, 친환경車 인식 계기... 전기차 늘리고 인프라 구축 박차"" [인터뷰]","여장권 서울시 교통기획관서울시, 2040년 100% 전환 목표상습정체 동부간선도로 개선키로  '요소수 대란'이 진정 국면으로 접어들고 있다고는 하지만 요소수 부족 현상 장기화나 재발에 대한 걱정은 여전히 남아 있다. 때문에 주목을 받는 분야가 친환경 교통수단이다. 온실가스를 내뿜고 요소수가 들어가야 하는 디젤 차량 대신 전기차 또는 수소차로 빠르게 전환돼야 한다는 인식이 시민들 사이에서도 번지고 있는 것이다.   여장권 서울시 교통기획관(사진)도 ""'요소수 대란'은 친환경 차량에 대한 인식을 구체적으로 느끼는 계기가 됐을 것""이라고 밝혔다.   여 기획관은 ""요소수 없이 운행이 불가한 디젤 차량의 한계와 이로 인해 시내버스나 마을버스 등 교통수단, 청소차량, 택배 등 물류 서비스가 벽에 부딪히게 됐다""며 ""지금까지 친환경 차량에 대한 인식이 기후변화나 탄소 배출 등 좀 피상적인 부분에 머물렀다면 이번 ('요소수 대란'으로) 구체화됐다""고 설명했다.   이에 서울시도 대중교통을 중심으로 친환경 차량 도입과 인프라 구축에 박차를 가하겠다는 방침이다. 우선 시내버스의 경우 오는 2030년까지 100% 전기버스로 전환한다는 목표다. 현재도 차량교체 시 친환경 저상버스 도입을 의무화하고 있다. 택시도 오는 2040년까지 100% 친환경차 전환을 목표로 한다.   여 기획관은 ""서울시의 교통 수송 분담률은 지하철 41.6%, 버스 24.0%，승용차 24.5%, 택시 5.7% 순이다. 시민 이동의 대부분이 대중교통을 통해 이뤄지고 있는 만큼 친환경 교통 체계의 재빠른 완성을 위해서는 대중교통부터의 전환이 필수적""이라며 ""특히 버스는 하루 평균 229㎞, 택시는 사업자에 따라 200~400㎞까지 주행하고 있어 친환경차 교체 시 효과가 매우 높다""고 지적했다.   그는 ""전세버스, 화물차 등 민간 수송 분야에서는 아직 경유차가 약 90% 이상으로 절대적인 비중을 차지하고 있다""며 ""수송 업계의 친환경차 전환을 위해서는 차량 선택 시 필수 요소인 1회 충전 주행거리와 배터리 안전성, 출력 등 기술력 제고가 충족돼야 할 것으로 보인다""고 덧붙였다.   또 여 기획관은 대중교통이나 수송에 수소 차량 도입이 중요하다고 강조했다. 서울시는 수소버스 등 수소 차량 도입과 충전 인프라 구축에 적극 나서고 있지만 해당 지역 주민들의 반대 등으로 사업의 속도가 늦어지고 있다.   여 기획관은 ""수소 충전소가 폭발할 수 있다는 우려에 지역 주민들이 반대의 목소리를 내는 경우가 있다""며 ""서울시가 안전하게 관리하는 만큼 주민들도 수소 충전소에 관대하게 생각해줬으면 좋겠다""고 전했다.   더불어 친환경 중심의 교통 확충을 위해 차량 흐름을 조절하는 교통 개선대책도 중요하다고 지적했다. 원활한 교통흐름을 유지해 공회전으로 인한 매연발생을 막음으로써 탄소 감축을 이루어낼 수 있기 때문이다. 지난달 13일 오세훈 서울시장도 서울시의 대표적인 상습 정체구간 중 하나로 꼽히는 동부간선도로를 방문해 도봉 지하차도 개통 이후 도로 진출입이 더욱 어려워졌다며 개선을 주문한 바 있다.   여 기획관은 ""동부간선도로 교통상황은 서울시 도시교통실 차원에서 꾸준히 관심을 갖고 지켜보는 사항으로 교통체증 개선을 위해 차로 추가, 우회동선 확보, 진출입 램프 신설 등의 조치가 이뤄지고 있다""고 말했다.   coddy@fnnews.com 예병정 기자		"
