,날짜,기사제목,기사내용
26,2019.02.18. 오전 12:52,[조달청 입찰정보]주간 신기술 용역·물품구매,"			조달청은 이번 한 주 동안 국세청의 '빅데이터 시스템 구축사업' 등 253건, 2063억원 상당의 신기술·서비스 용역과 국가보훈처의 '국가유공자 명패 제작 구매사업' 등 139건, 678억원 상당의 물품구매 입찰을 집행한다.신기술·서비스 용역에서 국세청의 '빅데이터 시스템 구축사업'은 176억1700만원 규모로, 협상계약을 통해 오는 20일 개찰한다.또 한국교육학술정보원의 '차세대 지방교육 행·재정 통합시스템 인프라 구축사업'과 행정안전부의 'GIS 기반 통합상황관리시스템 구축사업'은 각각 745억3000만원, 73억1000만원 규모로 진행된다.물품구매로는 국가보훈처의 '국가유공자 명패 제작 구매사업'이 56억7900만원 규모로 협상계약을 통해 오는 22일 개찰한다. 또 한국정보화진흥원의 '학교 스마트 단말 도입사업(3차)'이 128억4800만원 규모로 협상계약으로 집행된다.지역별로 대전 소재 본청(807억원), 대구지방청(144억원) 등 2개 청이 전체 금액의 68.0%를 차지하며, 부산 등 10개 지방청은 805억원을 각각 집행한다.<신기술 용역·물품구매 입찰내역>  (단위 : 100만원)No사업명수요기관명추정가격개찰예정일계약방법분야1시흥은계 지구외 고속도로 방음시설(레미콘) 구매한국토지주택공사  광명시흥사업본부1032019/02/18적격심사물품2학교 스마트 단말 도입사업(3차)한국정보화진흥원12,8482019/02/19협상계약“37,8호선 장암역 등 43역 2기지 정보통신기계실 축전지 제작구매 설치서울교통공사2,509“적격심사“4부산명지 행복주택 건설공사 1공구PHC파일 및 이음철물 구매한국토지주택공사 부산울산지역본부1,705“적격심사“5아산탕정 2-A5BL 아파트 전기공사승강기 구매한국토지주택공사 대전충남지역본부1,152“적격심사“6증산빗물펌프장 배수펌프 제작구매 서울특별시 은평구846“적격심사“7국립과천과학관 과학탐구관 전시품제작 설치 및 개선사업과학기술정보통신부 국립과천과학관2,7392019/02/20협상계약“8포항신항 제4부두 개축공사(4차)레미콘(25-35-120 삼성분계) 구매해양수산부 포항지방해양수산청542“적격심사“9태양광 재활용센터 용융용해 시스템구매재단법인 충북테크노파크1,2752019/02/21규격가격“10국가유공자 명패 제작 구매국가보훈처5,6792019/02/22협상계약“11IMO 차세대 해양안전종합관리체계운영시스템 구축 용역한국해양과학기술원 부설 선박해양플랜트연구소9,473 2019/02/19협상계약용역122019년 전자소송 등 전자지불대행서비스 사업대법원2,721 “협상계약“132019년 SGIS 스마트플랫폼 구축(2단계) 구축사업통계청2,633 “협상계약“14빅데이터 시스템 구축사업국세청17,617 2019/02/20협상계약“15GIS기반 통합상황관리시스템 구축행정안전부7,310 “협상계약“16문화재청 정보시스템 유지관리 및운영위탁사업문화재청3,608 2019/02/21협상계약“17차세대 지방교육행재정통합시스템인프라 구축한국교육학술정보원74,530 2019/02/22협상계약“18세종특별자치시  장애인형 국민체육센터 및 시민운동장 건립사업 감독 권한대행 등 CM세종특별자치시2,436 2019/02/19PQ“19영화진흥위원회 사옥 건립공사건설사업관리용역(감독권한대행)영화진흥위원회1,773 2019/02/20PQ“20한강본류 단위유역 유역하수도정비계획 변경수립 용역환경부 한강유역환경청1,100 2019/02/22PQ“ 디지털타임스 홈페이지 바로가기 / 디지털타임스 뉴스 더보기네이버 채널에서 '디지털타임스'를 구독해주세요."
27,2019.02.10. 오후 7:27,[독자광장] 에스컬레이터에서 뛰지 말아야,"			부산 도시철도를 이용할 때마다 에스컬레이터를 자주 탄다. ‘에스컬레이터에서는 걷거나 뛰지 마십다’라는 방송이 나오지만, 방송에 아랑곳하지 않고 걷거나 뛰는 사람들을 볼 때마다 눈살을 찌푸리게 된다.물론 시간에 쫓겨 뛰는 심정은 이해되지만, 이 때문에 일반인은 물론 노인들까지도 덩달아 걷거나 뛰고 있다.에스컬레이터를 무리하게 이용하다보니 고장이 나서 수리하는 모습이 종종 볼 수 있다. 이럴 때마다 부득이 노인들과 장애인들은 어쩔 수 없이 계단을 이용해야만 한다. 부산교통공사는 에스컬레이터를 안전하게 이용 방법에 대해 좀 더 시민들에게 홍보해 사고와 파손을 막아야 한다. 이동일·부산 동래구 아시아드대로"
28,2019.02.26. 오전 11:15,4.4억명 무임승차 손실 정부 보전…서울시 등 6개 지자체 공동 대응,"			[머니투데이 김경환 기자] [서울시,“2020년 무임승차 손실 국비확보 총력”]지하철을 이용하는 시민들 전경/사진=뉴스1서울시를 비롯해 도시지하철을 운영하는 부산, 대구,인천, 광주, 대전 6개 광역지방자치단체가 무임승차 손실에 대한 중앙정부의 보전을 끌어내기 위한 공동 대응에 나섰다.이들 6개 지자체는 22일 '전국 도시철도 운영 지자체 협의회'를 개최하고 △2020년 정부예산 확보 △국비보전 근거인 도시철도법 개정안 통과 △토론해 개최 등 대시민 홍보 방안에 대해 집중 논의하고, 회의 결과를 반영해 올해에도 공동 대응전략을 마련해 추진하겠다고 26일 밝혔다. 협의회는 지난 2017년 정부로부터 법정 무임승차 손실에 대한 보전을 이끌어 내기 위해 구성됐으며, 현재 정기 또는 수시회의를 개최하는 동시에 협의회를 통해 6개 지자체가 공동으로 국회와 정부를 설득하기 위해 다방면으로 노력하고 있다.대표적인 교통복지 제도인 지하철 무임승차는 1984년 5월 22일 대통령의 지시에 따라 도입된 노인 무임승차를 시작으로 장애인, 유공자를 대상으로 확대됐으며, 올해로 35년째 시행되고 있다. 무임승차제도는 노인, 장애인, 유공자들의 이동권을 보장함으로써 그들의 활동을 유도하여 건강을 증진하고 경제를 활성화 하는 등 큰 사회적 편익을 유발하고 있다.그간 급격한 고령화와 도시철도 노선의 광역화, 정부의 유공자 보훈정책 강화 등으로 법정 무임승차자가 급증한 결과, 2017년 전국 도시철도 법정 무임승차자는 4억4000만명에 달하며 그에 따른 운임손실도 5925억원에 달했다. 계속되는 고령화 추세로 무임승차자는 더욱 늘어날 전망이다.하지만 낮은 운임 수준 등으로 인해 전국 7개 도시철도 운영기관은 매년 약 9000억원 수준의 적자가 발생(2017년 1조347억원)하고 있어 재정난은 날로 심각해지고 있다.2017년 기준 전국 도시철도 법정 무임승차 손실은 전국 7개 도시철도 운영기관 적자의 약 57% 수준으로, 법정 무임승차가 도시철도 운영기관들의 운영적자에 큰 영향을 미치고 있음을 알 수 있다.더욱이 서울과 부산의 도시철도는 개통한지 30여년이 지나 선로, 전동차 등 시설들이 내구연한을 경과하여 막대한 재원을 투입하여 이를 교체해야 하나, 계속된 적자로 재원을 마련하지 못하고 있는 상황이다.도시철도를 운영하는 지자체 또한 국세에 편중된 세입체계(붙임 2)와 복지비 등 과다한 법정 의무 지출의 구조적인 한계로 도시철도의 안전을 위해 투자할 여력이 없어 승객들의 안전은 날이 갈수록 위협받고 있다.이에 6개 지자체는 정부에 법정 무임승차 손실에 대한 지원을 지속적으로 요청해왔다. 그러나 정부는 ‘도시철도 운영 주체는 지자체이므로 무임승차 손실은 운영 주체인 지자체가 부담해야하며, 법정 무임승차의 도입 또한 지자체가 결정한 사항’이라는 논리로 지난 14년간 거부하고 있다.하지만 이들은 노인 법정 무임승차의 경우 대통령의 지시로, 장애인과 유공자 법정 무임승차는 강행규정인 법령에 따라 도입된 것이므로 도입의 주체는 정부이며, 원인제공자 부담의 원칙에 따라 법정 무임승차 손실 또한 정부가 보전해야 한다고 강조한다.더욱이 정부는 서울, 인천과 함께 수도권 도시철도를 동일한 운임으로 운영중인 한국철도공사에만 '철도산업발전기본법'에 따라 도시철도 법정 무임승차 손실을 보전하고 있는 것은 형평성에 어긋난다고 지적했다.실제로 정부는 한국철도공사가 운영하고 있는 수도권 도시철도 구간에서 발생하는 법정 무임승차 손실의 약 50~60%를 매년 보전 중이다.6개 지자체는 2017년 3월 황희 의원이 법정 무임승차 손실을 정부에서 보전하는 내용의 도시철도법 개정안을 발의해 국회 국토교통위원회 심의를 통과했으나, 현재 법사위 제2소위에서 계류 중이라고 지적햇다. 이들은 시민안전과 직결된 도시철도 노후시설 투자재원 확보와 소외계층에 대한 교통복지의 지속적 운영을 담보할 수 있도록 도시철도법 개정이 반드시 필요하다고 강조했다.서울시 도시철도과장은 “국가 차원의 교통복지 사무로서 시행되고 있는 법정 무임승차 제도의 지속가능성과 도시철도의 안전성을 위해 정부의 보전이 절실히 필요하다”며 “법정 무임승차 손실의 정부예산 미반영에 대해 협의회 차원에서 2020년 정부예산 반영과 도시철도법 개정안 통과에 총력을 다할 것""이라고 말했다.김경환 기자 kennyb@▶주식, 나도 더 잘할 수 있을까?▶조 변호사의 가정상담소 ▶머투가 봄맞이 선물 주나봄 <저작권자 ⓒ '돈이 보이는 리얼타임 뉴스' 머니투데이, 무단전재 및 재배포 금지>		"
30,2019.02.26. 오전 11:15,만성적자 지하철 무임승차…서울 등 6개 지자체 공동대응,"매년 약 9000억원 적자…지하철 재정난 날로 심각2020년 정부예산 확보, 도시철도법 개정 등 대응전두환씨가 지하철 노인 무임승차를 지시했다고 보도한 당시 기사(서울시 제공) © News1(서울=뉴스1) 전준우 기자 = 서울시 등 6개 광역지방자치단체가 매년 약 9000억원 수준의 적자가 발생하는 지하철 무임승차 손실에 대한 국비 확보를 위해 공동대응에 나섰다. 서울시를 비롯해 부산, 대구, 인천, 광주, 대전 6개 지자체는 전국 도시철도 운영 지자체 협의회를 열고 2020년 정부예산 확보, 국비 보전 근거인 도시철도법 개정안 통과 등 공동 대응전략을 마련하기로 했다고 26일 밝혔다.대표적인 교통복지 제도인 지하철 법정 무임승차는 1984년 5월22일 대통령 지시에 따라 도입됐다. 노인 무임승차를 시작으로 장애인, 유공자를 대상으로 확대되어 올해로 35년째 시행되고 있다.급격한 고령화와 도시철도 노선의 광역화, 정부의 유공자 보훈정책 강화 등으로 법정 무임승차자가 급증했다. 2017년 전국 도시철도 법정 무임승차자는 4억4000명에 달하고 이에 따른 운임손실도 5925억원이다. 하지만 낮은 운임 수준 등으로 인해 전국 7개 도시철도 운영기관은 매년 약 9000억원 수준의 적자가 발생하는 등 재정난은 날로 심각해지고 있다. © 뉴스1서울과 부산의 도시철도는 개통한지 30여년이 지나 선로, 전동차 등 시설들이 내구연한을 경과했다. 막대한 재원을 투입해 이를 교체해야 하지만 계속된 적자로 재원을 마련하지 못하고 있는 상황이다.이에 서울 등 지자체는 정부에 법정 무임승차 손실에 대한 지원을 지속적으로 요청하고 있으나 정부는 지난 14년간 거부하고 있다. ""도시철도 운영 주체는 지자체이므로 무임승차 손실은 운영 주체인 지자체가 부담해야 하고, 법정 무임승차의 도입 또한 지자체가 결정한 사항""이라는 논리다.하지만 지자체는 ""노인 법정 무임승차의 경우 대통령의 지시로, 장애인과 유공자 법정 무임승차는 강행규정인 법령에 따라 도입된 것이므로 도입의 주체는 정부""라며 국비 보전을 요구하고 있다.또 서울, 인천과 함께 수도권 도시철도를 동일한 운임으로 운영 중인 한국철도공사에만 정부가 매년 법정 무임승차 손실의 50~60%를 보전하는 것은 형평성에 어긋난다고 주장했다.지자체들은 시민안전과 직결된 도시철도 노후시설 투자재원 확보와 소외계층에 대한 교통복지의 지속적 운영을 담보할 수 있도록 '도시철도법' 개정이 필요하다고 촉구했다.2017년 3월 황희 의원이 발의한 법정 무임승차 손실을 정부에서 보전하는 내용의 도시철도법 개정안은 국회 국토교통위원회 심의 통과 후 현재 법사위 제2소위에서 계류 중이다. 박진순 서울시 도시철도과장은 ""국가 차원의 교통복지 사무로서 시행되고 있는 법정 무임승차 제도의 지속가능성과 도시철도의 안전성을 위해 정부의 보전이 절실히 필요하다""며 ""법정 무임승차 손실의 정부예산 미반영에 대해 협의회 차원에서 2020년 정부예산 반영과 도시철도법 개정안 통과에 총력을 다할 것""이라고 말했다.junoo5683@news1.kr▶[ 북미 2차 회담 ]  [ MWC 2019 ] ▶ 네이버 메인에서 [뉴스1] 구독하기![© 뉴스1코리아(news1.kr), 무단 전재 및 재배포 금지]"
34,2019.02.26. 오후 9:18,"""도시철도 '무임승차'로 인한 운임손실, 정부가 보전하라""","서울,부산,대구,인천,광주,대전 등뿔난 6개 광역시 연내 공동대응 추진 합의[서울경제] 노인 등 법률로 보장되는 도시철도 무임승차에 뿔난 6개 광역 지방자치단체가 “내년에는 국비 보전을 받겠다”며 공동 대응하기로 했다. 노인복지법·장애인복지법 등 무임승차는 법률로 보장받는데 그 비용은 지자체가 모두 부담하는 현재의 구조가 기형적이라는 것이다.26일 서울시에 따르면 서울·부산·대구·인천·광주·대전 6개 지자체는 지난 22일 ‘전국 도시철도 운영 지자체 협의회’를 개최해 오는 2020년 정부 예산 확보 방안에 대해 집중 논의했다. 6개 지자체는 ‘국비 보전’을 위한 공동 대응전략을 만들어 올해 추진하기로 합의했다.도시철도 법정 무임승차는 법률로 보장된다. 노인 무임승차는 노인복지법과 지난 1984년 대통령 지시로 시작됐다. 장애인의 경우는 1991년 시행된 장애인복지법, 국가유공자는 1985년 시행된 ‘국가유공자 등 예우 및 지원에 관한 법률’이 근거다. 이처럼 근거 조항은 지자체 조례가 아닌 법률에 있는데 중앙정부는 “도시철도 운영 주체는 지자체이므로 무임승차 손실은 운영 주체인 지자체가 부담해야 한다”고 주장한다는 것이다. 서울시 관계자는 “노인 법정 무임승차의 경우 대통령의 지시로, 장애인과 유공자 법정 무임승차는 강행규정인 법령에 따라 도입된 것이므로 도입 주체는 정부이며 원인제공자 부담의 원칙에 따라 법정 무임승차 손실 또한 정부가 보전해야 한다”고 주장했다.서울시는 무임승차로 운임손실이 늘어나고 있다고 주장한다. 2017년 전국 도시철도 법정 무임승차자는 4억4,000만명에 달하며 그에 따른 운임손실도 5,925억원에 이른다. 박진순 서울시 도시철도과장은 “국가 차원의 교통복지 사무로서 시행되고 있는 법정 무임승차 제도의 지속가능성과 도시철도의 안전성을 위해 정부의 보전이 절실히 필요하다”며 “법정 무임승차 손실의 정부 예산 미반영에 대해 협의회 차원에서 2020년 정부 예산 반영과 도시철도법 개정안 통과에 총력을 다할 것”이라고 말했다./변재현기자 humbleness@sedaily.com[서울경제 바로가기]네이버 메인에서 'No. 1 뉴스' 서울경제를 만나보세요 [바로가기▶]프리미엄 미디어 Signal이 투자의 바른 길을 안내합니다 [바로가기▶]저작권자 ⓒ 서울경제, 무단 전재 및 재배포 금지		"
37,2019.02.26. 오후 2:36,"서울시,“도시철도 무임승차 손실 국비확보 총력”","서울시를 비롯해 부산·대구·인천·광주·대전 6개 지방자치단체가 도시철도 무임승차 손실에 따른 정부 지원을 끌어내기 위해 공동 대응하기로 했다.  서울시는 지난 22일 6개 지자체가 전국 도시철도 운영 지자체 협의회(이하 협의회)를 열고, 법정 무임승차 손실의 국비 보전을 위한 공동대응 전략을 마련해 추진하기로 했다고 26일 밝혔다. 2017년 발족된 협의회는 무임승차를 법령으로 허용한 데 따른 지자체의 손실에 대한 정부보전을 끌어내기 위해 구성됐다. 교통복지 제도인 도시철도 법정 무임승차는 1984년 5월22일 당시 전두환 대통령의 지시에 따라 도입됐다. 노인 무임승차를 시작으로 장애인, 유공자를 대상으로 확대됐으며, 올해로 35년째 시행되고 있다.2017년 기준 전국 도시철도 법정 무임승차자는 4억4000만명에 달한다. 그에 따른 운임손실은 5925억원이다. 이는 전국 7개 도시철도 운영기관 적자(1조347억원)의 57%에 해당하는 금액이다. 무임승차로 재정난이 심해지면서 안전 관리에도 어려움을 겪고 있다는 게 이들 지자체의 주장이다. 서울과 부산의 도시철도는 개통한 지 30여년이 지나 선로, 전동차 등 시설들이 내구연한을 지났지만 재원이 부족해 교체하지 못하고 있다고 서울시는 전했다.관련 지자체는 정부에 무임승차 손실에 대한 지원을 요청해왔으나 정부는 ‘무임승차 손실은 운영 주체인 지자체가 부담해야 하며, 법정 무임승차의 도입 또한 지자체가 결정한 사항’이라는 입장이다. 이들 지자체는 그러나 “노인 법정 무임승차는 대통령의 지시로, 장애인과 유공자 무임승차는 강행규정인 법령에 따라 도입된 것이므로 도입의 주체는 정부”라며 “원인 제공자 부담의 원칙에 따라 법정 무임승차 손실 또한 정부가 보전해야 한다”고 주장했다.게다가 서울, 인천과 함께 수도권 도시철도를 동일한 운임으로 운영 중인 한국철도공사(코레일)에만 철도산업발전기본법에 따라 정부가 도시철도 무임승차 손실을 보전하고 있는 것은 형평성에 어긋난다는 지적도 나온다. 정부는 한국철도공사가 운영하는 수도권 도시철도 구간에서 발생하는 법정 무임승차 손실의 약 50∼60%를 매년 보전해준다.2017년 3월 국회에서 법정 무임승차 손실을 정부가 보전하는 내용의 도시철도법 개정안이 발의돼 그해 국토교통위원회 심의까지 통과했으나 아직 법사위 제2소위에서 계류 중이다.박진순 서울시 도시철도과장은 “법정 무임승차 손실의 정부예산 미반영에 대해 협의회 차원에서 2020년 법정 무임승차 손실의 정부 예산 반영과 도시철도법 개정안 통과에 총력을 다할 것”이라고 전했다.이명희 기자 minsu@kyunghyang.com▶ 최신 뉴스 ▶ 두고 두고 읽는 뉴스 ▶ 인기 무료만화©경향신문(www.khan.co.kr), 무단전재 및 재배포 금지"
38,2019.02.26. 오후 7:53,마지막이 된 마중,"40대 장애인이 오르막길을 힘들어하는 어머니를 전동 휠체어에 태워 함께 타고 귀가하던 중 택시와 부딪혀 어머니가 숨지고 아들은 크게 다치는 사고가 발생했다. 아들은 밤늦게 헬스장 청소 일을 마친 어머니를 마중 나오다 변을 당해 주위를 더욱 안타깝게 하고 있다.26일 오전 0시 10분께 부산 영도구 동삼동 와치복지관 앞 왕복 2차로 도로에서 손 모(44) 씨와 어머니 이 모(67) 씨가 함께 탄 전동휠체어가 택시와 충돌했다. 충격을 받고 휠체어에서 튕겨 나간 모자는 인근 대학병원으로 옮겨졌으나 이 씨는 치료를 받던 중 뇌출혈로 이날 오전 10시 8분께 끝내 숨졌다. 갈비뼈와 코뼈가 부러진 손 씨는 현재까지 치료를 받고 있다.장애 5급 40대 전동휠체어 타고 매일 어머니 퇴근길 마중 ‘큰 보람’26일 휠체어 타고 오르막길 가다 택시와 부딪혀 어머니 결국 사망 영도구, 딱한 사연에 장례비 지원경찰은 택시기사 문 모(56) 씨가 몰던 차량이 와치복지관 앞에서 동삼중학교 방향으로 좌회전하던 중 전동휠체어와 충돌한 것으로 보고 있다. 사고 당시 손 씨와 어머니는 전동휠체어를 타고 역주행을 하고 있었다. 경찰은 “집이 있는 반대편으로 길을 건너려고 역주행하다 이를 미처 보지 못한 택시와 충돌한 것으로 보인다”고 말했다. 경찰은 당시 신호상황이 적색 점멸 신호상황이었다고 전했다. 경찰은 CCTV분석을 통해 적색 점멸 신호에서 택시기사 문 씨가 전방주시 의무를 제대로 준수했는지 등 정확한 사고 경위를 조사 중이다.5년 전 조선소 직원으로 일하던 손 씨는 불의의 사고로 다리를 다쳐 지체 장애 5급 판정을 받았다. 어머니 이 씨도 청각장애 4급이지만, 아들 손 씨를 대신해 홀로 생계를 책임졌다. 모자는 매월 기초생활수급비, 장애 수당을 조금 보탠 90만 원의 돈으로 근근이 살아왔다. 적은 돈에도 모자는 서로에게 큰 힘이 됐다. 아들은 어머니가 일을 마치는 시간 매일 전동휠체어에 몸을 의지한 채 마중을 나갔다. 밤늦게 헬스장 청소 일을 마치는 어머니에게도 아들을 보는 일은 세상에서 가장 큰 즐거움이었다.사고가 발생한 날에도 아들은 어머니를 마중나가 고생하신 어머니에게 전동휠체어를 내어드렸다. 모자는 오르막길에서 전동휠체어에 나란히 올라탔고, 집이 있는 건너편으로 가기 위해 폭 1.2m의 좁은 인도를 벗어나 도로에 내려온 게 화근이 되고 말았다.도로교통법상 전동휠체어는 인도로 다니는 것이 원칙이지만, 사고 지점 인도는 보도블록으로 조성돼 전동휠체어가 다니는 것이 사실상 불가능한 상황이었다. 부산의 한 장애인단체 관계자는 “폭 1.2m의 인도는 보행자와 휠체어가 같이 다니기에는 매우 좁은 도로다”며 “열악한 도로 환경도 이번 사고의 한 원인으로 보인다”고 말했다.모자의 안타까운 사연이 전해지자 영도구청은 어머니 이 씨의 장례비용과 아들 손 씨의 치료비용을 지원할 계획이다. 영도구청 관계자는 “실의에 빠진 손 씨를 위로하기 위해 장례비용을 지원하는 장례급여와 긴급의료비 지원을 검토하고 있다”고 말했다. 박혜랑 기자 rang@busan.com"
