,날짜,기사제목,기사내용
0,2019.08.29. 오전 9:36,교통약자 특별교통수단 '두리발' 9월부터 즉시 배차,"부산시설공단, 장애인 교통편의 위해 운행체계 혁신즉시배차제·지정차고지제·오전 집중배차제 등 도입추연길 부산시설공단 이사장이 8월 초 두리발 신규 복지매니저 공채1기 서비스소양교육에서 강의를 하고 있다. (부산시설공단 제공) 2019.8.29 © 뉴스1 (부산=뉴스1) 박기범 기자 = 교통약자의 특별교통수단인 ‘두리발’ 운행 체계가 대대적으로 손질된다. 부산시설공단은 ‘두리발’이 시민과 장애인의 눈높이에 맞게 운영될 수 있도록 강도높은 혁신책을 마련, 내달 1일부터 시행에 들어간다고 29일 밝혔다. 부산시설공단은 고객 요청 시 즉시 배차로 15분 내 탑승지 도착과 ‘일본의 MK택시보다 더 친절한 복지매니저’라는 두 가지 목표를 달성한다는 방침이다. 우선 고객 요청시 현행 40분 이상 걸리던 평균 대기시간을 15분 내로 개선한다.또 두리발 차량을 운행하는 복지매니저의 휴식 시 차량운행이 멈춰 차량이 부족했던 현행 '1인 1차제' 제도를 폐지하고 '권역별 지정차고지제'를 도입해 24시간 운행이 가능하도록 했다. 부족한 인력은 노인일자리를 확대해 충원하기로 했다.운행수요가 많은 시간대에 차량배치도 확대한다. 현행 6개 근무조로 운행하던 두리발 차량근무제도를 4개 근무조로 개선해 출근 시간대인 오전 7~8시에 투입되는 두리발을 99대까지 늘리고, 수요가 적은 야간시간대는 줄인다는 계획이다. 40분 전 예약제 시행 대신 고객요구 시 즉시배차제를 도입해 이용 편의 증진에도 나선다.  고객 상담실도 '고객불편 제로(ZERO)화 및 고객요구 100% 이행'을 목표로 근무형태를 조정하고, 내년 상반기까지 4차산업을 활용한 운영시스템을 도입할 예정이다.복지매니저 성과 분석에도 나선다. 개인별 생산성을 매달 파악해 성과자에게는 해외연수 기회를 제공하며, 기준 이하 직원에게는 재교육 및 촉탁제 탈락 등 상벌을 달리한다. 인센티브 성과급도 차등 지급된다.  추연길 이사장은 ""이 같은 목표를 달성하지 않으면 부산시설공단의 미래가 없다는 각오로 혼신을 다해 개혁해 나가겠다""고 밝혔다.pkb@news1.kr▶ [ 크립토허브 ] ▶ [ 해피펫 ]▶ 네이버 메인에서 [뉴스1] 구독하기![© 뉴스1코리아(news1.kr), 무단 전재 및 재배포 금지]"
1,2019.08.28. 오후 7:11,윤석영 부산성의신협 이사장 “초우량 신협 비결? 직원 복지 높이면 고객서비스도 좋아져요”,"부산 부산진구를 기반으로 한 부산성의신협은 전국 900개가 넘는 신협 중에서도 최상위 레벨의 초우량 신협으로 꼽힌다. 1974년 설립 이후 46년 연속 흑자를 이어오고 있으며, 자산과 당기순이익 기준으로 꾸준히 전국 10위 이내에 이름을 올리고 있다. 2017년엔 당기순이익 76억 원의 실적으로 1위에 오르기도 했다. 올 상반기 기준으로도 자산 순위 8위(6258억 원), 당기순이익 2위(48억 원)로 순항을 이어가고 있다.부산성의신협 윤석영 이사장은 그 비결로 우선 ‘직원들의 뛰어난 역량’을 꼽았다. 그는 “직원 복지에 최우선을 둔 조직 관리로, 직장에 최선을 다할 수 있는 환경 조성이 부산성의신협의 지속적인 성장을 이끌고 있다”고 했다.올 상반기 당기순이익 전국서 2위작년 2억대 교통약자 저상버스 기부“경영 수익 지역사회 환원에 노력”이는 엄청난 인원이 몰리는 신입사원 모집 때도 쉽게 확인된다. 1~2년에 한 번씩 6명가량을 뽑는데, 매번 경쟁률이 100대 1을 훌쩍 넘는다. 초봉이 5200만~5400만 원에 달해 시중은행 부럽지 않다. 또 부산성의신협만의 특별한 복지정책도 운영한다. 전 직원을 대상으로 3~4년에 한 번꼴로 300만 원 상당의 가족여행권을 증정하는데 직원들은 물론 그 가족들의 만족도도 높다. 윤 이사장은 “부산성의신협에 잠깐의 서비스를 맛본 고객들이 아주 만족해 재산 대부분을 우리 신협에 맡기는 경우도 종종 있다”면서 “직원들을 위한 복지정책은 곧바로 업무 효율성과 연결이 되고, 이는 수익 창출을 위한 큰 발판이 되는 동시에 지역사회를 위한 환원사업까지 이어지는 기초가 된다”고 설명했다.윤 이사장은 “수익을 사용자인 조합원들에게 적극적으로 환원하는 다양한 정책들도 조합원 확대 등 발전의 원동력이 되고 있다”고 밝혔다. 시중은행에선 쉽게 흉내 낼 수 없을 정도로 예금상품 금리는 높게, 가계 대출상품 금리는 시중은행 못지않게 낮게 설계해 가계 경제에 도움이 되도록 하는 것뿐만 아니라, 정기예금 금리보다 훨씬 높은 3.5%(2018년 기준)의 출자 배당금을 매년 지급한다. 또 비대면서비스에 어려움을 겪는 조합원들을 위해 온라인 송금 수수료를 면제해 준다.부산성의신협은 사회공헌활동도 왕성하게 벌이고 있다. 매년 지역 중·고생 2000만 원 장학금 지급과 학교발전지원금 전달 뿐만 아니라 지난해엔 지역 내 교통약자의 교통 편의를 위해 부산진구노인장애인복지관에 2억 5000만 원 상당의 저상버스를 기부하기도 했다. 단위 신협 차원에서의 이러한 거액 기부는 처음이어서 전국적으로 큰 화제를 모으기도 했다. 이는 유통업 관련 사업을 일구며 30년이 넘게 부산진구를 위해 다양한 봉사활동을 해 온 윤 이사장의 의지가 강하게 반영된 것이다. 천주교 신자인 그는 장례지도사자격증을 따 160여 명의 선종(서거를 뜻하는 천주교 용어) 봉사를 해왔고, 소녀가장과 독거노인 돌보기, 청소년 학비 지원 등을 위해 매년 수천만 원의 사비를 아낌없이 지역에 내놓았다. 이에 2011년엔 희생·봉사 부문 ‘자랑스러운 부산진구민상’을 수상하기도 했다.윤 이사장은 “신협은 서민을 위한 지역금융회사로, 더불어 잘사는 사회를 만드는 것이 목표”라면서 “앞으로도 지역사회 발전을 위해 최선을 다하겠다”고 강조했다.강희경 기자 himang@busan.com"
