,날짜,기사제목,기사내용
0,2017.06.02. 오후 5:24,"네오펙트, 부산 장애인복지관에 ‘라파엘 스마트글러브’ 기부","소셜 기부 플랫폼 ‘쉐어앤케어’와 함께 기부캠페인 진행네오펙트는 2일 뇌졸중환자 재활훈련의료기기인 ‘라파엘 스마트글러브’를 부산 금정구 장애인복지관에 기부했다고 밝혔다.   이번 기부캠페인은 네오펙트와 플랫폼 '쉐어앤케어'가 재활이 필요한 환자를 돕기 위해 SNS를 통해 진행했다. 남편을 잃고 택시운전을 하다가 교통사고를 당해 재활이 필요했던 김복선 씨의 이야기에 약 1만5000여명이 소셜 기부로 참여해 1500만원 목표액을 달성했다.   네오펙트는 1일 뇌졸중 환자 재활 훈련 의료기기인 ‘라파엘 스마트글러브’를 부산 금정구 장애인 복지관에 기부했다. 왼쪽부터 네오펙트 최안나 차장, 네오펙트 이승용 부장과 금정구 장애인 복지관 고영찬 관장.캠페인은 '좋아요'를 누르면 한 건당 200원, 공유는 1000원이 기부되는 방식이다. 금정구 장애인복지관 환자들은 복지관 내 프로그램을 통해 라파엘 스마트글러브로 물리치료사와 함께 정기적으로 재활 훈련을 진행할 수 있게 됐다.   라파엘 스마트글러브는 뇌졸중 등 중추신경계질환자들이 다양한 재활훈련게임을 통해 손가락과 손목, 아래팔 기능의 재활훈련을 할 수 있도록 개발된 치료용 의료기기다. 약 40여 개의 재활훈련게임은 환자의 시각과 청각, 두 가지 감각을 동시에 자극해 뇌 가소성 증진과 뇌 운동 부위의 재학습을 도와준다.   또 훈련 중 측정되고 분석된 데이터는 인공지능을 통해 환자상태에 맞는 다양한 과제훈련게임을 제공, 동기가 부여되도록 디자인됐다. 라파엘 스마트 글러브는 CES 2017 혁신상을 수상한 바 있다.  금정구 장애인복지관 고영찬 관장은 “금정구 장애인복지관은 어려운 환경에서 재활훈련이 필요한 장애인들을 돕고 있다”며 “재활은 포기하지 않는 것이 가장 중요한데 라파엘 스마트 글러브로 많은 환자가 의지를 갖고 지속적인 재활훈련을 하는데 큰 도움이 될 것 같다”고 말했다.   네오펙트 반호영 대표는 “네오펙트가 의미 있는 사회공헌을 통해 금정구 장애인복지관에 도움을 줄 수 있어 기쁘다“며 “기기를 통해 저렴한 비용으로 더 많은 사람들이 재활혜택을 받을 수 있도록 앞으로도 노력하겠다”고 밝혔다. <헬스경향 백영민 기자 newbiz@k-health.com>▶ [스포츠경향 인기 무료만화 보기]▶ [스포츠경향 핫&스타포토] [따라해 보세요! 다이어트 영상]©스포츠경향(sports.khan.co.kr), 무단전재 및 재배포 금지		"
1,2017.06.27. 오후 5:49,[인사] 한국가스공사 / 부산교통공사 / 한국기업평가 등,"			■한국가스공사 ◇전보 및 보임 △지원본부장 박인환 △영업본부장 유종수 △생산본부장 김성모 △총무지원처장 김천수 △인사노무처장 박오근 △통합보안처장 김차중 △경기지역본부장 김정규 △강원지역본부장 박병선 △광주전남지역본부장 이동률 △대구경북지역본부장 홍성백 △경영협력실장 김병식 △경영협력실 경영공시팀장 임찬국 △재무처 자산관리팀장 김영석 △인사노무처 성과보상팀장 양기철 △인천기지본부 공정기술팀장 윤종운 △인천기지건설단 토건팀장 이상원 △삼척기지본부 안전환경팀장 박성수 △경기지역본부 설비운영팀장 이훈상 △경기지역본부 안전환경팀장 윤용태 △부산경남지역본부 설비보전팀장 이종복 △설비기술처 기술기준팀장 김기수 △재무처 재무기획팀장 배경석 △자원기술처 비전통가스기술팀장 오권택 △가스연구원장 이성민 △가스연구원 자원기술연구센터장 신창훈 ■부산교통공사 △안전관리실장 강용길 △경영지원처장 박병수 △감사실장 김현중 △대저승무사업소장 최천수 △제1운영사업소장 하성룡 △제3운영사업소장 김동면 △기획조정실 평가조직부장 박명도 △안전관리실 안전계획부장 윤을용 △재정예산실 예산부장 이종욱 △전략사업실 사업운영부장 공재순 △경영지원처 인사부장 김현주 △영업처 영업관리부장 신희철 △전기기계설비처 전기시설부장 예동해 △설비공사처 전기공사부장 신병태 △BTC아카데미 교수부장 이상곤 △BTC아카데미 부장교수 왕수환 △대저승무사업소 운영부장 김이남 △제1운영사업소 관리·환승역장 요원 김환수 △제2운영사업소 운영부장 배영덕 △제3운영사업소 관리역장요원 홍윤의 △경전철운영사업소 관리역장 요원 곽상신 △노포차량사업소 정비부장 서호진 △노포차량사업소 검수부장 김성규 △종합관제소 기술관제부장 강주원 △시설사업소 토목부장 서근순■한국기업평가 ◇신규선임 △분석부문 총괄전무 강일진 △경영지원본부장(전무) 민영창■강동경희대병원 △경영정책실 부실장 심계식 △의대병원 기획진료부원장 이봉재 △한방병원 기획진료부원장 겸 기획조정실 부실장 이진무 △치과병원 기획진료부원장 겸 기획조정실 부실장 지유진 △의대병원 수술부장 주선형■이화여대 △자연과학대학부학장 김명화 △수리물리과학부장·물리학과장·물리학전공주임교수 윤석현 △정보보호학 연계전공주임교수 오세진 △THE인재평가지원실장 정제영 △교육학과장 겸 도덕·윤리교육 연계전공주임교수 신태섭 ■광주대 △기획처장 김현종 △교무처장 한규무 △입학처장 이득기 △학생지원처장 윤홍상 △산학협력단장 김정근 △산학협력선도대학(LINC+)사업단장 김갑용 △기획부처장 박경종 △교무부처장 방요순 △입학부처장 김한성 △학생지원부처장 이윤호 △산학협력부단장 김광현 △LINC+사업부단장 노선식■전주대 △체육부장 직무대리 겸 학생지원실장 박종찬 △비서실장 김영진 △취업지원실장 한진연 △총무지원실장 이재환■전북도 ◇부단체장 △김제 부시장 이후천 △완주 부군수 고재욱 △임실 부군수 박진두 △부안 부군수 이연상 ◇국장급(3급) 직위승진 △노인장애인복지과장 신현승■충북 진천군 ◇5급 △세정과장 김창우 △회계정보과장 방승원 △경제교통과장 송상호 △환경위생과장 이미숙 △친환경농정과장 신영목 △산림축산과장 안재승 △의회사무과장 정태우 △덕산면장 이헌우 △초평면장 서계석 △문백면장 이남희 △이월면장 이종찬 △광혜원면장 한상열 △보건소장 유경자 △의회사무과 전문위원 신정호 ◇6급 △시설관리사업소장 직대 유성현 △주민복지과 희망복지지원팀장 이영희 △행정지원과 행정팀장 윤혁헌 △행정지원과 사무지원팀장 임승혁 △경제교통과 생활경제팀장 김평환 △경제교통과 공동체일자리팀장 이영자 △환경위생과 위생팀장 오영진 △보건소 건강관리팀장 오연순 △보건소 보건관리총괄팀장 허선미 △농업기술센터 수박상담소장 봉윤종 △시설관리사업소 문화시설관리팀장 강선미 △덕산면 팀장요원 문재란 △백곡면 팀장요원 이원제 △이월면 팀장요원 신숙 ■충북 옥천군 ◇4급 승진 △기획감사실장 박범규 △경제정책실장 박준태 ◇5급 전보 △자치행정과장 이광섭 △건설교통과장 이제만 △의회사무과장 이상길 △옥천읍장 김인종 △동이면장 박정옥 ◇5급 직무대리 △환경과장 권세국 △상하수도사업소장 고명도 △행정운영 전문위원 박영범 △산업경제 전문위원 임홍순■충남 당진시 △토지관리과장 이형주 △의회 전문위원 최경호 △고대면장 정영환■청주시 ◇4급 승진 △도서관평생학습본부장 박동규 △고인쇄박물관장 한상태 △도시개발사업단장 김의 △상당보건소장 정용심 △상수도사업본부장 이범수 ◇4급 전보 △문화체육관광국장 남성현 △환경관리본부장 서강덕 △건설교통본부장 박홍래 △청원구청장 남기상 △안전도시주택국장 최용한 △상당구청장 이중훈 ◇5급 승진 △미원면장 직무대리 유서기 △금천동장 직무대리 전재천 △용암제1동장 직무대리 박종철 △수곡제1동장 직무대리 김충환 △복대제1동장 직무대리 정헌구 △차량등록사업소장 직무대리 지성규 △청원구청 환경위생과장 직무대리 조미영 △상당구청 건설교통과장 직무대리 신건홍 △서원구청 건축과장 직무대리 백두흠 △현도면장 직무대리 이광창 △청원구청 건축과장 직무대리 민병전 △농업기술센터 기술보급과장 직무대리 이성희 △농업기술센터 도시농업관 직무대리 박만성 △오송첨단의료산업진흥재단 파견 강호경 ◇5급 전보 △상생협력담당관 이상숙 △예산과장 정호형 △세정과장 윤기학 △생활안전과장 이화영 △복지정책과장 임헌석 △체육진흥과장 박노열 △문예운영과장 이현석 △농업정책과장 유오재 △안전정책과장 정동열 △대외협력사무소장 이원옥 △상당구청 행정지원과장 안순희 △상당구청 주민복지과장 남선자 △탑대성동장 고영대 △가덕면장 박명옥 △서원구청 행정지원과장 홍창수 △흥덕구청 행정지원과장 김옥동 △흥덕구 세무과장 유병근 △흥덕구청 복대제2동장 김우혁 △청원구청 민원지적과장 신용희 △청원구청 주민복지과장 박은향 △오창읍장 오세구 △북이면장 이제일 △봉명제2송정동장 박진호 △대중교통과장 조일희 △하수처리과장 남붕우 △원예유통과장 원상연 △축산과장 김웅수 △위생정책과장 김미환 △상당보건소 건강증진과장 맹준식 △청원보건소장 장정수 △도로시설과장 우두진 △도시개발사업단 도시재생과장 정무영 △문의면장 차금남 △농업기술센터 지원기획과장 안승남 △오송첨단의료산업진흥재단 파견 이상원■서울시 ◇3급 이상 전보 △상수도사업본부장 윤준병 △복지본부장 김용복 △도시교통본부장 고홍석 △문화본부장 서정협 △도시기반시설본부 시설국장 류훈 △인재개발원장 장경환 △시민소통기획관 유연식 △일자리노동정책관 조인동 △정보기획관 정헌재 △평생교육국장 주용태 △지역발전본부 동북권사업단장 이정화 △도시기반시설본부 도시철도국장 형태경 △서울시립대 행정처장 윤영철 △경제진흥본부 경제기획관 직무대리 박대우 △도시재생본부 주거사업기획관 직무대리 김승원 △기획조정실 정책기획관 직무대리 이영기 △도시교통본부 보행친화기획관 직무대리 여장권 △기후환경본부 환경에너지기획관 직무대리 정광현 △푸른도시국 서울로운영단장 이수현 △푸른도시국장 직무대리 최윤종 ◇자치구 전출 △서대문구 부구청장 이충열 △구로구 부구청장 엄연숙[매일경제 공식 페이스북] [오늘의 인기뉴스] [매경 프리미엄][ⓒ 매일경제 & mk.co.kr, 무단전재 및 재배포 금지]		"
2,2017.06.28. 오전 11:31,[인사],"			▶전북도 <부단체장> ▷김제 부시장 이후천 ▷완주 부군수 고재욱 ▷임실 부군수 박진두 ▷부안 부군수 이연상 <3급 승진> ▷노인장애인복지과장 신현승▶부산교통공사 ▷안전관리실장 강용길 ▷경영지원처장 박병수 ▷감사실장 김현중 ▷대저승무사업소장 최천수 ▷제1운영사업소장 하성룡 ▷제3운영사업소장 김동면 ▷기획조정실 평가조직부장 박명도 ▷안전관리실 안전계획부장 윤을용 ▷재정예산실 예산부장 이종욱 ▷전략사업실 사업운영부장 공재순 ▷경영지원처 인사부장 김현주 ▷영업처 영업관리부장 신희철 ▷전기기계설비처 전기시설부장 예동해 ▷설비공사처 전기공사부장 신병태 ▷BTC아카데미 교수부장 이상곤 ▷BTC아카데미 부장교수 왕수환 ▷대저승무사업소 운영부장 김이남 ▷제1운영사업소 관리ㆍ환승역장 요원 김환수 ▷제2운영사업소 운영부장 배영덕 ▷제3운영사업소 관리역장요원 홍윤의 ▷경전철운영사업소 관리역장 요원 곽상신 ▷노포차량사업소 정비부장 서호진 ▷노포차량사업소 검수부장 김성규 ▷종합관제소 기술관제부장 강주원 ▷시설사업소 토목부장 서근순▶이화여대 ▷자연과학대학부학장 김명화 ▷수리물리과학부장ㆍ물리학과장ㆍ물리학전공주임교수 윤석현 ▷정보보호학 연계전공주임교수 오세진 ▷THE인재평가지원실장 정제영 ▷교육학과장 겸 도덕ㆍ윤리교육 연계전공주임교수 신태섭▶영감이란 불꽃에 타오르게할 스토리(INSPIRE)▶앞서가는 젊은 경제신문 친구맺기 ▶오늘의 운세 날씨 - Copyrights ⓒ 헤럴드경제 & heraldbiz.com, 무단 전재 및 재배포 금지 -		"
3,2017.06.12. 오후 5:49,"부산장애인단체 ""도시철도 전동차와 승강장간 유격·단차 커 위험"" ","			【부산=뉴시스】 하경민 기자 = 부산장애인총연합회는 12일 ""부산 도시철도 1·2호선의 전동차와 승강장 간의 유격과 단차가 너무 커 장애인들의 이용에 상당한 제약을 주고 있으며 안전사고에 대한 위험도 높다""고 밝혔다.부산장애인총연합회에 따르면 부산 도시철도 1~4호선은 총 105개 역으로 운영되고 있으며, 이 중 1·2호선은 전체 역의 70%(75개역)를 차지하고 있다. 1·2호선 일부 구간에서는 최소 10~28㎝에 달하는 유격(같은 평면 내 간격)과 2~7㎝의 단차(전동차와 승강장과의 높이 차)가 발생해 휠체어나 지팡이를 이용하는 장애인들의 안전사고 발생 위험이 높다.이 같은 문제점이 심각한 역은 1호선 남포·서면·연산역, 2호선 국제금융센터역 등이라고 장애인연합회는 전했다. 장애인연합회는 ""수 차례에 걸쳐 부산교통공사에 민원을 제기했지만 예산과 기술적인 한계 등의 변명으로 일관하고 있다""고 주장했다.이에 장애인연합회는 ""전동차 간의 유격과 단차를 기술력으로 해결하고, 현재 차량의 앞뒤 두 곳에 설치돼 있는 장애인석을 차량 중간 지점에 추가 설치를 해달라""고 요구했다.더불어 ""이동식 안전발판 또는 직원 상주로 장애인들의 이동권 보장에 최선을 다해 줄 것""을 촉구했다. yulnetphoto@newsis.com뉴시스 뉴스, 네이버 뉴스 스탠드에서도 만나세요뉴시스 SNS [페이스북] [트위터]<저작권자ⓒ 공감언론 뉴시스통신사. 무단전재-재배포 금지.>"
4,2017.06.25. 오후 11:01,부산시 택시발전계획 놓고 갑론을박,"    지난 23일 오후 부산시청 12층 국제회의장에서 교통 전문가와 택시업계 관계자 등 350여 명이 참석한 가운데 '택시운송사업 발전계획 수립 공청회'가 열렸다.      ""택시 요금 올리려면 노사정 협약 도장부터 찍읍시다. 이번에도 사납금만 인상되면 뭔 소용입니까.""지난 23일 오후 2시 부산시청 12층 국제회의장. 교통 전문가와 택시업계 관계자 등 350여 명이 참석해 열린 '택시운송사업 발전계획 수립 공청회'에서 부산시가 계획을 공개하자, 뜨거운 논쟁이 벌어졌다.지난 23일 부산시 공청회 전문가·업계 관계자 참석 환승할인·희망사업 쓴소리시는 올 2월부터 워킹그룹과 라운드테이블을 운영하며 '종합선물세트' 수준인 5개 목표 23개 사업을 추렸고, 다음 달 교통개선위원회 심의로 계획이 확정되면 차례로 추진될 예정이다.시는 택시 과잉공급 완화를 위해 감차 사업 이외에 택시를 통째 빌려 장애인 이동 등에 활용하는 '임차택시'를 도입한다. 또 경쟁력을 향상을 위해 △요금 체계 합리화(인상) △전기택시 도입 △무료 와이파이 서비스 △통합 택시 앱 △휴대전화 습득 신고포상금 등을 도입하고, 근로 여건 개선을 위해서는 △희망키움 사업(보조금 지급) △택시베이 설치 △화장실 앱·지도 제작 △힐링센터 건립 △범죄예방 택시 격벽 설치 △선진지 견학 △택시 공영차고지 설치가 선정됐다.서비스 개선 방안으로 △택시 환승체계 도입 △MICE 전담 택시, 해피택시(반려동물·복지·분홍·임산부택시) 운영 △택시 외부 개선 등이 포함됐고, 안전관리 강화 목표에 △건강 UP 행복 UP 프로그램 △택시안내센터 운영을 추진한다.이 가운데 택시환승 할인과 희망키움 사업, 요금 현실화 등 3가지 핵심 안건(본보 19일 자 10면 보도 등)이 도마 위에 올랐는데, 쓴소리가 곳곳에서 터져 나왔다. 계획이 '수박 겉핥기'라는 것이다.부산참여자치시민연대 윤영삼 교통위원장은 ""계획이 성공하려면 감차를 더 해야 하고, 비정상적인 법인택시 사납금을 손질해야 한다""며 ""정확한 데이터를 가지고 인상 이유를 검증하고 시민들에게 설명해야 한다""고 지적했다. 부산YMCA 오문범 기획실장은 ""부산 택시의 서비스평가 지수는 대단히 낮다. '그래서 달라지는 게 뭔데?'라는 소릴 듣지 않도록 먼저 시와 업계의 정확한 답변이 필요하다""고 말했다.택시 종사자들은 어느 때보다 절실했다. 법인택시 10년차라고 밝힌 한 운전사는 ""12시간 일하는데 최저 임금을 4시간 20분만 보장하니 문제가 해결될 리 없다""고 목소리를 높였다. 민주노총 소속 한 운전사는 ""희망키움 사업은 지속가능성이 없어 보인다. 요금 인상이 개개인에게 돌아가게 힘써달라""고 했다. 27년차 운전사는 ""내년 지방선거용으로 내놓은 거란 소리 듣지 않으려면 계획의 10%라도 실행해주길 빈다""고 호소했다.부산시 이준승 교통국장은 ""추가 감차는 예산 한계로 어렵다. 오히려 승용차 운행을 억제하는 게 문제 해결의 중요한 요소라 생각한다""는 입장을 밝혔다. 글·사진=박세익 기자 run@busan.com"
5,2017.06.27. 오전 9:16,[대전소식]28~30일 대전장애인기능경기대회 등,"			【대전=뉴시스】조명휘 기자 = ◇ 28~30일 대전장애인기능경기대회  대전시는 28일부터 30일까지 한국폴리텍Ⅳ대학, 대전직업능력개발원 등 4개 경기장에서 ‘2017 대전장애인기능경기대회'를 연다. 가구제작 등 19개 정규직종 169명, 바리스타 등 5개 시범직종에 42명, 레저 및 생활기술직종에 11명 등 모두 222명이 참가해 기량을 겨루게 된다. 입상자에게는 해당직종별 기능사 실기시험이 면제된다.정규직종의 경우 금상 50만원, 은상 30만원, 동상 20만원을,  시범직종 및 레저·생활기술 직종은 금상 30만원, 은상 20만 원, 동상 10만원이 주어진다. 특히 금상 수상자에게는 9월 부산에서 열리는 '전국장애인기능경기대회'의 참가 자격이 주어진다. 자세한 사항은 대전시 장애인복지과나 한국장애인고용안정협회 대전지부로 문의하면 된다.◇ 대전시 6개공원 지명 확정대전시는 유성구에 있는 6개 공원 지명이 국가지명위원회에서 최종 확정됐다고 27일 밝혔다.확정된 지명은 문지지구 사업에 따라 신설되는 민마루근린공원과 강변어린이공원, 문지어린이공원을 비롯해 죽동지구 내 지울소공원, 도룡동 한빛탑 주변으로 조성되는 엑스포과학공원, 노은3지구에 있는 해랑숲근린공원 등이다. 앞서 국토교통부 국토지리정보원은 지난 22일 국가지명위원회를 열고 대전시에서 상정한 지명을 이같이 심의·의결했다. 이 지명들은 앞으로 국가기본도에 반영된다. ◇ 대전시, 2017 관광정책 토론광장 개최 대전시는 지역 관광산업의 로드맵 재정비를 통한  관광 활성화 선도도시 실현 방안 마련을 위해 오는 29일 옛 충남도청 대회의실에서 ‘2017 대전 관광정책 토론광장’을 개최한다고 27일 밝혔다. 문화체육관광부, 한국관광공사, 한국문화관광연구원 등 정책 입안과 실행을 담당하는 기관들이 참여해 대전지역 관광의 현실과 방향을 제시할 예정이다.차기 한국관광학회장인 김남조 한양대 교수가 '대전이 관광도시로 가는 방향'을 주제로 발제하고 강정원 문체부 관광정책과장과 김홍기 한국관광공사 국내관광실장 등이 참여해 토론을 한다.  joemedia@newsis.com뉴시스 뉴스, 네이버 뉴스 스탠드에서도 만나세요뉴시스 SNS [페이스북] [트위터]<저작권자ⓒ 공감언론 뉴시스통신사. 무단전재-재배포 금지.>"
6,2017.06.26. 오전 10:36,"부산시, 택시 운전석 격벽 설치 추진","수요 조사한 뒤 신청한 기사 차량에 한해 설치[부산CBS 박중석 기자]부산시가 택시기사의 인권보호와 안전을 위해 차량 내 격벽을 설치하는 방안을 추진하고 나섰다. 부산시는 택시 운전석 격벽 설치 등의 내용을 담은 '택시 운송사업 발전계획'을 추진한다고 26일 밝혔다.모두 5개 부문 23개 사업으로 구성된 발전계획은 예산 확보 등에 따라 단계적으로 진행될 예정이다. 시는 먼저, 올해 하반기부터 택시기사가 승객이 차량에 놓고 내린 휴대전화기를 신고하면 1만 원 상당의 포상금을 지급할 예정이다. 시는 이를 위해 올해 추가 경정예산에 1천8백만 원의 예산을 반영해 놓은 상태이며, 여기에 택시 조합 측이 신고 포상금을 추가 하는 방안을 검토하고 있다. 시는 이와 함께 올해 택시 과잉 공급 완화를 위해 2백대를 감차할 계획이다. 내년부터는 택시에 격벽을 설치하는 사업이 본격화한다. 시는 택시기사의 안전과 인권보호를 위해 수요를 조사한 뒤 격벽 설치를 지원할 방침이다.시는 기사들을 상대로 격벽의 설치 형태 등에 대한 의견을 물어 그 결과를 반영할 예정이다. 또, 내년 8월부터 비휠체어 중증 장애인을 위해 240대 가량의 장애인 전용 임차택시를 도입한다. 현재 휠체어 장애인을 위한 두리발과 비휠체어 장애인이 이용하는 '바우처콜'이 운영되고 있으나 바우처콜의 경우 운전자의 선택에 따라 배차가 이뤄진다는 불만이 제기되어 왔다. 시는 이 밖에 택시 내 무료 와이파이 서비스와 전기택시 도입, 기사들을 위한 지도와 앱 설치 등의 사업도 단계적으로 진행할 방침이다.부산시 송광행 대중교통과장은 ""예산 확보와 더불어 택시기사는 물론 시민단체들의 의견을 다양하게 반영해 사업을 추진할 예정""이라고 말했다. jspark@cbs.co.kr저작권자 © CBS 노컷뉴스(www.nocutnews.co.kr) 무단전재 및 재배포 금지		"
