,날짜,기사제목,기사내용
4,2019.08.28. 오후 3:53,"북구 금곡동, '우리 동네 교통안전지킴이' 발대식 개최","부산 북구 금곡동 '주민주도 마을계획 추진위원회'(위원장 박성흠)에서는 지난 19일 부산뇌변병복지관에서 장애인들을 대상으로 '우리 동네 교통안전지킴이' 발대식을 열고 교통사고 예방 교육을 실시했다.이번 발대식은 주민주도 마을계획 사업 중 '안전한 금곡동 만들기' 사업의 일환으로 추진되었으며, 장애인들도 교통안전지킴이로 동참하여 교통사고 예방 활동과 '안전한 마을 만들기 캠페인'을 적극 전개할 예정이다. 발대식 후에는 북부경찰서 경찰관을 초빙하여 교통사고 예방을 위한 교육을 실시해 안전에 대한 경각심을 높였다.주민주도 마을계획 추진위원회는 향후에도 공창ㆍ동원ㆍ화정종합사회복지관 노인 일자리 대상자 및 이용자들을 대상으로 교통사고 예방 안전교육을 이어나갈 계획이라고 밝혔다.박성흠 위원장은 ""교통사고 없는 안전한 금곡동을 만들기 위해서 지속적으로 교통사고 예방 교육과 캠페인을 실시하고 훼손된 도로를 찾아 신고하는 등 다양한 활동을 추진하겠다""고 말했다.디지털본부  news@busan.com"
5,2019.08.16. 오후 1:51,"부산도시철도 엘리베이터, 교통약자 인식 자동호출시스템 도입",【부산=뉴시스】 제갈수만 기자 =  부산교통공사는 장애인 등 교통약자가 도시철도 내 엘리베이터에 이용시 버튼을 누르지 않고도 자동 호출이 되는 시스템을 전국 최초로 개발·적용한다고 16일 밝혔다. 2019.08.16. (사진= 부산교통공사 제공)photo@newsis.com<저작권자ⓒ 공감언론 뉴시스통신사. 무단전재-재배포 금지.>		
6,2019.08.29. 오후 4:24,"부산시, 내년도 정부예산안 국비 6조6935억 확보","2019년 반영액 6조613억 대비 6322억 ↑부산시청 전경.부산시는 내년도 국비 확보액을 자체 집계한 결과, 총 6조6,935억원을 정부예산안에 반영했다고 밝혔다.이는 2019년 정부예산 반영액인 6조613억원 대비 6,322억원이 증액된 것으로, 복지와 투자 예산 두 분야 모두 증가했다. 복지 분야는 기초보장급여, 아동수당, 노인일자리, 장애인연금 등을 중심으로 전년 대비 4,158억원 증액됐으며, 투자 분야는 생활편의, 노후 인프라에 대한 안전투자 확대 등 내년도 정부예산 편성방향을 중심으로 2,164억원이 증액됐다.2020 정부 예산안에 반영된 투자분야 주요 국비사업은 시정 3대 핵심기조인 △일자리・혁신 △도시대개조 △시민행복이다.일자리・혁신 분야는 지역 경제활력 제고, 신성장 동력 확충 등 양질의 일자리를 창출하고 미래 먹거리가 되어줄 신규 사업이 반영됐으며, 주력산업인 해양(해운ㆍ물류ㆍ수산), 제조(자동차ㆍ조선ㆍ기계부품 등) 분야 등을 중심으로 융복합, 스마트화를 지원할 사업 예산도 중점 확보했다. 또 강화되는 친환경 규제에 선제 대비, 신재생에너지 관련 사업들과 수소차, 수소버스 구매 보조지원 등 수소사회 조기 전환을 이끌 핵심사업의 예산도 충실히 확보했으며, 창업 중심 혁신생태계 구축과 함께 청년 중심 일자리 창출 관련 예산도 안정적으로 확보해 향후 지원을 더욱 확대할 계획이다.도시 대개조 분야는 원활한 교통과 물류 흐름 구현을 위해 기존 대규모 도로・교량 확충 관련 사업 예산을 문제없이 확보했으며, 신규 도로 관련 사업도 정부안에 반영하여 향후 안정적 사업예산 확보를 기대할 수 있게 됐다. 아울러 도시재생활성화지역 등 기존 추진하던 도시재생 뉴딜 사업과 함께 도서관・체육관, 문화센터, 도시공원 등 지역주민의 생활과 밀접한 19개 중점투자 시설을 중심으로 생활SOC사업을 대거 확보, 지역 내 격차 완화와 경제 활력 제고 효과를 크게 기대할 수 있게 됐다.또 시민행복 분야는 시정 제1기조인 시민안전과 행복을 위해 매년 국회에서 반영되던 도시철도 노후시설 개선지원에 566억원을 최초로 정부안에 반영했으며, 사회적 재난으로 지정된 미세먼지 문제 해결 등 관련 분야 예산을 적극 확보해 시민 삶의 질 향상에도 크게 기여할 수 있게 됐다. 기타 신규사업으로 부산지역 민주열사를 기념하기 위한 민주공원 부속별관 3억원, 국내 최대 천연기념물 집적지인 을숙도 내 국립자연유산원 건립 1억원, 저출산 극복과 가족공동체 중요성을 고양하기 위한 가족센터 15억원, 부산항의 우수한 물류 인프라를 국제적으로 홍보할 수 있는 국제운송주선인협회연합회(FIATA) 2020 부산총회 지원비 9억원 등이 반영됐다.이런 성과는 주요 현안사업을 정부안에 반영하기 위해 그간 오거돈 시장이 기획재정부 홍남기 경제부총리, 구윤철 2차관, 안일환 예산실장을 예방, 사업을 설명하는 등 역량을 집중한 결과로 보인다. 부산시 관계자는 “올해는 ‘국비확보 추진 전담반’을 10월 초부터 조기 구성해 국회에 상주하면서 시의 모든 사업 예산에 대한 밀착 대응을 강화할 것”이라며 “지역의원의 예산심의 활동도 전방위 지원해 올해 시가 자체 목표한 6조9,000억원의 국비확보 목표액을 넘어서도록 총력을 다 할 계획”이라고 밝혔다. 목상균 기자 sgmok@hankookilbo.com▶[한국일보 페이스북 친구맺기] [한국일보 홈 바로가기]▶네이버 채널에서 한국일보를 구독하세요!"
7,2019.08.30. 오후 5:09,"[산청브리핑] 예산 편성 최초 5200억원 달성…""국가추경에 발빠르게 대응""","영세축산 무료순회진료…금서면에 소독·의약품 전달'약초의 고장' 산청군, 약초재배 전문가 71명 배출산청군이 제2회 추경을 통해 제1회 추경보다 291억원 늘어난 5228억원의 예산을 편성, 군의회에 제출했다. 이는 산청군 예산편성 이래 최초로 5000억원을 넘는 예산안이 편성된 것이다. 군은 동의보감촌 활성화 사업을 비롯해 복지와 지역개발 등 전 분야에 걸쳐 예산안을 마련했다.8월29일 군에 따르면 이번 추경에서 일반회계는 본예산보다 649억원(15.4%) 증가한 4844억원, 특별회계는 16억원(4.3%) 증가한 384억원이다. 주요 세출예산으로는 동의보감촌 활성화 사업에 35억원을 편성했다. 동의보감촌 외곽순환도로 개설 등의 사업이 포함됐다. 산청군청 전경. ©산청군복지부문에서는 장애인복지증진에 5억원, 노인복지증진에 19억원을 편성했다. 문화체육부문에서는 문화예술진흥에 5억원, 문화유산보존에 4억원, 건전한 체육활동지원에 14억원을 편성했다. 지역경제부문은 핵심국정과제인 일자리 창출을 위해 고용촉진과 근로자 복지증진에 9억원, 도시가스공급에 9억원, 투자유치활성화에 6억원을 편성했다. 지역균형개발을 위한 도시계획도로 개설 등 지속가능한 도시기반조성에 18억원, 지역현안사업을 비롯한 건설사업에 40억원, 상·하수도확충에 13억원을 편성했다. 농업부문에서는 한방약초산업육성에 8억원, 친환경 청정축산물 생산기반조성에 5억원, 전원농촌활력사업에 1억원, 농작물 시설사업 경쟁력강화에 4억원, 농산물 유통 수출지원에 5억원을 편성했다.분야별 주요 예산안은 일반공공행정 15억원(5.1%), 공공질서 및 안전 3억원(1%), 문화 및 관광 98억원(33.6%), 환경보호 18억원(6.2%), 사회복지 25억원(8.6%), 농림해양수산 62억원(21.3%), 산업·중소기업 18억원(6.2%), 수송 및 교통 12억원(4.1%), 국토 및 지역개발 36억원(12.3%) 등이다.산청군은 국가추경에 발빠르게 대응하고, 일본의 경제보복 등 대내외 경제여건 악화로 인해 민생경제가 위축되는 현상을 막기 위해 제1회 추경예산의 78% 수준으로 편성했다고 설명했다. 한편 2019년도 제2회 추경예산안은 9월3일까지 열리는 산청군의회 제261회 임시회에서 심의·의결을 거쳐 최종 확정된다.◇영세축산 무료순회진료…금서면에 소독·의약품 전달산청군이 여름철 폭염과 폭우 등으로 어려움을 겪은 영세 축산농가를 대상으로 무료 가축 순회진료를 실시했다. 군은 8월29일 금서면 지역 축산농가 240여곳을 대상으로 하절기 가축 무료 순회 진료 활동을 가졌다고 밝혔다.산청군이 여름철 폭염과 폭우 등으로 어려움을 겪은 영세 축산농가를 대상으로 무료 가축 순회진료를 실시했다. ©산청군이번 순회진료는 여름을 지나며 면연력이 저하된 가축들의 질병을 사전에 예방하기 위해 마련됐다. 진료는 산청군 수의사회 소속 6명의 공수의사가 경남도 동물위생시험소, 함양산청축협의 협조를 받아 진행됐다.특히 경남도동물위생시험소에서 가축 검진, 검사반을 투입해 각종 질병 검진·검사와 전염병 예방, 상담을 실시해 농가로부터 호응을 얻었다. 진료반은 폭염으로 면역력이 저하된 가축들에 적절한 의약품을 공급하고 축사주변 환경 개선을 위해 파리구제용 약품도 무료로 공급했다. 또 농장진입로와 농장내외 소독을 실시해 질병발생을 차단했다.산청군 관계자는 ""지속적인 농가지도와 방역활동 실시로 고품질 안전축산물 생산 기반을 다지고 안정적인 농장 운영이 가능하도록 적극 지원하겠다""고 밝혔다. ◇'약초의 고장' 산청군, 약초재배 전문가 71명 배출산청군이 지역을 대표하는 고품질 약초를 재배하고 홍보할 약초전문가 71명을 배출했다. 군은 지난 8월28일 오후 동의보감촌 다목적실에서 이재근 군수를 비롯한 내빈들과 수료생 등 70여명이 참석한 가운데 '2019년 약초재배 전문기술교육 수료식'을 개최했다.2019년 약초재배 전문기술교육 수료식 모습. ©산청군교육은 경남과학기술대학교에 위탁 운영해 지난 7월10일 개강해 8주간 총 14회에 걸쳐 귀농귀촌 희망자, 약초재배농가 등을 대상으로 실시했다. 주요 내용은 약초 재배·가공·유통 등 약초산업 관련 지식과 약초 전문인력 양성, 약초재배농가 확대 등에 대한 내용으로 채워졌다. 교육참여자들은 ""교육과정 구분을 떠나 교육내용이 알차고 흥미로워 다른 과정 수업도 청강했다""며 ""특히 8주간 교육을 받으면서 동료 교육생들과 약초재배 노하우나 기술 등에 대한 많은 정보를 공유할 수 있는 좋은 계기가 됐다""고 입을 모았다. 수료식에 참석한 이재근 군수는 ""산청군은 대한민국 한방항노화 산업의 거점이며 고품질 약초생산은 우리군 항노화산업의 기반구축을 위해 매우 중요한 부분""이라며 ""한방약초산업을 더욱 발전시킬 수 있도록 최대한 노력할 계획""이라고 강조했다. 부산경남취재본부 허동정 기자 sisa511@sisajournal.com<저작권자 ⓒ 시사저널, 무단 전재 및 재배포 금지>		"
8,2019.08.23. 오전 9:37,"기아차, 추석 귀향 시승 이벤트…셀토스·K9 등 300대 무상지원","중증 장애인 가정 선정 카니발 이지무브 차량 지원【서울=뉴시스】박주연 기자 = 기아자동차가 추석 연휴를 맞아 300대의 귀향 차량을 고객들에게 무상 대여해주는 '5박6일 시승 이벤트'를 벌인다.  기아차는 전국 지점을 통해 '셀토스'와 'K7 프리미어'를 비롯해 더 K9, 스팅어 등을 추석 귀향 차량으로 지원한다고 23일 밝혔다. 운전면허 소지자라면 누구나 23일부터 다음달 3일까지 기아차 홈페이지 이벤트 페이지를 통해 시승 신청을 할 수 있으며, 추첨을 통해 300명이 선정된다. 지원 대상자로 선정되면 다음달 11~16일까지 5박6일간 귀향 차량을 시승할 수 있다.기아차 관계자는 ""민족 대명절인 추석을 맞아 고객들이 기아차와 함께 안전하고 편안한 귀향길에 오를 수 있도록 시승 이벤트를 마련하게 됐다""며 ""특히 소형 SUV 시장에 돌풍을 일으키고 있는 '셀토스'와 급을 넘어서는 럭셔리함으로 세단의 품격을 높인 'K7 프리미어'를 통해 고객들에게 잊지 못할 추억을 선사할 것""이라고 말했다.한편 기아차는 신체적·경제적 어려움 등으로 명절 기간 동안 고향을 방문하기 어려운 중증 장애인 15개 가정을 선정하여 카니발 이지무브 차량을 무상 지원하는 '기아차 초록여행' 이벤트도 진행한다.이번 이벤트에 선정된 중증 장애인 15개 가정에는 다음달 10일부터 16일까지 6박7일간 카니발 이지무브 차량이 지원되며, 유류완충, 여행경비, 귀성선물 등의 혜택도 주어진다. 이벤트 참여를 원하면 이달 30일까지 초록여행 홈페이지에서 신청하면 된다.초록여행은 교통약자의 이동권 향상을 위해 수도권과 부산·경남, 광주·전남, 대전·충청, 강원권역 등 전국에서 장애인 여행지원 서비스를 제공하고 있다.pjy@newsis.com▶ 네이버에서 뉴시스 채널 구독하기▶ 뉴시스 빅데이터 MSI 주가시세표 바로가기 <저작권자ⓒ 공감언론 뉴시스통신사. 무단전재-재배포 금지.>		"
9,2019.08.23. 오후 3:46,"기아차, 추석 귀향 시승 이벤트 실시","셀토스·K7프리미어·더K9·스팅어 등총 300명 추첨해 6일간 시승기회기아자동차가 추석 연휴를 맞아 총 300대의 귀향 차량을 고객들에게 무상 대여해주는 5박 6일 시승 이벤트를 실시한다. 기아차는 전국 지점을 통해 셀토스, K7 프리미어, 더 K9, 스팅어 등을 추석 귀향 차량으로 지원한다고 23일 밝혔다. 운전면허 소지자라면 누구나 23일부터 내달 3일까지 기아차 홈페이지 이벤트 페이지를 통해 시승 신청이 가능하다. 기아차는 추첨을 통해 총 300명을 선정해 내달 11일부터 16일까지 5박 6일간 귀향 차량을 지원할 계획이다.기아차 관계자는 ""민족 대명절인 추석을 맞아 고객들이 기아차와 함께 안전하고 편안한 귀향길에 오르실 수 있도록 시승 이벤트를 마련하게 됐다""며 ""특히, 소형 스포츠유틸리티차량(SUV) 시장에 돌풍을 일으키고 있는 '셀토스'와 세단의 품격을 높인 'K7 프리미어'를 통해 고객분들께 잊지 못할 추억을 선사할 것""이라고 말했다.기아차는 신체적·경제적 어려움 등으로 명절 기간 동안 고향을 방문하기 어려운 중증 장애인 열 다섯 가정을 선정해 카니발 이지무브 차량도 무상 지원한다. 이벤트 참여를 원하는 고객은 오는 30일까지 초록여행 홈페이지에서 신청하면 된다. 초록여행은 교통약자의 이동권 향상을 위해 수도권과 부산·경남, 광주·전남 등 전국에서 장애인 여행지원 서비스를 제공하고 있다. [문지웅 기자]▶네이버 메인에서 '매일경제'를 받아보세요▶뉴스레터 '매콤달콤' 구독 ▶무궁무진한 프리미엄 읽을거리[ⓒ 매일경제 & mk.co.kr, 무단전재 및 재배포 금지]		"
10,2019.08.28. 오전 8:00,[전국 주요 신문 톱뉴스](28일 조간),"			▲ 경향신문 = 조국 의혹 전방위 압수수색…'검찰개혁 상징' 겨눈 검찰    ▲ 국민일보 = 윤석열의 검, 조국 의혹 찔렀다    ▲ 매일일보 = 日, 백색국 韓 제외…전면전 치닫는 韓日    ▲ 서울신문 = 조성욱 공정위원장 후보자 간담회, ""호반 불공정행위 엄정하게 법 집행""    ▲ 세계일보 = 칼 빼든 檢…'조국 의혹' 전방위 수사    ▲ 아시아투데이 = '조국 의혹' 고강도 수사…새 변수    ▲ 일간투데이 = 일본, 오늘부터 '韓 화이트리스트 제외' '日창 vs 韓방패' 본게임 시작됐다    ▲ 조선일보 = 검찰, 조국 집 빼고 20여곳 압수수색    ▲ 중앙일보 = 조국 사태, 윤석열이 먼저 움직였다    ▲ 한겨레 = 조국 청문회 앞 초유의 압수수색…'검찰 정치개입' 논란    ▲ 한국일보 = 청문회 前…윤석열 칼날 위에 선 조국    ▲ 디지털타임스 = ""0.1% 日원료도 안된다""…점점 세지는 '불매'    ▲ 매일경제 = '조국 의혹' 압수수색 법무부엔 사후 보고    ▲ 서울경제 = 앞으로 석달…통상 퍼펙트스톰 몰아친다    ▲ 아시아타임즈 = 日 ""한국 백색국가 배제 변함없다""    ▲ 아주경제 = 사상 첫 '제로금리 시대' 온다    ▲ 에너지경제 = 금감원, 증권사 고금리 장사에 '헛칼질'?    ▲ 이데일리 = 실손보험 팔면 손해 판매 접는 보험사들    ▲ 이투데이 = 북서울농협, ""무자격자 감싸고 기존 조합원 강제 퇴출""    ▲ 일간리더스경제 = 금투협 ""부산 창업기업 지원 확대""    ▲ 전자신문 = 공정위 '망 이용대가 차별' 위법성 따진다    ▲ 한국경제 = ELS 114兆…금융 불안 '뇌관' 되나    ▲ 건설경제 = 뒤로 딴소리하는 국회    ▲ 전국매일 = 日 추가규제 예의주시…내부기반 다지기 총력    ▲ 경기신문 = 교통지옥 불 보듯…대형쇼핑몰 개점 갈등    ▲ 경기일보 = 여성 독립운동가 202명 찾았다더니…포상자 69명 뿐    ▲ 경인일보 = 실패한 '공공기관 이전' 시즌2가 웬말    ▲ 기호일보 = 인천시, 남북 교류 키포인트 '강령·남포' 눈도장    ▲ 신아일보 = '조국 의혹' 전방위 압수수색…與 '당혹'    ▲ 인천일보 = 35분 탑승에 8000원…월미바다열차 10월8일 개통    ▲ 일간경기 = 용인 반도체 특화 클러스터 인근 '땅값 안정' 처방    ▲ 중부일보 = 일자리가 국력이다, ""이재명號 일자리 93% 비정규직""    ▲ 중앙신문 = 월미바다열차 10년 만에 첫 시동 켠다    ▲ 현대일보 = '공존' 통해 도민행복 실현…경기도의회 개원 63주년 기념식    ▲ 강원도민일보 = 양양주민·재경군민 3000명, ""강원도 꿈, 친환경 오색케이블카 즉시 승인해달라""    ▲ 강원일보 = 양양주민·장애인協, ""장애인도 설악산 오를 기회를 달라""    ▲ 경남도민신문 = 진주 장기미집행 도시공원 사유지 75%, 부작용 '우려'    ▲ 경남도민일보 = 이주노동자 퇴직금제도 '빈손 귀국' 양산    ▲ 경남매일 = '조국 효과' 학종 이대로 괜찮나    ▲ 경남신문 = 김해공항 '초과 소음' 제주 37배·김포 10배    ▲ 경남일보 = 스마트팜 혁신밸리 청년 창업의 장으로    ▲ 경북매일 = 울릉도 독도 바다 전용 연구선 뜬다    ▲ 경북연합일보 = 대형 국제 행사 유치로 관광 촉진 일자리 창출 두 토끼몰이 나선 경북    ▲ 경북일보 = 경북·대구의 미래, 과학기술 혁신이 답이다    ▲ 경상일보 = 울산시 ""입주시점 적용"" vs 세영 ""소급적용 부당""    ▲ 국제신문 = 조국에 칼 빼든 檢…부산·경남 '회오리'    ▲ 대경일보 = '크루즈로 우아하게' 포항~러시아 물길 열린다    ▲ 대구신문 = 통합신공항 이전지 '선정 룰' 놓고 삐걱    ▲ 대구일보 = 입장료 올려 직원 늘린다더니 오히려 관리자 줄어든 이월드    ▲ 매일신문 = 국방부 ""통합신공항 속도 내겠다""    ▲ 부산일보 = 조국 겨눈 檢…윤석열의 벼린 칼?    ▲ 영남일보 = 檢 전격 압수수색 '조국 정국' 예측불가    ▲ 울산매일 = 울산시, ""울산항 '액화수소 허브화' 북극항로 서비스 개발해야""    ▲ 울산신문 = 북방지역 물류 활성화 포럼, ""울산, 액화수소 관련 북극권 비즈니스 강화해야""    ▲ 울산제일일보 = 市, ""북방지역 물류 활성화 대비해 액화수소 북극 비즈니스 개발을""    ▲ 창원일보 = 검찰, 진해 웅동학원ㆍ부산대 의전원 `압수수색`    ▲ 광남일보 = [현장속으로] 철새 서식, 악취 '진동'·소음 '극심'    ▲ 광주매일 = 檢, '조국 의혹' 수사 착수    ▲ 광주일보 = 전남 농어촌 빈 집 어떻게 하나    ▲ 남도일보 = 시내버스 수 백억 지원…시민 절반 ""모른다""    ▲ 전남매일 = 오늘부터 일본 수출 규제…지역경제계 파장 촉각    ▲ 전라일보 = 도내기업 일본산 소재-부품 대체 가능    ▲ 전북도민일보 = 道 지역연고 국회의뤈 초청 간담, ""전북현안 해결·국비확보 초당적 협력""    ▲ 전북일보 = 의료비 역외 유출 전북 해마다 증가    ▲ 호남매일 = '광주형일자리' 주거단지 조성한다    ▲ 금강일보 = 명절특별자금 지원정책 체감 힘들다    ▲ 대전일보 = 대전 유성구 고분양가 주범    ▲ 동양일보 = 한민족 여성리더축제 청주서 막 오르다    ▲ 중도일보 = 대세밸리, 3개 시도 '케미'가 필요하다    ▲ 중부매일 = 전국 첫 '3번 연임' 정초시 충북연구원장, ""충북 미래 책임진다는 사명감 갖고 연구 매진""    ▲ 충청일보 = 19회 세계한민족여성네트워크 대회, 청주서 팡파르    ▲ 충청투데이 = 충남지역 해수욕장 방문객수 '반토막'    ▲ 제민일보 = '솜방망이 처벌' 인식 고착화 우려    ▲ 제주매일 = ""번개에 천둥까지""…道 전역 게릴라성 폭우 '물폭탄'    ▲ 제주신문 = 제주공항 복합환승센터 '안갯속' 동광 일반·동부 외곽 우선 추진    ▲ 제주新보 = 총선에 도민 끌어들인 원 지사    ▲ 제주일보 = 오라단지 사업 추진 향방 '분수령'    ▲ 한라일보 = 오늘 제주도-반대위 '제2공항 토론회'    ▲ 메트로신문 = 反시장·反기업 외치는 강남진보, 재산은 수십억대(서울=연합뉴스)▶확 달라진 연합뉴스 웹을 만나보세요▶네이버 [연합뉴스] 채널 구독   ▶뭐 하고 놀까? #흥"
