,날짜,기사제목,기사내용
0,2019.02.27. 오후 2:55,"부산경찰, 장애인 모자 전동휠체어 충돌사고 현장 도로환경 개선","			【부산=뉴시스】 하경민 기자 = 부산경찰청은 지난 26일 오전 장애인 모자 탑승 전동휠체어 충돌사고 현장에 대한 유관기관 합동 점검을 실시해 도로환경을 개선을 추진하기로 했다고 27일 밝혔다. 먼저 부산경찰은 사고현장인 영도구 와치복지관 인근 교차로 진입 전 차량 속도를 낮추기 위해 기존에 설치된 횡단보도를 고원식 횡단보도로 교체하고, 좌회전 유도선을 설치할 예정이다.또 횡단보도 투광기 설치와 가로수 전지 작업 등 조명 환경을 개선해 운전자 시야 확보하는 등 전반적인 도로 환경을 개선할 계획이다. 아울러 노인·장애인 등 교통약자를 대상으로 실효성 있는 교통안전 교육을 지속적으로 전개하고, 전동휠체어 전·후면에 부착할 수 있는 고휘도 반사지 및 야광조끼를 배부하는 등 야간 교통사고 예방책을 추진할 방침이다.더불어 택시 등 사업용 차량에 의한 교통사고 예방 활동을 강화할 계획이다.앞서 지난 26일 0시 10분께 부산 영도구 와치복지관 앞 도로에서 쏘나타 택시와 장애인 모자가 함께 타고 있던 전동휠체어가 충돌, A(67·여)씨가 숨지고 아들 B(44)씨가 중상을 입고 병원에서 치료를 받고 있다. 장애가 있는 B씨는 밤늦게 퇴근하는 어머니를 마중 나갔다가 지친 어머니와 함께 전동휠체어를 타고 오르막 도로를 지나다가 사고를 당한 것으로 전해졌다.yulnetphoto@newsis.com▶ 네이버에서 뉴시스 채널 구독하기▶ 뉴시스 빅데이터 MSI 주가시세표 바로가기 <저작권자ⓒ 공감언론 뉴시스통신사. 무단전재-재배포 금지.>		"
1,2019.02.27. 오후 3:21,오거돈 부산시장 교통사고 장애인 위로,     (부산=연합뉴스) 조정호 기자 = 27일 오후 부산 영도구에 있는 한 병원에서 오거돈 부산시장 등이 장애인 전동 스쿠터를 타고 귀가하던 중 교통사고로 어머니를 잃고 다발성 골절로 병원 치료를 받는 장애인 손모씨를 찾아 위로하고 있다. 2019.2.27 ccho@yna.co.kr▶네이버 홈에서 [연합뉴스] 채널 구독하기▶뭐 하고 놀까? #흥  ▶기사보다 생생한 북미회담 소식 '뉴스라이브'
2,2019.02.26. 오후 5:47,휠체어 함께 탄 장애인 모자...  교통사고로 어머니 숨져,"			[서울신문]전동휠체어를 타고 오르막길을 오르던 모자가 택시에 치여 어머니가 숨지고 아들도 부상을 입는 안타까운 사고가 발생했다.26일 부산 영도경찰서에 따르면 이날 0시 10분쯤 부산 영도구 동삼동 한 왕복 2차로 도로에서 택시(운전기사 문모·56)와 전동휠체어가 충돌했다.전동휠체어에는 장애인 손모(44)씨와 손씨 어머니 이모(67)씨가 함께 타고 있었다.이 사고로 어머니 이씨가 뇌출혈 등으로 의식을 잃고 병원으로 옮겨져 긴급 수술을 받았으나 끝내숨졌다.다.아들도 중상을 입고 응급실에서 치료를 받고 있다.경찰은 밤늦게 일을 마치고 퇴근한 어머니를 아들이 마중 나갔다가 사고를 당한 것으로 파악했다.사고는 오르막길로 아들이 지친 어머니를 무릎에 태워 전동휠체어를 타고 가던 중 일어났다.경찰은 택시가 좌회전해 해당 도로로 진입하자마자 전동휠체어와 부딪쳤다고 밝혔다.모자를 태운 전동휠체어는 차선을 역주행하는 상태였다.경찰은 현장 주변 폐쇄회로(CC)TV를 확보하고,택시 기사 문씨가 전방주시 의무 등을 위반했는지 조사하고 있다.경찰은 “택시나 전동휠체어 모두 속도가 빠르지 않은 상황이었다”면서 “사고 충격 자체는 크지 않았던 것으로 보이지만 모자가 휠체어 등에 함께 타고 있어 어머니가 머리 등이 바닥에 부딪히며 중상을 입은 것 같다”고 설명했다.아들은 지체 장애 5급,어머니는 청각 장애 4급으로,그나마 몸을 움직일 수 있는 어머니가 일을 해 번 돈과 기초생활수급비,장애인 수당 등을 합쳐 생활 해왔다.지체 장애 3급인 아버지는 2016년 숨진것으로 알려졌다.부산김정한 기자 jhkim@seoul.co.kr▶ 네이버에서 서울신문 구독하기 ▶ 재미있는 세상[나우뉴스] [서울신문 페이스북]ⓒ 서울신문(www.seoul.co.kr), 무단전재 및 재배포금지		"
3,2019.02.27. 오후 7:30,전동보장구 장애인 10만명…그들이 차도로 내몰리는 이유는(종합),"이용자 10년 만에 5배 증가…노인 이용자까지 합치면 더 많아법상 보행자라 인도 이용, 통행 여건은 엉망진창…사고 빈발 불법이든 합법이든 인도 위 시설물 수두룩…안전장치 법제화 필요전동보장구가 고속도로 진입하는 사례도…안전교육 시스템도 시급전동휠체어 탄 장애인 모자 참변[부산지방경찰청](전국종합=연합뉴스) 차근호 기자 = ""전동휠체어 타고 집 밖 나갈 때마다 두렵습니다. 특히 밤에는 목숨을 건 외출일 때가 많죠.""    이동 시 전동보장구에 의지해야 하는 어느 지체장애인의 하소연이다.    전동휠체어와 같은 전동보장구가 장애인과 노인의 대표적인 이동수단으로 자리 잡았지만 열악한 인도 환경 탓에 이용자가 차도로 내몰리면서 크고 작은 사고가 잇따른다.    제대로 된 장애인 보행환경 조성에 대한 인식이 부족하고, 전동보장구에 대한 안전교육이 없는 등 관련 제도는 제자리걸음을 하고 있다. 27일 통계청 '주요 장애인 보조기구 필요 및 소지 현황'을 보면 전동보장구(전동휠체어, 전동스쿠터) 소지자는 2017년 기준 10만2천명으로 집계됐다. 2005년부터 전동보장구 구입 시 국민건강보험 급여비 혜택이 적용되면서 이용자가 10년 만에 5배가량 늘었다.     장애인 외에도 고령의 노인들이 전동보장구를 이동수단으로 쓰는 경우도 많아 실제 소유자는 이보다 훨씬 많은 것으로 알려진다. 교통약자 통행 방해하는 가로수[차근호 기자]    하지만 전동보장구를 타기에는 우리나라 인도 여건이 매우 열악한 상황이다.    전동보장구는 도로교통법상 자동차가 아닌 '보행자'여서 인도로만 다녀야 한다.     한국장애인개발원에 따르면 우리나라 인도 유효 폭은 2m 이상이다.     지형상 불가능하거나 기존 인도를 증축 개축이 불가능할 경우 1.2m 이상으로 유지하면 된다.     가로수나 전신주, 간판을 설치할 때도 교통약자의 통행에 지장을 주지 않게 보행 안전지대 밖에 설치하도록 하도록 법은 규정하고 있다.     하지만 현실에서는 이런 법이 지키지 않는다.     가로수나 도로 시설물이 인도 한복판에 불쑥 설치돼 통행을 막는 경우가 다반사다.교통약자 보행 방해하는 불법 시설물[차근호 기자]    불법 시설물이나 조경을 위한 화단, 버스정류장도 무분별하게 놓여 있다.    보도블록으로 된 인도 침하나 벌어짐 현상이 자주 발생해 장애인들이 인도에서 전동보장구를 탈 때는 안전사고를 걱정해야 하는 상황이다.    안성준 한국장애인개발원 UD환경팀장은 ""전동보장구 이용자들은 일반 이용자들보다 자체 무게와 속도 때문에 사고 발생 시 크게 다치는 경우가 많아 주의해야 한다""라고 지적했다.    그는 ""한국은 차도 중심으로 시스템이 마련돼 있어 전동보장구 이용자들이 인도를 오르락내리락 힘이 든다. 이용자들이 단차(높낮이)가 없는 차도를 선호할 수밖에 없는 구조""라고 덧붙였다.좁은 보행로에 도로로 내몰린 전동휠체어[차근호 기자]    이 탓에 사고도 잇따른다.     지난 26일 0시 10분께 부산 영도구에서는 장애인 아들이 엄마를 무릎에 앉혀 함께 전동스쿠터를 타고 차도로 오르막길을 오르다가 택시에 부딪혀 어머니가 숨지고 아들이 다치는 사고가 발생했다.     사고 현장 바로 옆에는 인도가 있었지만, 인도 환경이 열악해 장애인 모자가 도로를 이용했던 것으로 알려진다.     지난해 12월에는 전남 곡성에서 전동휠체어를 타고 1차선 도로를 달리던 70대 장애인이 1t 트럭에 치여 사망했다.    지난해 8월 충북 청주에서는 전동휠체어를 타고 차도를 달리던 70대 노인이 택시와 충돌했다. 전동스쿠터를 이용하는 고령 노인이나 일부 장애인의 경우 안전의식이 떨어지는 것도 사고의 원인으로 꼽힌다.    현재 전동스쿠터를 몰기 위해서 별도 면허나 안전교육 이수는 필요 없는 상태다.    일부 노인의 경우 전동스쿠터를 인도에서 몰아야 하는지조차 모르는 경우도 있는 것으로 알려졌다.     실제로 지난해 경부고속도로에서 전동휠체어를 몰며 도로를 역주행하던 90대 여성이 경찰에 구조됐고, 2017년 10월에도 70대 남성이 전동스쿠터를 타고 중앙고속도로로 진입하기도 했다.     도로교통공단 한 관계자는 ""전동휠체어나 전동스쿠터 이용자를 위한 교통안전 교육과 안전장치 설치 법제화 등도 필요하지 않겠나 생각한다""면서 ""안전운전 상식, 전동보장구 점검법 등 필수 소양은 운전자가 익히고 있어야 한다""고 밝혔다.    부산경찰청 교통과 이동관 경장은 ""심야 전동휠체어 안전 운행을 위해 휠체어 앞뒤로 고휘도 반사지를 부착하거나 이용자가 야광 조끼 등을 입는 것이 도움 된다""면서 ""부산경찰청은 모자 비극 사고를 계기로 교통 약자에게 반사지 등 안전장비를 무료로 나눠주고 실효성 있는 교통안전 교육도 지속할 것""이라고 말했다. ready@yna.co.kr▶네이버 홈에서 [연합뉴스] 채널 구독하기▶뭐 하고 놀까? #흥  ▶기사보다 생생한 북미회담 소식 '뉴스라이브'"
4,2019.02.04. 오전 8:24,"[설, 잊힌 존재들]④장애인 귀성길은 유독 멀었다…""내년엔 버스로 갈 수 있겠죠?""","국내엔 아직 휠체어 탑승가능한 시외·고속버스 없어십수년째 아버지 납골당 찾지 못하는 안타까운 사연도교통약자법 개정…국토부 휠체어 탑승 버스 개발중장애인들 ""운송사업자 도입 의무조항 없어 걱정""지난달 31일 오후 서울 용산역에서 인터뷰 중인 뇌병변 1급 장애인 이흥호(49)씨.(사진=신중섭 기자)[이데일리 신중섭 기자] “내년 설날엔 저도 편하게 버스를 타고 고향에 갈 수 있을까요?”부산에 살고있는 뇌병변 1급 장애인 이흥호(49) 씨가 설 연휴에 고향 세종시 조치원으로 갈 수 있는 방법은 기차밖에 없다. 국내에는 아직 이씨처럼 휠체어를 탄 장애인들이 탑승할 수 있는 시외·고속버스가  없기 때문이다.비장애인들은 기차표를 구하지 못하더라도 20~30분 간격으로 줄줄이 이어지는 시외·고속버스 중 하나를 잡아타면 되지만 이씨와 같은 장애인들은 하루에 단 몇 차례 정해진 시간에 기차를 타는 방법밖에 없다. 최근 장애인을 위한 버스를 도입하기로 결정했지만 아직 상용화까지는 요원한 상황이다. 설 명절 연휴를 하루 앞둔 1일 오전 서울 서초구 서울고속버스터미널 승강장에서 국토교통부의 휠체어 탑승 가능 고속버스 시승 행사에 참여한 장애인이 휠체어에 탄 채 리프트를 이용해 버스에 탑승해 안전 장치를 고정하고 있다. (사진=연합뉴스)◇국내 휠체어 탑승 가능 시외·고속버스 단 1대도 없어지난 2016년 말 기준 전국 고속·시외버스 총 1만 730대 중 휠체어 사용자 탑승 편의시설이 갖춰진 버스는 한대도 없다. 모두에게 명절 연휴 귀경길은 전쟁이지만 휠체어를 탄 중증 장애인들에게는 더욱 고역이다. 그들에겐 집 근처에 있는 버스터미널 대신 집 멀리에 있는 기차역으로 가는 것부터가 난관이다. 휠체어를 타고 탑승이 가능한 저상버스가 올 때까지 기다려야만 한다. 기차역에 도착해서도 마찬가지다. 모든 기차가 휠체어를 탄 승객의 편의를 고려하고 있는 것은 아니어서 이를 이용하려면 몇시간이고 기다려야 한다는 게 그들의 설명이다.이씨는 “기차 중에는 출입문이 좁아 전동휠체어 탑승이 불가능한 열차도 있다”며 “휠체어 탑승이 가능한 열차가 올 때까지 10시간 가까이 마냥 기다린 적도 있었다”고 말했다. 그렇게 고향에 도착하면 또다시 집으로의 이동을 걱정해야 했다. 이씨와 같은 어려움을 겪는 장애인들은 한두 명이 아니다. 시외 버스 중 간혹 버스 화물칸이 높은 경우엔 전동휠체어를 분해해 간신히 구겨 넣으면 탑승할 순 있지만, 부품 분실 문제와 번거로움 때문에 선뜻 탑승하기는 힘들다. 더욱이 휴게소에서 화장실을 가고 싶어도 잠깐을 위해 다시 조립과 분해를 부탁하기도 부담스럽다. 이처럼 장애인이 귀성길이 오르기엔 만만치 않은 일들이 많기에 아버지 장례 이후 십수 년이 지나도록 납골당도 찾지 못하는 안타까운 사연도 있다. 미국의 대표 고속버스 업체인 ‘그레이하운드’는 2001년 이후 제작된 모든 버스에 휠체어 리프트를 설치하고 있고, 영국 역시 2000년부터 22석 이상 대중교통 수단은 저상버스로 운영하고 있다. 이러한 선진국의 사례를 비교해 보면 우리나라의 장애인에 대한 배려는 여전히 추진적이다.  ◇휠체어 탑승 가능 버스 도입 앞뒀지만, 우려도 상존장애인들의 ‘이동권 투쟁’은 지난 2001년 오이도역 장애인 리프트 추락사에서 시작됐다. 그 결과 2005년 ‘교통약자의 이동편의 증진법(교통약자법)’이 제정됐다. 법에 따라 휠체어 이용 장애인이 탑승할 수 있는 저상버스가 시내버스에 도입되기 시작했지만 고속·시외버스엔 한 대도 도입되지 않았다.이 때문에 휠체어 사용 장애인들은 명절마다 ‘장애인 시외이동권 투쟁’을 하러 버스터미널로 향해야 했다. 2014년부터 시작된 투쟁 끝에 지난 2017년 9월 추석, 김현미 국토교통부 장관은 ‘장애인 이동권 민관협의체 구성’을 약속했고 지난해 1월 장거리 버스에 휠체어 탑승 시설을 설치할 근거가 추가된 ‘교통약자의 이동편의 증진법’ 개정안이 국회 본회의를 통과했다.국토부는 지난해 휠체어 사용자가 이용 가능한 고속·시외버스 도입을 위해 지난 2017년 4월부터 올해 9월까지 ‘휠체어 탑승설비 장착 고속·시외버스 표준모델 및 운영기술’을 개발한다고 밝혔다. 지난해 9월과 설연휴를 앞둔 지난 1일에는 버스 시승식도 열렸다. 하지만 우려도 적지 않다. 막상 도입 버스 숫자가 극히 적다거나 철도 노선과 겹치는 주요노선만 운행할 경우 무용지물 아니냐는 지적이 나온다. 또, 통과된 교통약자법 개정안도 운송사업자가 휠체어 탑승설비를 버스에 설치해야만 한다는 의무조항을 담고 있지 않아 사업자들이 자발적으로 버스를 도입할 가능성은 낮을 것이라는 지적도 있다.조현수 전국장애인차별철폐연대 정책실장은 “휠체어 탑승설비 버스 도입시 면허를 우선 부여한다는 내용만 있을 뿐 도입을 하지 않는다고 해서 페널티를 준다는 내용은 없다”며 “운송 사업자 측에서 버스 도입에 대한 재정지원 뿐 아니라 좌석 수 감소로 발생되는 손실보전금까지 요구하는 상황”이라고 밝혔다.조 정책실장은 “향후 국토부는 현재 수립 중인 계획에 시범사업 결과를 반영해 수정할텐데 최소 향후 10년 이내에 전체 시외·고속버스의 50%는 휠체어 탑승 시설을 갖춰야 하는 방향으로 가야한다”고 말했다.신중섭 (dotori@edaily.co.kr)이데일리 채널 구독하면 [방탄소년단 실물영접 기회가▶]꿀잼가득 [영상보기▶] , 빡침해소!청춘뉘우스~ [스냅타임▶]＜ⓒ종합 경제정보 미디어 이데일리 - 무단전재 & 재배포 금지＞"
5,2019.02.27. 오후 5:35,'도움 되고 싶었는데…' 장애인 아들 눈물…각계 온정 손길(종합),"			영도구 치료비·장례비 간병인 지원…부산시도 위로금 전달 부산경찰청 ""사고 도로 환경 개선, 교통약자 안전교육""오거돈 부산시장 교통사고 장애인 위로(부산=연합뉴스) 조정호 기자 = 27일 오후 부산 영도구에 있는 한 병원에서 오거돈 부산시장 등이 장애인용 전동 보장구(스쿠터)를 타고 귀가하던 중 교통사고로 어머니를 잃고 다발성 골절로 병원 치료를 받는 장애인 손모씨를 찾아 위로하고 있다. 2019.2.27 ccho@yna.co.kr(부산=연합뉴스) 조정호 차근호 기자 = ""저 때문에…(엄마가 돌아가셨습니다)"" 27일 오후 부산 영도구에 있는 한 병원에서 치료를 받는 손모(44) 씨는 끔찍했던 사고 순간을 떠올리며 눈물을 흘렸다.    손씨는 ""차가 오는 소리를 듣고 쳐다보는 순간 사고를 당했다""며 ""바닥에 쓰러진 어머니 머리에서 피가 흘러내리는 것을 봤다""고 말했다.    그는 사고로 가슴과 발 등 3곳에 다발성 골절을 입어 치료를 받고 있어 어렵게 말 문을 열었다.     지체장애인인 손씨는 매일 밤 목욕탕 일을 마치고 돌아오는 엄마를 마중 나갔다고 한다.    손씨는 다리가 불편해 직장을 구하지 못했고 어머니 이모(67) 씨가 엄마 혼자 목욕탕 일을 해서 생계를 꾸려나갔다.    손씨는 미안한 마음에 조금이라도 도움이 되고 싶어 자신이 타는 장애인용 전동 보장구 앞에 엄마를 태우고 집으로 오곤 했다고 한다.    영도구 구민장례식당에 마련된 이씨 빈소에는 손씨 동생 부부가 상주로서 조문객을 맞았다.영도구 장애인 교통사고 현장[부산경찰청 제공]    이씨 며느리는 ""어머니가 목욕탕 일을 하다가 넘어져 허리를 다쳐 압박 붕대를 하고 다녔고 류머티즘 관절염으로 무릎도 안 좋아 가파른 경사길을 걸어가기 힘들어 아주버니가 큰 도로까지 마중 나가 장애인 전동기에 태워서 왔다""고 안타까워했다.    이번 사고는 26일 0시 10분께 영도구 동삼동 한 왕복 2차선 도로에서 발생했다.    전동 보장구와 택시가 충돌해 전동기에 탄 장애인 어머니가 숨지고 장애인 아들은 다발성 골절로 병원 치료를 받고 있다. 아들은 지체 장애 5급, 어머니는 청각 장애 4급이었다.    그나마 몸을 움직일 수 있는 어머니가 일해 번 돈과 기초생활수급비, 장애인 수당 등을 합쳐 생계를 유지했다.    안타까운 사연이 알려지면서 각계에서 온정의 손길이 이어지고 있다.    오거돈 부산시장은 27일 오후 김철훈 영도구청장, 김비오 민주당 중·영도구 지역위원 등과 함께 손씨가 입원 치료 중인 병원을 방문, 위로하고 쾌유를 빌었다.장애인 전동스쿠터 이동 힘든 울퉁불퉁한 인도[촬영 차근호]    부산시 간부 공무원들이 십시일반으로 모은 성금을 손씨에게 전달했다.    영도구는 손씨 병원에 간병인을 지원하고 장례비와 병원 치료비 등을 지원하기로 했다.    민주당 중구·영도구 지역위원회는 손씨를 돕기 위해 모금하는 방안을 논의하고 있다.    부산경찰청은 사고 발생 도로 환경 개선과 장애인 교통사고를 줄이기 예방 활동에 나서기로 했다.     경찰은 사고 도로 일대 차량 속도를 줄이기 위해 횡단보도 2곳을 과속방지턱 기능을 겸한 고원식 횡단보도로 교체하기로 했다.     사고 당시 가로등이 있었지만 일대가 밝지 않았다고 판단해 횡단보도 등에는 투광기를 설치하고, 가로수 전지 작업과 좌회전 유도선도 그릴 예정이다.    반사지가 부착돼 있지 않은 전동보장구 이용자에게 고휘도 반사지와 야간 조끼 등을 무료로 배부해 심야 교통사고 예방을 하기로 했다.    택시 등 사업용 차량 교통사고를 줄이기 위해 사고 다발 운수회사에 대해 컨설팅과 업체 준수사항 점검도 할 계획이다. ccho@yna.co.kr▶네이버 홈에서 [연합뉴스] 채널 구독하기▶뭐 하고 놀까? #흥  ▶기사보다 생생한 북미회담 소식 '뉴스라이브'"
6,2019.02.27. 오전 9:10,[자막뉴스] 부산 휠체어 교통사고가 더욱 안타까운 이유,"			늦은 시각 주택가를 달리던 택시.좌회전하자마자 전동휠체어가 나타나고 미처 피할 새도 없이 부딪치고 맙니다.주변이 너무 어두워 휠체어를 제대로 보지 못했습니다.[정도권 / 부산 동삼동 : 시내처럼 건물 상가가 있으면 조금 밝은데 주거지다 보니 밤이 되면 가로등이 있어도 어둡죠.]전동휠체어에는 60대 어머니와 장애인인 40대 아들이 함께 타고 있었습니다.앞에 앉아 있던 어머니는 사고 충격을 고스란히 받으면서 현장에서 의식을 잃었고 뒤에 앉아 있던 아들도 충격으로 날아가면서 심하게 다쳤습니다.전동휠체어에 모자가 함께 탄 건 이유가 있었습니다.늦은 시각 목욕탕에서 일을 마친 어머니가 안쓰러웠던 아들의 배려로 보입니다.[경찰 관계자 : 어머니가 밑에 일하는 헬스장(목욕탕)에서 오는 걸 아들이 태워 (집으로) 오는 중이었던 것 같아요.]의식을 잃고 병원으로 옮겨진 어머니는 수술을 받았지만 결국 숨졌습니다.성실하게 일하며 몸이 불편한 아들까지 살뜰하게 챙겼던 어머니의 죽음에 이웃들은 안타까움을 감추지 못했습니다.[이웃 : 착하죠, 성실하고. (장애인) 아들이니까, 목욕탕을 청소하니까 목욕을 시켜주고 데려가고 하더라고요.]경찰은 주변 CCTV를 확보해 정확한 사고 경위를 가릴 계획입니다.취재기자ㅣ김종호촬영기자ㅣ강현석자막뉴스ㅣ서미량 ▶ 제2차 북미정상회담 관련 생방송 보기  ▶ YTN 유튜브 채널 구독하고 백화점 상품권 받자! [저작권자(c) YTN & YTN PLUS 무단전재 및 재배포 금지]		"
