,날짜,기사제목,기사내용
0,2022.10.21. 오전 10:32,전국 버스터미널 교통약자 서비스 30%에 그쳐…보청기 대여는 '0',"[국감브리핑] 최인호 '2021년 교통약자 이동 편의 조사' 공개점자책자 비치·수어통역 서비스 1~2곳뿐…공항, 89%로 '최고'서울 서초구 고속버스터미널에서 귀성객 및 여행객들이 버스 탑승 준비를 하고 있다. (사진은 기사 내용과 무관함)2022.9.8/뉴스1 ⓒ News1 이승배 기자(부산=뉴스1) 노경민 기자 = 장애인, 고령자 등 교통약자를 위한 전국 버스터미널의 편의 서비스 제공률이 크게 낮은 것으로 나타났다. 특히 청각장애인이 이용할 수 있는 보청기기를 대여하는 터미널은 단 한곳도 없어 시급한 대책 마련이 요구된다.21일 국회 국토교통위원회 소속 더불어민주당 최인호 의원(부산 사하갑)이 한국교통안전공단으로부터 받은 '2021년 교통약자 이동 편의 실태조사' 자료에 따르면 전국 버스터미널, 철도역사 등 1436곳의 여객시설 내 교통약자 이용 편의 서비스 제공률은 약 43%로 나타났다.가장 취약한 서비스는 보청기기 대여 서비스로 전국 여객시설의 2.2%만 제공하고 있다. 점자안내책자가 비치된 곳은 2.9%에 불과하고, 한국수어통역 서비스 제공 6.3%, 팩스비치 12%, 휠체어 대여 39% 순으로 교통약자를 위한 서비스가 취약한 것으로 집계됐다.공항의 경우 서비스 제공률이 88.9%로 비교적 복지가 잘 지켜지고 있는 것으로 조사됐다. 하지만 버스터미널이 30.4%로 가장 낮아 교통약자에 대한 배려가 크게 부족한 것으로 나타났고 △지하철·광역철도 역사 42.1% △철도역사 53.4% △여객선터미널 59.3% 순으로 서비스 제공률이 낮았다.특히 전국에서 보청기기를 대여하는 버스터미널은 없는 것으로 나타났다. 낮은 서비스 제공률을 기록한 버스터미널의 경우 전국 240곳 중 발권지원 서비스(매표소 직원 서비스)는 153곳(63.8%)에서 제공되고 있지만, 점자안내책자가 비치된 곳은 단 한곳뿐이고, 수어통역도 2곳에서만 하는 것으로 조사됐다.교통약자의 이동편의 증진법 제17조에 따르면 교통사업자는 교통약자가 편리하게 여객시설을 이용할 수 있도록 한국수어 통역서비스 등 탑승보조 서비스를 제공해야 한다. 최 의원은 ""누구나 언제든지 원하는 교통수단을 이용할 수 있도록 국토교통부가 여객시설 이용 편의 서비스 제공에 대한 관리를 강화하고 지자체에서도 해결 의지를 보여야 한다""고 말했다.		"
1,2022.10.26. 오후 5:40,대전~세종 오가는 2층버스 도입…교통약자도 편하게,"			<앵커>높이가 4m에 달하는 2층 전기저상버스가 지방 대도시권에서는 처음으로 대전과 세종을 오가는 광역 BRT 노선에 투입됩니다. 기존 버스보다 서른 명 이상 많이 탈 수 있어서 출퇴근 시간 혼잡도가 크게 줄어들고, 교통약자들도 편하게 BRT를 이용할 수 있을 전망입니다.양정진 기자의 보도입니다.<기자>영국 런던의 상징인 2층 버스를 연상시키는 빨간색 2층 버스 2대가 대전 시내 도로를 누빕니다.다음 달 14일부터 대전역을 출발해 세종시를 지나 충북 오송역까지 운행하는 BRT B1노선에 투입되는 2층 전기저상버스입니다.1, 2층 좌석이 71석으로 40석 안팎인 기존 버스에 비해 30명을 더 태울 수 있어 BRT 버스의 출퇴근 시간 만차 문제가 크게 줄어들 것으로 기대됩니다.[이장우/대전시장 : (BRT 노선에) 많은 수요가 있다 보니까 굉장히 어려움이 많았습니다. 이번 저상 2층 버스를 도입함으로써 교통 수요에 상당히 획기적으로 개선될 것 같고.]일부 구간이 '자동차전용도로'인 BRT B1 노선은 안전장치가 미흡한 기존 저상버스 투입이 어려워 관광버스형 차량을 운행해 왔습니다.하지만 2층 전기저상버스 2대가 추가 투입되고 하루 20차례 더 운행되면서 장애인들도 편하게 BRT를 이용할 수 있게 됐습니다.휠체어 탑승장치와 고정 장치를 비롯해 자동차전용도로에서 주행할 수 있는 다양한 안전장치가 완비돼 교통약자들의 이동편의에 큰 보탬이 될 전망입니다.[최명진/대전장애인차별연대 공동대표 : 11분마다 한 대씩 오는 버스에 저상버스가 없었다는 건 교통약자들에 대한 이동권을 완전히 배제하고 있었던 상황인데 그것을 늦게라도 시작했다는 것에 큰 의미를 두고.]대전시는 높이가 4m에 달하는 2층 전기버스 운행을 위해 표지판과 나무 등 지상 시설물을 정비하고, 기점지인 대전역과 차고지인 금고동에 전용 충전시설도 설치했습니다.국토교통부 대도시권광역교통위원회는 대전권을 시작으로 부산과 광주 등 지방대도시권의 광역교통 개선을 위해 2층 전기저상버스를 추가로 도입해나갈 계획입니다.		"
2,2022.10.25. 오후 12:01,"대법, 권한 없이 장애인자동차 표지 놓고 일반구역 주차… ""공문서부정행사 아냐""","사용 권한이 없는 사람이 장애인사용자동차 표지를 차량에 비치한 채 주차했더라도 장애인전용주차구역이 아닌 일반 주차구역에 주차했다면 공문서부정행사죄로 처벌할 수 없다는 대법원 판결이 나왔다.공문서부정행사죄에서의 '부정행사' 개념을 사용 권한 없는 사람이 본래의 사용용도에 따라 사용한 경우로 축소해석하는 종래 대법원 판례에 따른 결론이다.대법원 3부(주심 이흥구 대법관)는 실효된 장애인자동차 표지를 자신의 승용차 전면에 놓은 채 일반 주차구역에 주차했다가 공문서부정행사죄로 기소된 김모씨(56)의 상고심에서 벌금 150만원을 선고한 원심을 파기하고 사건을 창원지법으로 돌려보냈다고 25일 밝혔다.재판부는 ""이 사건 공소사실을 유죄로 인정한 원심판결에는 공문서부정행사죄에서 '부정행사'에 관한 법리를 오해해 판결에 영향을 미친 잘못이 있다""고 이유를 밝혔다.김씨는 2020년 5월 20일 이미 실효된 부산광역시 동래구청장 명의의 장애인자동차 표지를 차량 전면에 비치한 채 아파트 지하주차장 일반 주차구역에 주차했다가 공문서부정행사죄로 재판에 넘겨졌다.어머니가 장애인이었던 김씨는 2014년부터 보호자용 장애인자동차 표지를 적법하게 발급받아 사용해왔지만 2019년 11월 어머니와 주소지가 달라졌기 때문에 이후로는 더 이상 사용할 수 없는 상태였다.재판에서 김씨는 ▲이미 효력이 없어진 장애인자동차 표지이기 때문에 공문서부정행사죄의 객체인 공문서로 볼 수 없고 ▲장애인전용주차구역이 아닌 일반 주차구역에 주차했기 때문에 본래의 용도에 따른 사용을 했다고 볼 수 없다며 무죄를 주장했다.하지만 1심과 2심 재판부는 이 같은 김씨의 주장을 모두 배척했다.이들 재판부는 김씨의 첫 번째 주장에 대해서는 사용 권한자와 용도가 특정돼 진정하게 성립한 공문서의 경우 반드시 유효한 것 뿐만 아니라 실효된 공문서의 경우에도 공문서부정행사죄가 성립한다고 판단했다.공문서부정행사죄는 '공문서의 사용에 대한 공공의 신용'을 보호법익으로 하는 추상적 위험범(법익 침해의 구체적·현실적인 위험이 없더라도 일반적인 법익 침해의 위험이 발생하면 성립하는 범죄)인데, 일단 유효하게 성립한 공문서의 경우 유효기간이 지나는 등 이유로 효력이 없어진 공문서라고 해도 부정사용했을 때 일반인에게 미치는 위험은 마찬가지이기 때문이다.또 하급심 재판부는 김씨의 두 번째 주장은 장애인복지법이나 장애인복지법 시행규칙 등 관련 법령에 비춰볼 때 장애인자동차 표지는 장애인이 사용하는 자동차를 지원하는 데에 편리하도록 장애인이 사용하는 자동차임을 알아볼 수 있게 하는 표지이고, 장애인전용주차구역 주차는 장애인자동차 표지의 여러 용도 중 하나에 불과하다는 이유로 받아들이지 않았다.실제 장애인자동차 표지가 발급된 자동차에 대해서는 장애인전용주차구역 주차 외에도 세금감면, 주차요금 및 고속도로 통행료 감면, 주차위반에 대한 단속 과정에서의 배려(교통소통 및 안전에 지장을 주지 않는 범위에서 최대한 계도 위주의 단속) 등 혜택이 주어진다.하지만 대법원의 판단은 달랐다.재판부는 먼저 공문서부정행사죄를 엄격하게 축소해석해야 한다는 대법원 전원합의체 판결을 원용했다.앞서 대법원 전원합의체는 2001년 4월 ""형법 제230조(공문서부정행사죄)는 구성요건으로 단지 '공무원 또는 공무소의 문서 또는 도화를 부정행사한 자'라고만 규정하고 있어, 자칫 처벌범위가 지나치게 확대될 염려가 있으므로 본죄에 관한 범행의 주체, 객체 및 태양을 되도록 엄격하게 해석해 처벌 범위를 합리적인 범위 내로 제한해야 한다""고 밝힌 바 있다.또 재판부는 ""사용 권한자와 용도가 특정돼 있는 공문서를 사용 권한 없는 자가 사용한 경우에도 그 공문서 본래의 용도에 따른 사용이 아닌 경우에는 공문서부정행사죄가 성립되지 않는다""는 2003년 대법원 판결도 인용했다.그러면서 재판부는 ""피고인이 장애인자동차 표지를 승용차에 비치한 채 장애인전용주차구역이 아닌 장소에 승용차를 주차한 것은 장애인자동차에 대한 지원을 받을 것으로 합리적으로 기대되는 상황에서 장애인자동차표지를 승용차에 비치한 경우에 해당한다고 볼 수 없다""며 ""이러한 사실을 앞서 본 법리에 비춰 살펴보면, 피고인이 장애인자동차표지를 본래의 용도에 따라 사용한 것으로 볼 수 없으므로 공문서부정행사죄가 성립하지 않는다""고 결론 내렸다."
3,2022.10.27. 오후 2:06,이유있는 장애인 이동권 시위…저상버스 없는 노선 수두룩,"감사원, 교통약자 등의 이동편의제도 운영실태 공개저상버스 배차 않거나 편중…연석 탓 승하차 어려워교통약자 콜택시, 운전원 부족으로 실제 운행률 저조[이데일리 이유림 기자] 정부가 저상버스 보급량 관리에만 치중해 정작 배차가 일부 노선 및 시간에 편중되고 있다는 사실이 27일 감사원 감사 결과 드러났다. 또 저상버스 바닥과 인도의 높이차가 커서 휠체어 승하차가 힘든 사례 등도 감사원 감사를 통해 확인됐다. 저상버스는 장애인 등이 탑승할 수 있도록 바닥이 낮으며 승하차 계단이 없고 경사판을 장착한 버스다. 이번 감사 결과는 최근 장애인 단체의 이동권 보장 시위가 벌어지는 와중 발표돼 더욱 주목된다. 서울 중랑구 중랑공영차고지에 시내버스들이 주차돼 있다. (사진=뉴시스)국토부·지자체, 저상버스 배차 관리 안해감사원은 이날 ‘교통약자 등의 이동편의제도 운영실태’ 전문을 공개했다. 교통약자법 등에 따르면 노선버스 운송사업자는 일반버스와 저상버스 배차간격을 적절하게 편성해야 하고, 국토부는 이에 대한 실태조사를 해야 하며 지자체는 운송사업자에게 필요한 조치를 명할 수 있다. 감사원이 특·광역시 중 버스 수가 많은 상위 4개(서울, 부산, 인천, 대구)를 대상(409개 노선, 138개 사업자)으로 배차노선 및 배차간격을 분석한 결과 국토부 및 지자체는 저상버스의 보급에만 중점을 두고 실제 저상버스의 배차나 운행 간격 등 운영사항은 관리하지 않고 있었다. 또한 저상버스 운행가능 노선(급경사 등으로 저상버스 운행이 어려운 노선 제외)을 2개 이상 운영하는 100개 운송사업자의 305개 노선을 분석한 결과 운송사업자가 노선에 저상버스를 배차하지 않거나(55개) 편중 배차(53개)하는 등 총 97개 노선(중복 제외, 전체 305개의 32%)에서 저상버스를 균등 배차하지 않고 있었다. 4개의 특·광역시(서울, 부산, 인천, 대구)에서 운행 중인 290개 저상버스 노선에 대해 배차 간격을 분석한 결과, 115개(39.7%) 노선에서 저상버스를 균등 배차했을 때보다 배차간격이 2배 이상(최대 4.58배) 차이가 나고 있음을 확인했다. 정류장 연석 낮아 휠체어 승하차 어려움 감사원은 버스정류장의 연석 높이가 낮아 휠체어 승하차가 힘든 사례도 다수 적발했다. 연석 높이별 안전성과 편의성을 시험(교통안전공단)한 결과 연석 높이가 20cm일 때 가장 안전하고 편리했으며, 연석 높이가 낮아져 경사도가 클수록 휠체어 승하차가 곤란하다는 사실을 파악했다. 이에 감사원은 국토부 장관에게 휠체어 사용자 등을 포함한 교통약자가 저상버스에 안전하고 편리하게 승하차할 수 있도록 버스정류장의 연석 높이에 대한 종합적인 설치기준을 마련하도록 통보했다. 나아가 감사원은  정부가 보급률만을 기준으로 특별교통수단을 보급하다 보니 운전원 부족 등으로 실제 운행률은 저조하다는 점도 지적했다. 교통약자법 등에 따르면 국토부는 교통약자의 이동 편의를 위해 지자체가 특별교통수단(교통약자 콜택시)을 도입하도록 하고, 지자체는 법정기준대수(중증장애인 150명당 1대) 이상 운행해야 한다. 국토부 및 지자체는 매년 특별교통수단을 보급하고 있으나 12개 특·광역시의 보급률은 목표치인 84%에 미달한 반면(56.4~81.0%), 이용건수는 증가(2016년 대비 2020년 118.5% 증가)했다. 감사원은 특별교통수단 보급계획을 수립할 때 지자체의 특별교통수단 운행상황 및 운전원 확보 등 구체적인 운영계획을 반영하는 방안을 마련하도록 국토부 장관에게 통보했다. 감사원(사진=연합뉴스)복지부, BF 인증 대상 공공건축물 관리 소홀 복지부가 ‘장애물 없는 생활환경 인증’(BF) 신청을 하지 않는 공공건축물에 대해 실태 파악 등 관리를 소홀히 하는 점도 드러났다. 복지부는 장애인 등 편의법에 따라 2015년부터 국가·지자체의 신축 공공건축물에 대해 공사 완료 후 의무적으로 BF 인증을 받도록 관리해야 한다. 그러나 BF 인증 대상 공공건축물(6094개)에 대해 인증 현황을 점검한 결과, 1527개(25.1%)가 인증을 신청하지 않고 있는데도 복지부는 관리를 소홀히 하고 있었다. 예비인증을 받았거나 신청한 BF 인증 대상 공공건축물 769개 중 110개(14.3%)는 공사 완료 후 1년이 지나도록 본인증을 신청하지 않았다. 또한 복지부가 인증취득 마감기한 등을 마련하지 않아 본인증을 신청한 667개 시설 중 191개는 장기간(공사 완료 후 1년 경과) 보완 요구를 이행하지 않고 있는데도 과태료 부과 등을 강제하지 못하고 있었다. 이에 감사원은 복지부 장관에게 국가·지자체 등이 ‘장애물 없는 생활환경’(BF) 의무인증 대상시설을 건축하면서 BF 인증을 받지 않는 일이 없도록 지도·감독할 것을 통보했다."
4,2022.10.26. 오전 5:02,"뇌병변 장애인의 작가 도전기 “장애 불편하지만, 다른 사람들과 같아요”","작가 백순심(42)씨가 책 ‘불편하지만 사는 데 지장 없습니다’를 들고 웃고 있다. 본인 제공 “장애는 극복의 대상이 아니라 그 사람의 정체성이라는 걸 알아 줬으면 좋겠어요.”책 ‘불편하지만 사는 데 지장 없습니다’(설렘)를 펴낸 작가 백순심(사진·42)씨는 25일 서울신문과의 인터뷰에서 이렇게 강조했다. 사회복지사로 일하는 20년 차 직장인이자 초등학생 쌍둥이를 키우는 백씨는 지체장애 5급 판정을 받은 장애인이다.2020년부터 네이버 카페 ‘엄마의 꿈방‘에 장애인 엄마로서의 삶과 직접 겪은 차별을 이야기로 풀어 연재하기 시작했는데, ‘우리만 보기 아깝다’는 성원에 직접 책까지 펴냈다. 이 책은 문화체육관광부와 한국문화예술위원회의 ‘나의 첫 책 프로젝트’에도 선정돼 도서 보급 사업에 활용되고 있다. 백씨는 “아이들이 크면서 요즈음 엄마가 장애인인 것에 대해 묻곤 하는데 거기에 대해 항상 ‘불편하지만 불행하진 않다’고 답한다”며 “이 책이 비장애인이 장애인을 이해하는 통로가 됐으면 좋겠다”고 설명했다.백씨는 태어날 때부터 뇌병변 장애를 앓았다. 손이 약간 떨리고 말이 어눌한 정도지만 그 조그만 ‘차이’도 사회에선 큰 ‘차별’이 됐다. 그는 “대학에서 사회복지학을 전공했는데도 결국 장애인은 취업 시장에서 받아 주지 않더라”며 “원래 집이 부산인데 도저히 취업이 안 돼 결국 강원도까지 왔다”고 했다.장애인이라는 점은 일할 때도, 결혼할 때도 걸림돌이 됐다. 백씨는 “결혼을 앞두고 남편 동료들이 남편에게 ‘결혼을 다시 생각해 보라’는 말까지 했다”며 “이런 갑갑함이 쌓여 항상 내 얘기를 쓰고 싶다고 생각했다”고 돌아봤다.숱한 아픔과 차별이 있었지만 그 경험은 모두 책을 쓰는 데는 좋은 거름이 됐다. 사회복지사로 일하며 장애인 차별을 개인적 고민이 아닌 사회적 문제로 받아들이는 시각 역시 한층 단단해졌다.백씨는 “시설 식구들과 지하철 탑승 활동 체험을 하러 간 적이 있는데 그때 한 시민이 ‘아침부터 장애인을 봐서 재수 없다’고 하더라”며 “단순히 대중교통을 이용하는 건데 왜 그런 차별을 받아야 하나. 이건 사회구조의 잘못”이라고 말했다.타자 속도가 느린 그는 A4 용지 한 장 분량의 이야기를 치는 데도 1시간이 걸린다. 남들은 10분이면 끝내고도 남을 양이다. 어쩌면 고되고 힘든 작업인데도 그가 계속하는 이유는 결국 장애인으로서 이 세상에 할 말이 많기 때문이다.“우리 사회에선 장애인이 무조건 못한다고만 생각하는 것 같아요. 같은 일을 해도 속도가 느리면 숙달될 때까지 기다려 주지 않죠. 하지만 비장애인 기준에 모든 걸 맞추지 말고, 개개인의 기준에 맞춰 바라본다면 어떨까요. 장애인도 더 많은 기회를 얻는 사회가 됐으면 합니다.”		"
5,2022.10.20. 오전 11:57,"부산 도시철도 서면·대연역, 이동편의 시설 확충","기사내용 요약24일부터 서면역 대합실 에스컬레이터 개통11월 4일 대연역 2·4번 출구 승강기 신규 운행[부산=뉴시스] 신규로 개통되는 부산 서면역 대합실 내 에스컬레이터. (사진= 부산교통공사 제공)  *재판매 및 DB 금지[부산=뉴시스]권태완 기자 = 부산교통공사는 도시철도 서면역 및 대연역에 신규로 에스컬레이터 2대와 승강기 1대를 설치했다고 20일 밝혔다.서면역에는 1·2호선 대합실을 연결하는 양방향 에스컬레이터가 오는 24일 개통된다. 특히 서면역은 부산의 중심이자 주요 환승역으로, 이번 에스컬레이터 개통으로 캐리어 등 짐을 소지한 관광객이나 어르신 등 교통약자의 이동편리성이 향상될 것으로 전망된다.다음달 4일에는 2호선 대연역에 2·4번 출구로 이어지는 엘리베이터 1대가 신규 운행된다. 대연역에는 6개의 출구가 있지만 대합실과 지상을 잇는 엘리베이터가 1대 뿐이라 맞은편 출구를 이용하는 시민들의 불편이 많았다. 이번에 설치된 엘리베이터는 2·4번 출구로 이어져 인근 주민들의 도시철도 접근성과 이동편의가 크게 향상될 것으로 보인다.부산교통공사 한문희 사장은 ""도시철도 이동 편의시설 확충은 노인, 장애인 등 교통약자의 접근성 향상에 반드시 필요한 사업""이라며 ""통행량에 비해 승강시설이 부족한 다른 역사에도 승강기를 조속히 설치할 수 있도록 노력하겠다""고 말했다."
6,2022.10.11. 오후 5:47,"""시각장애인 어머니, 기차에 치일 뻔…코레일 직원은 없었다""","			[[the300][국정감사]](서울=뉴스1) 이동해 기자 = 이종배 예결위원장이 20일 서울 여의도 국회에서 열린 예산결산특별위원회를 진행하고 있다. 2022.2.20/뉴스1   한국철도공사(코레일)가 교통약자 편의 서비스 운영에 소홀하다는 지적이 나왔다. 매뉴얼이 부실하고 코레일 직원이 응대를 제대로 하지 않아 교통약자들이 열차를 이용하면서 어려움을 겪는다는 것이다. 국회 교통위원회 소속 이종배 국민의힘 의원은 11일 코레일 등에 대한 국정감사에서 ""현장에서 서비스받은 교통약자들은 이용 편의는커녕 교통약자를 진상 취급했다며 분노하고 있다""며 ""교통약자를 최우선 배려하기 위한 관련 규정 개정이 필요하다""고 촉구했다. 이 의원은 이날 코레일의 승하차 도우미 서비스 관련 민원 사례를 공개했다. 한 민원인의 어머니는 1급 시각 장애인이라 주변 도움 없이는 기차를 타거나 내릴 수 없지만, 약속과 달리 코레일에서는 네 번이나 현장에 나오지 않았다. 민원인은 ""도착역에 담당자분들이 오지 않은 네 번 동안 저희 어머니는 기차에 치일 뻔했고 혼자 뛰어가다 넘어질 뻔하기도 했다""고 호소했다. 또 다른 민원인은 올해 6월 부모님을 위해 부산-서울 노약자 도우미를 신청했으나 직원이 오지도 않고 연락도 없었다고 전했다. 결국 부모님은 이동했다가 홈을 잘못 찾아가 열차를 놓쳤다. 역무원은 열차표를 반환한 뒤 재구매해야 한다고 했으나 부모님이 ""카드가 없다""고 하자 해당 직원이 욕설을 했다는 주장이다. 코레일의 교통약자 승하차 도우미 서비스는 사전에 고객이 요청하면 직원이 교통 이용을 도와주는 것이다. 규정에 따르면 도우미는 열차 도착 3분 전까지 하차 위치에 도착해야 한다. 고객이 요청할 경우 버스나 택시를 탈 수 있는 곳까지 안내해야 한다. (서울=뉴스1) 허경 기자 = 나희승 한국철도공사 사장이 11일 서울 여의도 국회에서 열린 국토교통위원회의 한국철도공사 등에 대한 국정감사에서 의원들의 질의에 답하고 있다.  2022.10.11/뉴스1  Copyright (C) 뉴스1. All rights reserved. 무단 전재 및 재배포 금지.이 서비스 이용자는 △2020년 94건 △2021년 116건 △2022년 134건으로 매년 증가하고 있다. 하지만 관련 규정이 제대로 지켜지지 않아 이용자 불만도 잇따르고 있다. 이 의원에 따르면 민원 건수는 △2020년 9건 △2021년 22건 △2022년 8월까지 13건이다. 이 의원은 ""장애인 등 교통약자가 열차를 이용하는 데 미처 챙기지 못한 부분이 없는지 철도 전반에 걸쳐 다시 한번 살펴야 한다""며 ""유관기관 등 다양한 의견 수렴과 현장 조사를 추진해 개선방안을 마련해야 한다""고 주문했다. 나희승 코레일 사장은 ""시각 장애인에 대한 대응이 미흡했던 부분에 대해 죄송스럽게 생각한다""며 ""직원 행동 지침과 매뉴얼 등을 개정하고 있다""고 답했다. "
