,날짜,기사제목,기사내용
0,2017.07.04. 오후 3:19,[인사] 부산시,			◇ 행정 5급    ▲규제개혁추진단 김정희 ▲언론홍보담당관실 김재학 ▲통합민원담당관실 박희옥 ▲감사관실 김우배 ▲감사관실 김가영 ▲기획담당관실 양병욱 ▲기획담당관실 장승희 ▲자치행정담당관실 연태흠 ▲인사담당관실 신미란 ▲인사담당관실 김영봉 ▲세정담당관실박용호 ▲세정담당관실 고현정 ▲세정담당관실 심재승 ▲세정담당관실 서재덕 ▲세정담당관실 이종석 ▲회계재산담당관실 정말순 ▲정보화담당관실 신성봉 ▲재난상황관리과 박성배 ▲재난상황관리과 윤석동 ▲특별사법경찰과 신종배 ▲건설행정과 임창근 ▲건설행정과 이성무 ▲다복동추진단TF 박명수 ▲사회복지과 신명식 ▲장애인복지과 권경만 ▲노인복지과 정권철 ▲출산보육과 류승자 ▲체육진흥과 이욱자 ▲의료산업과 김민숙 ▲문화예술과 하성태 ▲영상콘텐츠산업과 윤재성 ▲영상콘텐츠산업과 황호규 ▲관광진흥과(행정자치부 파견) 김성근 ▲관광산업과 김상대 ▲자원순환과 송찬호 ▲대중교통과 박두영 ▲교통관리과 김경희 ▲교통관리과 천귀애 ▲도시정비과 최재명 ▲소상공인지원단TF 권순민 ▲좋은기업유치과 이수일 ▲클린에너지추진단TF 남정은 ▲에너지산업과 강희성 ▲창업지원과 이옥형 ▲서비스금융과 안경은 ▲해양산업과 하상을 ▲시의회사무처 노윤숙 ▲시의회사무처 윤상오 ▲인재개발원 김형철 ▲상수도사업본부 조진태 ▲상수도사업본부 양구석 ▲상수도사업본부 박태관 ▲상수도사업본부 김정일▲서울본부 손용완 ▲여성문화회관 이준섭 ▲차량등록사업소 최임동 ▲현대미술관 강영진 ▲해양자연사박물관 채대병 ▲현장지원단 송진우 ▲대외협력담당관실(국회사무처 파견) 김남오 ▲자치행정담당관실 박대선 ▲회계재산담당관실 박경휘 ▲공항기획과 임미란 ▲신공항도시과 장세홍 ▲사회복지과 윤영균 ▲관광진흥과 이연악 ▲기후대기과 문남희 ▲교통운영과 조종규 ▲교통관리과 권순일 ▲일자리창출과 배경아 ▲소상공인지원단TF 전선임 ▲경제기획과 박수원 ▲에너지산업과 홍경애 ▲창업지원과 김원균 ▲창업지원과(부산창조경제혁신센터 파견) 김난숙 ▲해운항만과 김영호 ▲시의회사무처 김소영 ▲시의회사무처 강경돈 ▲건설본부 이선화 ▲낙동강관리본부 김종한 ▲낙동강관리본부 신명섭 ▲체육시설관리사업소 김동명 ▲통상진흥과 정기영 ▲소통기획담당관실 김진선 ▲재난상황관리과 강호영 ▲아동보호종합센터 주민희 ▲회계재산담당관실 김말순 ▲좋은기업유치과 김상돈 ◇ 사회복지 5급    ▲다복동추진단TF 김은희 ▲아동청소년과 공영숙◇ 공업(기계) 5급     ▲생활하수과 한정국 ▲교통관리과 문광일 ▲기간산업과 허상태 ▲기간산업과 윤병철 ▲상수도사업본부) 황정용 ▲상수도사업본부 김충회 ▲건설본부 이기택 ◇ 공업(화공) 5급    ▲에너지산업과 박희득 ▲상수도사업본부 성미선 ▲낙동강관리본부 조형우 ▲기후대기과 오세홍 ▲환경보전과(환경부 파견) 오수진 ▲사상구 이기봉◇ 녹지 5급    ▲공원운영과 박길성 ▲공원운영과 이재욱 ▲산림녹지과 안철수 ▲북구 한영진 ▲금정구 이호준 ▲사상구 박대성 ▲해운대구 김성영◇ 수의 5급    ▲농축산유통과 박희종◇ 해양수산(일반수산) 5급    ▲수산자원과 최정희 ▲수산유통가공과 남상정 ▲수산자원과 박진서 ▲기장군 이월라◇ 해양수산(일반선박) 5급    ▲수산자원과 김기두 ▲남항관리사업소 한용일◇ 보건 5급    ▲사하구 이미숙◇ 간호 5급    ▲노인복지과 김혜숙 ▲건강증진과 엄길란◇ 시설(토목) 5급    ▲감사관실 김종만 ▲도시계획과 최점돌 ▲기술심사과 이현우 ▲도로계획과 백명기 ▲생활하수과 조상제 ▲공원운영과 손기홍 ▲산업입지과 김해종 ▲상수도사업본부 김하일 ▲건설본부 정상희 건설안전시험사업소 신용호 ▲건설안전시험사업소 이경섭 ▲건설안전시험사업소 권혁갑 ▲건설안전시험사업소 김종원 ▲서구 조구공 ▲신공항도시과 박종인 ▲철도시설과 김진대 ▲산업입지과 이도훈 ▲해운항만과 김정일 ▲시의회사무처 이상도 ▲상수도사업본부 김학전 ▲건설본부 윤채선 ▲건설본부) 서대봉 ▲부산진구 박만호 ▲금정구 김성규 ▲철도시설과(한국철도시설공단 파견) 강철곤 ▲재난대응과 오지석◇ 시설(건축) 5급    ▲재난예방과 오규상 ▲도시재생과 남택경 ▲도시정비과 김필한 ▲서구 신용균 ▲해운대구 배성일 ▲오페라하우스추진단TF 김덕영 ▲도시재생과 정동현 ▲건설본부 한재찬 ▲강서구 박재영◇ 시설(지적) 5급    ▲토지정보과 김항곤 ▲남구 박동성 ▲해운대구 이정용 ▲사하구 배영덕 ▲서구 이기종 ▲영도구 김경희◇ 방송통신 5급    ▲재난상황관리과 이종욱◇ 연구지도직 5급    ▲보건환경연구원 김용순 ▲보건환경연구원 정재은 ▲농업기술센터 김현숙  (부산=연합뉴스) 최신 유행 트렌드 총집결(클릭!)
1,2017.07.20. 오전 11:39,부산도시철도 교통약자 이용 편의시설 확충,"[부산CBS 박중석 기자]부산도시철도에 장애인과 노약자 등 교통약자를 위한 시설이 확충됐다. 부산교통공사(사장 박종흠)는 교통약자 이용편의를 위해 남포역 등 5개 역에 승강기 3대와 에스컬레이터 8대를 추가 설치했다고 20일 밝혔다.공사는 앞서 지난 2003년 1차 시설개량 공사를 시작해 이번에 마무리된 6차 공사까지 순차적으로 각 역사의 승강기와 에스컬레이터 추가 설치 공사를 진행해왔다.공사는 앞으로 도시철도 2호선 화명역과 호포역에 승강기와 에스컬레이터 추가 설치 공사를 진행할 계획이다.공사는 이와 함께 우천시 빗물에 노출돼 고장이 잦았던 시각장애인용 음성유도기를 개량한 '매립형 음성유도기'를 개발해 특허 출원을 마무리했다. 특허를 받은 매립형 음성유도기는 최근 개통한 도시철도 1호선 연장 다대구간은 물론 서울역 고가를 개선한 '서울로 7017'에 모두 52대가 설치됐다. 박종흠 부산교통공사 사장은 ""앞으로도 지속적인 편의시설 확충을 통해 교통약자가 도시철도를 이용하면서 불편이 없도록 노력하겠다""고 말했다.jspark@cbs.co.kr저작권자 © CBS 노컷뉴스(www.nocutnews.co.kr) 무단전재 및 재배포 금지		"
2,2017.07.28. 오전 10:38,"부산중구 보훈회관, 장애물 없는 생활환경 인증제도 '우수등급' 획득","    부산 중구(구청장 김은숙)에서 지난해 준공한 중구 보훈회관이 장애물 없는 생활환경(BF)인증제도 본인증에서 우수등급(사진)을 취득했다.'장애물 없는 생활환경(BF)인증제도'란 장애인, 노인, 임산부 등을 비롯한 모든 국민이 지역 및 개별시설을 접근하고 이용 및 이동하는데 불편이 없는 생활환경의 구축 및 조성을 촉진하고자 보건복지부와 국토교통부가 공동으로 운영하는 제도로, 한국장애인개발원의 심사 후 인증된다.중구 보훈회관은 이번 우수등급 획득으로 장애인ㆍ노인ㆍ임산부ㆍ아동 등 모든 시설이용자가 안전하고 편리하게 이용 가능한 건축물로 2017년 6월부터 2022년 6월 28일까지 5년간 인증받는다.김은숙 중구청장은 ""앞으로 노인, 아동, 장애인 등 사회적 약자가 아무런 불편없이 생활하도록 장애물이 없는 건축물 등 더 좋은 환경 조성을 위해 노력하겠다""고 말했다.디지털미디어본부 news@busan.com"
3,2017.07.10. 오전 9:31,"양산시, 장애인 등 교통약자 콜택시 5대 증차 운영","양산시가 운영하고 있는 교통약자 콜택시(양산시 제공)2017.7.10./뉴스1© News1(부산ㆍ경남=뉴스1) 남경문 기자 = 양산시는 장애인이나 노약자 등 교통약자의 이동편의 증진을 위해 교통약자 콜택시 5대를 증차해 운영한다고 10일 밝혔다.시는 장애인의 교통약자 이동권 보장을 위해 휠체어 탑승설비 등을 장착한 콜택시를 법정보유대수(16대)를 초과한 25대로 확대해 대기시간 단축 등 배려와 존중의 약자 친화도시 조성에 앞장서고 있다.교통약자 콜택시는 양산시 복지재단(장애인복지관)에 운영한다.이용대상은 1·2급 장애인과 고령자나 임산부 등 대중교통수단 이용이 어려운 자, 교통약자 동반 가족이 이용할 수 있으며, 특별교통수단 콜택시(1566-4488)에 전화로 신청하면 된다.5월말 기준 하루 평균 151회 250명이 이용하고 있다. 요금은 관내 2000원, 시계를 초과할 경우 부산·울산 방향으로 440ｍ당 100원, 107초당 100원의 초과요금이 최대 1만원까지 부과되며 경남 타 시군의 시외버스요금의 1.5배를 넘지 못하게 되어 있다.  시 관계자는 “이용자의 차량을 장기간 이용하거나 교통약자 콜택시 이용 대상이 아닌 자가 이용하는 경우가 빈번하다”며 “교통약자들의 이동권 보장을 위해 시민들의 양보와 이해를 당부한다”고 말했다.news2349@news1.kr▶ 놓치면 후회! 최신 만화 보기 / 2017년 나의 운세 보기▶ 생생한 Real-Time 영상뉴스, 눈TV(바로가기!)▶ 여러분의 제보를 기다립니다. 제보하기(클릭!)[© 뉴스1코리아(news1.kr), 무단 전재 및 재배포 금지]"
4,2017.07.28. 오전 9:10,"[부산소식]동아대 학군단, 최우수 학군단 선정 등 ","			【부산=뉴시스】 하경민 기자 = ◇동아대 학군단, 최우수 학군단 선정동아대 학생군사교육단은 육군 교육사령부가 선정하는 2017년 최우수 학군단에 뽑혔다고 28일 밝혔다또 지난 6월26일부터 이달 21일까지 진행된 하계 입영훈련에서 전투기량 우수 학군단 표창도 받았다. 1961년 창설된 동아대 학군단은 최근까지 장교 4132명을 배출했으며 대통령상 2회, 전국 최우수 학군단 표창 9회, 교육사열 우승 11회, 하계 입영훈련 전국 1위 8회나 차지했다.◇부산시선관위, 초·중등 교원 대상 민주시민교육연수 개최부산시선거관리위원회는 오는 31일부터 8월 4일까지 시선관위 4층 대회의실과 부산 북구 솔로몬로파크에서 부산지역 초·중등 교원 40여 명을 대상으로 민주시민교육 연수를 실시한다. 연수에서는 학교 민주주의 실천사례와 민주시민교육 방법론, 교사에게 필요한 스피치 기법, 토론수업 방법론 등 총 13과목 30시간의 다양한 교육이 진행된다. ◇송도해수욕장 인공폭포 재가동부산 서구는 송도해수욕장 인공폭포의 새단장을 마무리하고 재가동을 시작했다고 28일 밝혔다.송도인공폭포는 송도해수욕장의 랜드마크로 만들기 위해 2009년 1월 조성됐는데, 시설 노후화에 따른 안전성 문제 등으로 운행을 중단했다가 부산시로부터 특별조정교부금 6억원을 받아 새롭게 조성해 다시 운영에 들어갔다. 인공폭포는 높이 16m, 너비 30m 규모로 기존 암반을 최대한 활용하고, 폭포 내부 구조물이 부식되지 않도록 기존 암반 위에 인조암을 덧붙이는 새로운 시공방식으로 조성한 것이 특징이다. 이 폭포는 5~10월 운영되며, 피서철인 성수기인 6~9월에는 매일 오전 9시부터 오후 9시까지 2시간 가동 후 30분 휴지시키는 방식으로 가동된다.◇중구보훈회관, 장애물 없는 생활환경인증제 '우수' 획득부산 중구는 지난해 준공한 중구보훈회관이 장애물 없는 생활환경(BF)인증에서 우수 등급을 획득했다고 28일 밝혔다. 장애물 없는 생활환경인증제는 장애인, 노인, 임산부 등이 접근·이용·이동하는데 불편이 없는 생활환경의 구축하기 위해 보건복지부와 국토교통부가 공동으로 운영하는 제도로, 한국장애인개발원의 심사 후 인증한다.중구보훈회관은 이번 우수등급 획득으로 장애인·노인·임산부·아동 등 모든 시설이용자가 안전하고 편리하게 이용 가능한 건축물로 인정을 받았으며, 이번 인증은 2022년 6월 28일까지 5년 동안 유지된다.◇롯데호텔, 여름 특가 패키지 출시부산 롯데호텔은 28일부터 8월 14일까지 여름 특가 패키지를 선보인다. 먼저 2박 패키지는 호텔에서 2박 이상 투숙하며 휴식을 취하고 싶은 고객을 위한 것으로, 디럭스룸 2박과 실내외 수영장 4명 이용, 헬스·사우나 2명 무료 이용 혜택이 제공된다. 또 주중 한정 패키지는 일요일부터 목요일 사이에 투숙하는 고객이 이용할 수 있다. yulnetphoto@newsis.com뉴시스 뉴스, 네이버 뉴스 스탠드에서도 만나세요뉴시스 SNS [페이스북] [트위터]<저작권자ⓒ 공감언론 뉴시스통신사. 무단전재-재배포 금지.>"
5,2017.07.12. 오후 9:03,"신분당선 ""적자 4천억 육박…노인·장애인도 요금 내야""","			<앵커>만 65세 이상 노인과 장애인, 국가 유공자는 지하철을 무료로 이용할 수 있지요. 하지만 고령화로 노인 인구가 빠르게 늘면서 서울과 부산 등 6개 지역 지하철에서는 무임승차로 인한 적자 규모가 해마다 커지고 있습니다. 이런 가운데 서울 강남과 경기 성남을 잇는 신분당선이 무임승차 혜택을 없애겠다고 나섰습니다.한승환 기자의 보도입니다.<기자>지난 2011년 10월, 민자 투자로 개통해 강남에서 수원 광교 구간을 운행하는 신분당선. 이용 승객이 당초 예상의 절반에도 못 미치면서 누적 적자가 4천억 원에 육박합니다.신분당선 측은 특히 지난해 무임승차 승객 비율이 전체 승객의 16.4%나 돼 이로 인한 손실만 140억 원에 달한다고 주장합니다.이에 따라 국토교통부에 노인과 장애인에게도 요금을 받을 수 있게 해달라고 요청했습니다.[신분당선 운영사 관계자 : (개통) 6년 이후에 유임으로, (요금을) 받는 것으로 (협약에) 되어 있다는 거죠. 앞으로도 이런 것들이 해결되지 않으면 추가 손실이 계속 발생할 것은 예상되죠.]국토부는 일단 관계부처와의 논의를 거친 뒤 신분당선과의 협의를 진행하겠다며 아직 정해진 것은 없다는 입장입니다. 시민들의 반응은 엇갈립니다.[임지생/서울 강남구 : 형평성에 안 맞네요, 신분당선만 거기에서 빠져나오겠다는 것은. (제도를 시행) 해보고 안 된다, 이러는 것은 굉장히 국민들을 우롱하는 것이죠.][안승완/서울 동작구 : 요금을 좀 내야 해요. 왜냐하면, 국가 예산도 생각해야 하고… 지금 65세는 사실 옛날에 비하면 30~40대밖에 안 돼 보여요.]지하철을 운영하는 전국의 지방자치단체들도 국정기획위원회에 무임승차로 생기는 손실을 보전해달라고 요구하고 있습니다.국토부가 신분당선 측의 요구를 받아들일 경우 서울 지하철 등에도 영향을 미칠 것으로 보입니다.(영상취재 : 김승태, 영상편집 : 이승열)  한승환 기자(hsh15@sbs.co.kr)☞ [마부작침] '인사청문 대해부' 기획 시리즈☞ [나도펀딩] 목숨보다 소중한 그 이름, 엄마※ ⓒ SBS & SBS콘텐츠허브 : 무단복제 및 재배포 금지"
6,2017.07.25. 오후 3:25,"안상수 시장 ""스페셜 올림픽 통해 장애인에 대한 인식 개선""","안상수 창원시장© News126~28일 창원종합운동장서 개최(부산·경남=뉴스1) 강대한 기자 = 안상수 창원시장이 25일 간부회의에서 “‘스페셜 올림픽 코리아 전국하계대회’를 계기로 장애인에 대한 사회적 인식을 개선하는데 노력해야 할 것”이라고 말했다.‘스페셜 올림픽 코리아 전국하계대회’는 오는 26일부터 3일간 창원종합운동장 일대에서 개최된다. ‘발달장애인’에게 스포츠 훈련 기회를 제공하고 경기대회에 참여함으로써 장애인들이 사회구성원으로 자리매김하는데 기여하는 대회다.이번 대회는 선수·코치·자원봉사자·운영위원 등 포함해 2500여명이 참여해 대규모로 열린다.안 시장은 “그간 행정국에서 참가선수와 대회관계자들이 불편함을 겪지 않도록 숙박이나 교통문제 등 적재적소에 세심한 배려를 기울여 왔다”며 “관련 부서는 막바지까지 긴장의 끈을 놓지 말기 바라며 특히 안전사고가 발생하지 않도록 챙겨주기 바란다”고 강조했다.그러면서 “복지여성국은 직원과 간부공무원 대상으로 장애인 인식개선 교육을 실시하고 사회전반에 ‘장애인도 동등한 권리를 가진 주체’라는 인식이 확산되도록 노력하라”고 지시했다.이어 “장애인이 경제적으로 자립하는데 도움을 줄 수 있도록, 장애인 생산품에 대한 구매비중도 보다 늘르기 바란다”며 “부서별로 관리하고 있는 장애인 편의시설도 자체 점검하고 장애인을 배려하는 시민의식 향상에 모범을 보일 것”이라고 주문했다.rok1813@▶ 놓치면 후회! 최신 만화 보기 / 2017년 나의 운세 보기▶ 생생한 Real-Time 영상뉴스, 눈TV(바로가기!)▶ 여러분의 제보를 기다립니다. 제보하기(클릭!)[© 뉴스1코리아(news1.kr), 무단 전재 및 재배포 금지]"
7,2017.07.03. 오전 10:19,"부산시, ‘규제개선’ 사례집 2종 발간","			 【부산=뉴시스】허상천 기자 = 부산시는 지난해 규제개혁 사례 중 시민의 생활 속 체감도가 높은 대표사례를 모아 ‘규제개선사례 70선’을 발간했다고 3일 밝혔다.   올해는 기업하기 좋은 도시를 위해 걸림돌이 되는 규제를 개혁한 핵심사례를 모은 ‘기업 규제개선사례 20선’도 신규로 제작했다.   ‘규제개선사례 70선’은 2015년 이후 매년 시민에게 불편·부담이 되었던 규제, 지역경제 활성화에 저해되는 규제를 개선하거나 적극행정으로 해결한 사례를 선정해 발간하고 있다. 올해 주요 개선사례는 ▲관광 펜션업 건축물 층수제한 한시적 완화(문화 및 관광) ▲공설장사시설의 음식물 반입 허용, 공설묘지 등 사용 취소때 사용료 반환규정 마련(사회복지) ▲음식판매자동차의 영업장소 확대(보건) ▲도매시장법인 겸영사업 확대(농림해양수산) ▲산단 내 공장부지 임대사업 자격요건 완화(산업·중소기업) ▲교통신호기 입찰 참가자격 완화(수송 및 교통) ▲장애인 등의 편의시설 건축협의 기간 단축, 일반주거지역 내 운동시설 입지기준 완화(국토 및 지역개발) 등을 담고 있다. 아울러 ‘기업 규제개선사례 20선’은 지난 3년간 지역기업 관련 규제개혁 성과를 담았다. 이들 기업규제개선 사례는 각종 규제로 어려움을 겪고 있는 기업이 규제개선을 적극 건의할 수 있도록 전자북(e-book) 형태로 시와 구·군, 부산상공회의소 홈페이지 배너에 연계·게시할 계획이다.  주요 사례 중에는 ▲준공된 산업단지 내 연료사용 규제 완화 ▲외국인투자기업 공유재산 임대료 감면율 상향 ▲법령 적극해석으로 산업단지 내 자동차해체시설 입주허용 ▲지식기반서비스산업 관련 기업 지원제도 신설 ▲도시재생활성화지역 내 내국인 도시민박 허용 ▲일반주거지역 내 떡 및 빵 공장 허용 ▲자동차매매업 등록제한지역 완화 ▲산업단지 도시공원 내 직장어린이집 설치기준 완화 등이 있다. 부산시는 이번에 발행한 사례집 2종을 구·군 민원실과 주민센터 등에 배부하고 시 홈페이지(www.busan.go.kr) 등에도 게시해 기업과 시민들이 규제개혁에 대한 관심을 갖도록 할 계획이다. 부산시 관계자는 “규제개혁 사례집이 공직자들의 규제개혁 마인드 확산에 큰 도움이 되길 기대한다”며 “기업인과 시민들이 느끼는 작은 불편도 허투루 보지 않고 현장 중심의 과감한 규제개혁을 위해 최선을 다하겠다”고 말했다. heraid@newsis.com뉴시스 뉴스, 네이버 뉴스 스탠드에서도 만나세요뉴시스 SNS [페이스북] [트위터]<저작권자ⓒ 공감언론 뉴시스통신사. 무단전재-재배포 금지.>"
