,날짜,기사제목,기사내용
0,2015.01.30. 오전 6:00,"[사건사고] 치매 노모·장애인 아들, 숨진 채 발견 外","			[뉴스투데이]◀ 앵커 ▶서울 송파의 다세대주택에서는 어머니와 장애인 아들이 숨진 채 발견됐습니다. 밤사이 교통사고도 잇따랐습니다. 정동욱 기자의 보도입니다. ◀ 리포트 ▶서울 송파구의 한 주택 다세대 3층.어제저녁 8시 반쯤 이곳에 살던 어머니 75살 표 모 씨와 아들 56살 이 모 씨가 숨진 채 발견됐습니다. 경찰 조사 결과 노모는 치매를 앓고 있었고 아들은 거동이 불편한 장애인이었던 것으로 나타났습니다.경찰과 소방 당국은 현장에 유서가 없어 이들 모자가 사고사를 당했을 가능성이 있는 것으로 보고 국과수에 부검을 의뢰해 정확한 사망 원인을 밝힐 예정입니다.=============================어제저녁 8시 40분쯤 서울 광진구의 한 아파트 앞 도로에서 직진하던 버스와 좌회전하던 택시가 충돌했습니다.이 사고로 택시 운전사 59살 김 모 씨가 머리 등을 크게 다쳐 병원으로 옮겨졌고 승객 48살 조 모 씨도 부상을 입었습니다.경찰은 좌회전하던 택시가 맞은 편에서 오던 버스를 보지 못해 사고가 난 것으로 보고 정확한 원인을 조사하고 있습니다.=============================앞서 어제 오후 5시 45분쯤에는 부산 중구 영주고가도로에서 부두 방향으로 달리던 트레일러가 승용차를 추돌했습니다. 이 사고로 69살 박 모 씨 등 3명이 다쳐 병원으로 옮겨졌고, 도로에 기름이 쏟아지면서 도로 양방향이 모두 통제됐습니다.MBC뉴스 정동욱입니다.(정동욱 기자)[저작권자(c) MBC (www.imnews.com) 무단복제-재배포 금지]		"
1,2015.01.26. 오전 6:00,교통문화수준 대전-세종-대구 순…꼴찌는?,"			(대구ㆍ경북=뉴스1) 이재춘 기자 = 운전자의 신호 준수 정도, 교통약자에 대한 배려, 교통사고 건수 등을 골고루 반영한 교통문화수준이 가장 높은 곳은 대전으로 나타났다.26일 교통안전공단 대구경북지역본부에 따르면 공단과 국토교통부가 지난해 전국 지자체별 '교통문화지수'를 조사한 결과 대전이 86.63점을 받아 전국 17개 광역시·도 중 1위를 차지했다.대전에 이어 세종(84.18점), 대구(83.58점), 부산(83.51점), 충북(83.20점), 서울과 인천(82.01점), 충남(81.61점), 경기(80.11점), 광주(80.02점)의 교통문화지수가 비교적 높은 편에 속했다.또 경남(78.61점), 울산(77.68점), 경북(75.10점), 제주(74.81점), 전북(74.73점), 강원(74.67점), 전남(68.58점) 순이다.운전자, 보행자의 습관과 행동양식을 지수화한 교통문화지수는 운전행태, 교통안전, 보행행태, 교통약자 등 4개 영역으로 나눠 11개 항목을 조사, 분석한 뒤 100점 만점으로 계량화한 것이다.운전행태 영역은 횡단보도 정지선 준수율, 안전띠 착용률, 신호 준수율, 방향지시등 점등률, 이륜차 승차자의 안전모 착용률 등 5개 항목으로 구성돼 있고 교통안전 영역에는 인구 10만명당 교통사고 건수와 사망자 수, 보행자 중 교통사고 사망자 수가 포함돼 있다.보행행태 영역은 횡단보도 신호 준수율이, 교통약자 영역에는 스쿨존 불법주차 점유율과 장애인 전용 주차구역 불법점유율이 조사 항목에 들어있다.leajc@[© 뉴스1코리아(news1.kr), 무단 전재 및 재배포 금지]"
2,2015.01.05. 오전 10:37,울산장애인단체 “중증장애인 정책 방향·철학 확립해야”,"울산지역 장애인들이 '지구에 살고 싶은... 별에서 on 장애인'을 주제로 장애인식 개선 캠페인을 하고 있다. (울산장애인자립생활센터 제공) © News1중증장애인자립생활지원센터 추가 및 콜택시 제도 개선 요구(울산=뉴스1) 조창훈 기자 = 울산장애인자립생활센터 김종훈 소장, 북구장애인인권센터 성현정 센터장, 울산북구장애인자립생활센터 윤여현 소장은 5일 중증장애인들의 자립생활 지원 확대와 이동권 보장 정책을 펼칠 것을 울산시에 촉구했다.울산장애인자립생활센터 김종훈 소장은 “최근 장애인 복지정책 패러다임이 ‘자립생활’로 변하고 있다. 단순한 지원에 그치는 것이 아니라 장애인들이 홀로설 수 있는 기반을 마련하는 데 집중해야 한다”고 강조했다. 이들은 중증장애인들의 사회활동 지원을 위해 중증장애인자립생활지원센터(이하 자립생활센터)를 구군별로 추가 설치하고 장애인 콜택시 제도의 확대 및 개선이 필요하다고 지적했다. 울산시에 등록된 장애인은 2014년 9월말 기준으로 4만8896명으로 이 중 1∼2급 중증장애인은 9808명이다. 여기에 3급 장애인 중 중복장애와 몇몇 장애도 중증장애에 해당되기 때문에 실질적 중증장애인 숫자는 1만명이 훨씬 넘는다. 하지만 울산시에는 국비 및 지자체의 지원을 받아 중증장애인의 자립을 도울 수 있는 자립생활센터가 한 곳뿐이다. 2014년 중증장애인자립생활지원센터 현황에 따르면 부산 6개소, 대구 5개소, 인천 4개소, 광주 4개소, 대전 3개소 등으로 1개소밖에 없는 광역시는 울산이 유일하다. 인구 44만의 제주시에도 2개소의 자립생활센터가 있다. 자립생활센터는 1~3급 중증장애인을 대상으로 자립생활 역량 강화, 동료상담 등 장애인 동료에 의한 서비스 지원, 장애인 학교 등을 통해 중증장애인이 일반인과 동등한 사회 구성원이 될 수 있도록 지원하는 역할을 하고 있다. 북구장애인인권센터 성현정 센터장은 “울산은 자립생활센터 한 곳에서 전 지역의 중증장애인을 관리하다 보니 접근성이 떨어지는 북구, 동구, 울주군 장애인에게는 지원이 거의 없다”고 말했다. 울산장애인자립생활센터 관계자는 “각 구군에 자립생활센터가 마련되면 침대에 누워 생활하는 와상장애인 등 사각지대에 놓인 중증장애인의 사회 활동 지원도 가능해 질 것”이라고 설명했다.울산장애인자립생활센터에서 장애인 자립을 위한 '동료상담'이 진행되고 있다. (울산장애인자립생활센터 제공) © News1자립생활센터가 1개소로 몇 년간 유지 되는 것에 대해 울산시와 각 구군의 의지 부족이라는 지적이 제기됐다. 울산장애인자립생활센터 김종훈 소장은 “중증장애인 자립 관련 조례안에 기본 계획을 마련해야 한다고 명시돼 있지만 울산시는 기본적인 계획자체가 없다”고 지적했다. 또 “울산시는 장애인 관련 각종 사업에 지원을 늘리고 있지만 이는 장애인을 도와줘야 한다는 인식에서 나오는 정책들이다. 일반인들과 동등한 존재라는 인식을 가지고 장애인 자립에 대한 철학이 필요하다”고 강조했다. 울산지역 구군 중 중증장애인 자립생활 지원 조례가 제정된 곳도 남구와 북구 두 곳 뿐이다. 특히 북구는 자립생활센터가 마련돼 있지만 지자체의 지원 없이 운영돼 제대로 된 기능을 하지 못하고 있다.이와 함께 장애인 콜택시 차량대수를 늘리고 24시간 연중 운행 하는 등 개선이 필요하다는 제안도 했다. 울산시에 따르면 울산지역 장애인 콜택시는 순환버스 2대를 포함해 34대가 오전 7시부터 오후 10시까지 운행되고 있다.‘교통약자의 이동편의 증진법 시행규칙’ 제5조 제1항에 따르면 1~2급 장애인 200명당 장애인 콜택시 1대를 두도록 돼 있다. 이에 울산시의회 문병원 의원은 2014년 9월말 기준 울산지역 1∼2급 중증장애인 수는 9808명으로 50대가 필요하다고 지적하며 법정대수 준수를 촉구하기도 했다. 울산지역 한 휠체어 이용 장애인이 장애인 콜택시를 이용하고 있다. (울산시 제공)© News1운영시간과 타 지역 운행 여부도 문제다. 부산, 인천, 대전, 대구, 광주 등 광역시는 24시간 연중무휴로 운영 중이지만 울산은 오후 10시 이후는 예약제로 운영하고 있다. 또 타 광역시는 인근 지역 운행까지 하고 있지만 울산은 기본적으로 시내 운행을 원칙으로 하고 타 지역으로 나가는 경우는 양산부산대학병원이 유일하다. 울산북구장애인자립생활센터 윤여현 소장 “울산은 지하철이 없고 버스 정류장에 휠체어 탑승 시설이 부족해 대부분의 휠체어 장애인들이 콜택시에 의존할 수 밖에 없다”고 말했다. 이어 “일반 차량을 늘리는 것은 휠체어 이용 장애인에게는 도움이 되지 않는다. 장애인 콜택시를 늘리면 다른 장애인들도 이용할 수 있어 일석이조의 효과를 거둘 수 있다”고 설명했다. 아울러 장애인콜택시의 요금(울주군 지역 9000원, 시내지역 4500원 초과 금지)이 기초생활수급자 등 경제사정이 여의치 않는 장애인들에게 부담이 된다며 지원을 요구했다. 이와 관련 울산시 관계자는 “새해에 장애인 콜택시 6대를 증차할 계획이다. 24시간 연중 운행 문제와 인접 시?군 운행 문제는 차를 더 구비해야 하고 예산에 대한 문제도 있기 때문에 추후에 검토해 보겠다”고 말했다. 북구장애인인권센터 성현정 센터장은 “아직까지 울산은 장애인에 대한 정책적 배려가 부족한 것이 현실이다. 자립생활센터 추가 및 콜택시 제도 개선은 울산시의 의지만 있으면 할 수 있는 정책이다”며 “새해에는 장애인이 사회 구성원으로서 당당히 설 수 있는 울산이 됐으면 한다”고 전했다.jch099@[© 뉴스1코리아(news1.kr), 무단 전재 및 재배포 금지]"
3,2015.01.05. 오전 8:17,장애인 자가운전 여전히 ‘그림의 떡’,"			<앵커 멘트> 장애인들이 취업하기 위해서는 스스로 운전할 수 있는 능력을 갖추는 게 필요한데요. 하지만 여전히 장애인들의 자가 운전을 돕기 위한 시설이나 제도는 부족하기만 합니다. 정새배 기자의 보도입니다. <리포트> 특수학교 교사로 근무하는 25살 유연철 씨. 얼마 전 도로교통공단에서 운영하는 장애인 지원센터의 도움을 받아 운전면허를 땄습니다.<인터뷰>  유연철(광주광역시 광산구) :  ""심리적인 안정감이 생긴 것 같아요. 면허증이 있으니까 언제든지 제가 원할 때 원하는 곳에 갈 수 있다는..."" 하지만 유 씨처럼 지원센터의 도움을 받은 장애인은 운이 좋은 경우입니다. 도로교통공단이 설치한 장애인 운전지원센터는 부산과 전남, 경기도의 세 곳에 불과해 전국의 수많은 장애인들이 도움을 받기에는 턱없이 부족하기 때문입니다. 어렵사리 면허를 손에 넣어도 넘어야 할 산은 또 있습니다. 차량을 개조해야 하는데 비용이 만만치 않습니다. 실제로 이처럼 차량을 특수하게 개조하는 데 많게는 수천만 원이 소요됩니다.자동차 값보다 훨씬 비싼데 부담이 클 수밖에 없습니다. 보건복지부에서 장애인 운전지원사업에 할당된 예산은 한 해 5억 원 정도. 이 예산으로는 현재 설치돼있는 장애인 운전지원센터의 인건비나 유지비 등을 충당하기도 빠듯해 추가적인 지원 사업은 엄두도 내지 못하고 있습니다. 국내 장애인 수는 250만 명.이 중 운전면허를 취득한 비율은 5.4%로 비장애인의 1/10 수준입니다. KBS 뉴스 정새배입니다.정새배기자 (newboat@kbs.co.kr)▶ [취재후] 방송에서 못한 현장 이야기▶ KBS뉴스 SNS [트위터][페이스북][카카오][저작권자ⓒ KBS 무단복제-재배포 금지]		"
4,2015.01.09. 오후 8:33,[인사] 부산경찰청 外,			      ◇부산경찰청 【경정 승진】 △청문감사담당관실 성백섭 △1부 정보화장비과 장성수 △〃 교통과 문종철 △2부 수사1과 이재홍 △〃 형사과 김삼식 △3부 외사과 심재준 △경찰특공대 박승호 △중부서 정보보안과 정진극 △동래서 수사과 국중용 △부산진서 형사과 김상동 △남부서 수사과 오영환 △해운대서 보안과 김종우 △〃 반석파출소 조기종 △사상서 수사과 문규주 △금정서 정보보안과 신찬욱 △강서서 청문감사관실 김광우 △북부서 구포지구대 윤영익 【경감 승진】 △홍보담당관실 박병구 △청문감사담당관실 정태열 △1부 경무과 오한길 △〃 〃 박규태 △〃 교통과 류현섭 △〃 〃 박진철 △〃 경비과 이재호 △2부 112종합상황실 임종윤 △〃 여성청소년과 박선주 △〃 수사1과 한흥주 △〃 형사과 전판개 △〃 형사과 서동호 △3부 정보과 석가람 △〃 정보과 주진환 △〃 보안과 추일엽 △〃 외사과 남재우 △경찰특공대 김준열 △중부서 생활안전과 탁상래 △〃 남포지구대 최문희 △동래서 경무과 박정열 △〃 형사과 심영동 △〃 온천지구대 천세철 △영도서 경무과 정용국 △〃 생활안전과 이경환 △동부서 청문감사관실 김길주 △〃 수사과 제해율 △부산진서 생활안전과 임채웅 △〃수사과 김기형 △〃 정보보안과 곽상만 △〃 당감지구대 윤현식 △〃 부전지구대 배성한 △서부서 수사과 노주석 △〃 구덕지구대 강정규 △남부서 생활안전과 김상우 △〃 여성청소년과 정상화 △〃 수사과 배병진 △〃 정보보안과 백근철 △〃 못골파출소 신호용 △해운대서 교통과 윤영한 △〃 여성청소년과 김은경 △〃 형사과 권기수 △〃 정보과 윤한철 △〃 좌동지구대 박주열 △사상서 청문감사관실 이행윤 △〃 여성청소년과 정승호 △〃 형사과 추한구 △금정서 청문감사관실 박기덕 △〃 수사과 김광호 △〃 정보보안과 조지혜 △〃 장전지구대 서국원 △사하서 생활안전과 김안호 △〃 형사과 권환식 △〃 하단지구대 권동효 △연제서 경무과 정철 △〃 생활안전과 황정섭 △〃 연일지구대 김동철 △강서서 정보보안과 이정현 △북부서 경비교통과 강정도 △〃 여성청소년과 김재복 △〃 금곡파출소 이창수 △기장서 경비교통과 김영완.◇한국해양대 △학생처 학생복지과장 송전희 △〃 입학장학과장 윤현아 △도서관 학술정보과장 장소연.◇경남 창원시 【3급 전보】△마산합포구청장 박춘우 △진해구청장 이종민 【4급 승진】△농업기술센터소장 진우철 △성산구 대민기획관 홍의석 △의창구 〃 이명옥 【4급 전보】△의창구청장 임태현 △기획예산실장 정수훈 △행정국장 정철영 △경제〃 정충실 △환경녹지〃 강종명 △관광균형발전〃 전경배 △안전건설교통〃 신용수 △창원보건소장 조현국 △문화도서관사업소장 허종길 【5급 승진】△의창구 신득만 김달년 △성산구 안봉진 조춘제 이제성 여판호 △마산회원구 왕수효 이경훈 허임영 이선우 정상호 △진해구 이찬영 문병기 △마산합포구 하식 △농업기술센터 마산지도과장 김정희 【5급 전보】△공보관 황진용 △기획담당관 홍명표 △예산〃 이영호 △교육법무〃 노무용 △정보통신〃 김기동 △행정국 부속실장 곽기권 △행정과장 권중호 △인사조직〃 안원준 △회계〃 신기열 △체육진흥〃 김상환 △야구장건립단장 이용암 △세계사격대회준비단장 류효종 △경제정책과장 송성재 △투자유치〃 김응규 △기업사랑〃 정성철 △세정〃 김윤기 △일자리창출〃 박부근 △환경정책〃 최옥환 △공원개발〃 박봉수 △사회복지〃 김금수 △문화예술〃 변재혁 △여성보육〃 조현준 △노인장애인청소년〃 이문수 △해양정책〃 허제웅 △항만지원〃 장진규 △관광〃 이충수 △균형발전〃 박인숙 △생태교통〃 강우대 △도시재생〃 김원현 △건축경관〃 이승우 △시민안전〃 최용균 △건설도로〃 김일규 △교통정책〃 김종환 △하천〃 이환선 △농업정책〃 김해성 △진해지도〃 박성원 △창원지도〃 배석규 △보건정책〃 김병석 △건강관리〃 현성길 △건강증진〃 노점상 △창원보건소 강명구 △하수행정과장 왕판이 △하수운영〃 오일환 △진해차량등록〃 김영문 △창원차량등록〃 이진태 △마산차량등록〃 차재권 △창원시의회 사무국 서정국 조현국 차상희 △의창구 최용성 황채성 △성산구 이연곤 △마산합포구 강춘명 김종택 박진수 이만식 △마산회원구 강성근 박영화 유득종 배선일△진해구 장용태 차석종 △인사조직과(공로연수) 박재기 전문자 정연경.◇경상대 【사무관】△총무과장 김상조 △법·경·사회과학대학 통합행정실장 정성진 △자연과학대학·약학대학 〃 박상원 △농·수의과대학 〃 신영진 △국제어학원 이재흥 △교육정보전산원 조영극△인재개발원 최성규.    		
