,날짜,기사제목,기사내용
14,2022.06.27. 오후 1:39,"[인터뷰] 정종복 기장군수 당선인 ""정부의 친원전 기조 찬성한다""","기사내용 요약""안전 전제로 한 원전 운영 필요""풍산 기장군 이전에 대해 '반대'""정관 지역 교통문제 해결 시급""[부산=뉴시스] 이동민 기자 = 정종복 기장군수 당선인. 2022.06.24. eastsky@newsis.com *재판매 및 DB 금지[부산=뉴시스]이동민 기자 = ""현 정부의 친원전 기조에 찬성한다. 고리 2호기의 정지에 관해서도 반대하는 입장이다.""정종복 기장군수 당선인은 현 정부의 원전 정책에 대해 안전을 전제로 하되 원전 운영은 꼭 필요하다며 이같이 답했다. 그러면서 정 당선인은 ""고리원자력본부에서의 전체 운영은 물론 해체 문제 등 관련 사안에 대해 감시하고 필요한 부분이 있다면 적극 지원할 예정""이라고 덧붙였다.해운대구 제2센텀단지 조성을 위한 풍산 부산 사업장의 기장군 이전에 관해서는 ""군민들의 의견을 대변해 반대하는 입장""이라고 밝혔다.정 당선인은 군정에 관한 자신의 철학에 대해 ""군민들과의 호흡이 무엇보다 중요하다""면서 ""지역 주민이 무엇을 원하는지 알아야 주민을 위한 행정을 선택해 밀고 나갈 수 있다고 생각한다. 군민군정자문회의를 꾸려서 분야별로 주민을 모시고 군정에 참여할 수 있도록 할 계획""이라고 말했다.다음은 정종복 기장군수 당선인과의 일문일답.-당선 소감은.""큰 성원과 사랑을 보내준 기장군민에게 감사하다. 군민들의 정성 어린 조언을 하나하나 가슴에 소중히 담아 반드시 보답하겠다.""-인수위원회 활동은 어떻게 진행되고 있나.""기장의 도시철도 정관선 예정지인 좌천역 일대와 동남권 방사선 융합클러스터 조성 현장, 도시농업 공원 조성 현장 등을 둘러보며 현황을 챙기면서 부서별 현안업무나 공약사항들을 검토하고 있다.""-기장군의 가장 시급한 해결과제는.""교통 문제 개선이다. 기장지역은 도시철도가 없어 부산 내 다른 지역에 비해 상대적으로 접근성이 부족하다. 특히 정관 지역의 교통 문제가 가장 심각하다. 얼마전에도 인수위원들과 좌천역을 다녀왔다. 임기 동안 정관 지역에서 좌천역까지 잇는 도시철도 공사를 조속히 진행할 것이다. 아울러 정관지역에서 버스를 애용하는 군민들을 위해 정관중앙공원에 환승센터를 구축해 교통 문제를 해결하려 한다.""-전임 군수의 재임 기간인 지난 12년간의 기장군을 평가한다면.""그간 기장군에 많은 발전이 있었지만 군청 내부에서는 공무원 조직 개편이 필요하다는 목소리가 있었다. 부서별로 투입된 공무원들의 수는 천차만별이지만 특정 직급으로 승진할 수 있는 인원은 부서별로 동일하게 돼 있다는 문제도 확인했다. 공무원들의 승진 문제 등 업무 여건이 개선돼야 행정의 질이 좋아지고, 나아가 군민들도 더 나은 혜택을 받을 수 있다. 임기동안 군청 내 행정시스템을 개편하겠다.""-새 정부 들어 원전 정책 기조가 탈원전에서 친원전으로 바뀌고 있다. 정부의 원전 정책에 대한 당선인의 입장은.""현 정부의 친원전 기조에 동의한다. 원전이 위험하다는 것은 누구나 인정하지만 별다른 이유 없이 탈원전하자는 것은 이해하기 어렵다. 군민들도 탈원전에 반대하는 여론이 높은 것으로 알고 있다. 내년 수명이 끝나는 고리 2호기의 정지에 관해서도 반대하는 입장이다. 원전 내부 기계 등을 전부 새것으로 바꾸면 운영하는 데 문제가 없을 것으로 생각한다. 다만 군민들의 안전이 최우선이다. 인수위 활동을 하면서 고리원자력본부를 방문해 기장군민 안전을 최우선으로 하는 원전운영 촉구문을 전달했다. 원자력 강국인 대한민국의 이면에는 국내 최대 원전 밀집 지역인 기장군민들의 희생이 있었다. 고리원자력본부에서의 전체 운영은 물론 해체 문제 등 관련 사안에 대해 감시하고 필요한 부분이 있다면 적극 지원도 할 예정이다.""-'풍산'의 기장군 이전에 대해 여전히 관심이 높은데.""군민의 입장을 대변해 저도 풍산의 기장군 이전에 반대하는 입장이다. 현재까지는 관련 기관들과 별다른 논의가 없었다. 취임 후 풍산 이전 문제와 기장군과 관련된 현안에 대해 논하려 한다.""-기장군민들의 일자리 해결책은.""일자리재단 등을 설치해 자립경제 기반을 확대해 나가겠다. 기존 군청에 일자리를 담당하는 부서가 있지만 기장 지역 기업으로부터 인력을 요청받아 연결해주는 역할에 불과하다. 일자리재단 설치의 핵심은 역량 개발이다. 지역 내 노약자와 장애인 등 사회적 약자들을 모집해 기업들이 필요한 기술 수요를 조사하려 한다. 실업자를 줄이면서 취업자 사후 관리까지 이뤄지는 선순환을 구축할 방침이다.""-기장군의 젊은 층들을 위한 맞춤형 정책이 있다면.""아이들을 키우는 젊은 부부들을 위해 정관 지역에 24시간 어린이 전문병원을 유치하고자 한다. 정관지역은 젊은 층이 세대의 상당수를 차지하고 있어 아동 전문 병원의 수요가 높지만 현재 제대로 된 병원 인프라를 누리기 힘든 게 현실이다. 24시간 어린이 전문병원을 반드시 유치해 명품보육·교육의 도시 기장을 만들겠다.""-군민들에게 하고 싶은 말은.""군민이 주인인 시대, 군민이 행복한 자립도시 기장을 만들겠다. 군민들의 목소리가 그 상상을 현실로 실현시키는 큰 힘이 될 것이다. 군민들의 성원에 행정으로 보답해 드리겠다. 앞으로 초심을 잃지 않고 군민들만 바라보며 나가겠다.""정종복 기장군수 당선인은 부산 기장군 철마면 출생으로 영산대 법무대학원 법학과를 졸업한 후 기장군의회 제4·5·6대 의원과 기장군의회 제5·6대 전반기 의장 등을 역임했다."
15,2022.06.30. 오후 5:13,"""사회공헌 앞장""…벤츠 사회공헌위, 사회복지기관에 차량 기증","2016년부터 7년간 차량 44대 기증""장애인과 아동 이동 편의성 제고""[이데일리 신민준 기자] 메르세데스-벤츠 사회공헌위원회가 장애인과 아동의 이동 편의성을 높이기 위해 전국 사회복지기관과 시설에 차량 기증 사회공헌 활동을 펼치고 있다. 메르세데스-벤츠 사회공헌위원회는 지난달 27일 취약 계층의 안전한 이동을 돕기 위해 전국 10개 사회복지기관과 시설에 ‘더 뉴 EQA’ 차량 총 10대를 기증하고 지원 기관 관계자들과 함께 전달식을 가졌다.피켓 위 왼쪽부터 울프 아우스프롱 메르세데스-벤츠 사회공헌위원회 위원, 김병기 사회복지법인아이들과미래재단 본부장, 토마스 클라인 메르세데스-벤츠 사회공헌위원회 의장, 홍진웅 산돌학교 교장, 이철승 메르세데스-벤츠 사회공헌위원회 부의장. (사진=벤츠 사회공헌위원회)벤츠 사회공헌위원회는 글로벌 자동차 브랜드가 갖는 특화된 전문성과 핵심역량을 활용해 한국 사회 구성원에게 기여하고자 벤츠 코리아와 다임러 계열사 3개사, 11개 공식 딜러사와 함께 2014년 출범했다. 메르세데스-벤츠의 약속(Mercedes-Benz Promise)이라는 공식 슬로건 하에 한국사회의 일원으로서 사회에 대한 책임 행동을 적극적으로 추구해야 하는 게 모든 기업이 기업시민으로서 갖는 의무라고 생각하며 다양한 활동을 펼치고 있다. 벤츠 사회공헌위원회는 지난 2016년부터 면밀한 심사를 거쳐 선정된 전국 사회복지기관과 시설에 차량을 기증하고 있다. 벤츠 사회공헌위원회는 올해 전북 군산 발달장애대안학교 산돌학교, 부산 나사함발달장애인복지관, 경기 광주 베다니동산 등 총 10곳의 사회복지기관과 시설을 선정해 더 뉴 EQA 차량 총 10대와 보험료 등 총 7억원 상당을 지원했다. 이들 모두 차량 지원 필요성과 지원 적합성, 차량 활용 방안 등 세부 항목에 대한 심사를 통해 선정된 곳들이다. 장량 베다니동산 원장은 “발달장애인거주시설은 대게 외곽지역에 위치하다 보니 교통여건이 매우 취약하다”며 “차량이 없으면 통원치료가 힘든데 벤츠 차량 과 보험료 등을 지원해줘 시설 이용자들 모두가 기분 좋은 안정감을 얻고 있다”고 말했다. 벤츠 사회공헌위원회는 지난해에도 더 뉴 EQA 차량 2대를 장기간 통원치료를 받고 있는 환아와 가족들이 머물고 있는 한국로날드맥도날드하우스에, C-클래스 차량 8대를 8곳의 사회복지기관과 시설에 기증하는 등 총 10대를 지원했다.벤츠 사회공헌위원회가 지난 2016년부터 지금까지 7년간 기증한 차량은 총 44대다. 이 차량들은 안전한 교통수단의 가치를 넘어 사회적 보호와 관심이 필요한 취약계층에게 삶을 풍족하게 영위할 수 있는 의료지원은 물론 사회적 교류와 문화적 활동까지 폭넓게 확대해 주고 있다고 벤츠 사회공헌위원회는 설명했다. 벤츠 사회공헌위원회는 사회에서 도움의 손길이 필요한 곳을 대상으로 차량기증 등과 같은 자동차기업으로서 할 수 있는 지원을 아낌없이 이어나간다는 계획이다.토마스 클라인 벤츠 사회공헌위원회 의장은 “차량 기증사업은 안전하고 편리한 이동이 무엇보다도 중요한 사회 취약계층에 더 직접적이고 실질적인 도움을 주고자 하는데 의미가 크다”며 “최고로 안전한 차량을 제공하고자 하는 벤츠의 가치에 부합하는 사회공헌활동을 앞으로도 지속적으로 이어나가 사회 저변에 도움을 확대할 예정”이라고 말했다."
16,2022.06.02. 오전 12:19,재선 성공한 박형준 부산시장 '15분 도시' 공약 등 탄력,"국민의힘 박형준 부산시장 후보가 1일 오후 선거사무소에서 당선이 확실시되자 꽃목걸이를 걸고 환하게 웃고 있다. [연합][헤럴드경제=박로명 기자] 박형준 부산시장이 6·1 지방선거에서 재선에 성공하면서 핵심 공약으로 제시한 '15분 도시' 조성 등의 사업 추진에 탄력이 붙을 것으로 보인다.15분 도시는 시내 62개 생활권을 중심으로 15분 거리 안에서 의료, 보육, 문화, 생활체육 등 편의시설을 이용할 수 있는 환경을 조성하겠다는 것이다.이와 관련해 2026년까지 어린이 복합문화공간 '들락날락'을 시내 전역에 300개 조성한다는 계획이 이번 선거의 공약 1순위에 올랐다.부산시는 이미 지난 4월 시청사 1층 로비와 3층에 1천240㎡ 규모로 들락날락 1호를 조성하기 위한 본격 공사에 들어갔고, 올해 안에 17곳을 더 만들 계획이다.박 시장이 지난해 4월 보궐선거에서 시장으로 처음 당선됐을 때 내걸었던 공약인 초음속 도시교통 수단 '어반루트' 도입도 속도를 낼 것으로 예상된다.어반루프는 진공 공간을 활용해 도시와 국가 간 이동하는 하이퍼루프 기술을 도시 내 이동 여건에 맞춰 적용한 초음속 교통수단이다.시는 가덕신공항 접근 문제 해결과 2030부산세계박람회 유치를 위해 가덕신공항, 북항(부산역), 동부산관광단지 등 시내 이동수요가 집중되는 지역을 곧바로 연결하는 방식으로 어반루프 도입을 추진한다.박 시장은 이번에 부산을 영어 상용도시로 만들겠다는 공약도 새로 내놨다. 영어로 소통이 원활한 환경을 조성하고 외국어 서비스가 불편 없이 제공되는 글로벌 허브도시로 만들겠다는 것이다.이를 위해 영어 국제학교 설립 확대, 외국전문대학 유치 강화, 영어교육센터 조성 확대 및 프로그램 다각화, 영어평생학습 지원 확대, 영어 신문과 영어방송 강화 등을 공약했다.또 의료 취약계층을 위해 지난 4월 본격 운영에 들어간 '찾아가는 의료버스'를 매년 4대 이상 추가로 도입해 2026년까지 20대까지 늘리겠다는 정책을 내놨다.인공지능, 클라우드 같은 첨단 정보통신기술이 적용된 의료버스는 이동형 초음파, 엑스레이 등 전문 검사장비를 갖추고, 의사와 간호사 등 전문 의료진이 건강검진, 상담, 교육 등 맞춤형 의료서비스를 제공한다.박 시장은 이 밖에도 부산창업청 설립, 창업혁신공간 조성, 메타버스를 기반으로 한 지역 브랜드 마케팅 플랫폼 구축, 장애인 진료 전용창구 지원 확대, 반려동물 종합병원과 수의전문대학 설립 등을 약속했다."
17,2022.06.28. 오전 9:01,"벤츠 사회공헌위원회, 사회복지기관에 전기차 EQA 10대 기증","			        메르세데스-벤츠 사회공헌위원회는 장애인과 아동의 이동 편의성을 높이기 위해 2016년부터 전국 사회복지기관과 시설에 차량을 기증하고 있다.메르세데스-벤츠 사회공헌위원회가 지난달 26일 전국 10개 사회복지기관과 시설에 ‘더 뉴 EQA’ 차량 총 10대를 기증하고 지원 기관 관계자들과 기념 촬영을 하고 있다. /메르세데스-벤츠코리아 제공        벤츠 사회공헌위원회는 차량 지원 필요성과 지원 적합성, 차량 활용 방안 등의 세부 항목을 심사해 기증처를 선정한다. 올해는 전북 군산 발달장애대안학교 산돌학교, 부산 나사함발달장애인복지관, 경기 광주 베다니동산 등 총 10곳의 사회복지기관 및 시설에 ‘더 뉴 EQA’를 각각 1대씩, 총 10대 지원했다. 각 3년간 보험료를 더해 총 7억원 상당이다.벤츠 사회공헌위원회는 지난해 더 뉴 EQA 2대를 장기간 통원 치료를 받고 있는 환아와 가족들이 머무르는 한국로날드맥도날드하우스에, C클래스 차량 8대를 8곳의 사회복지기관 및 시설에 기증한 바 있다. 2016년부터 현재까지 총 44대를 기증했다. 이 차량들은 안전한 교통수단 역할과 더불어 취약계층이 의료·사회·문화 활동을 하는 데 기여한다.벤츠 사회공헌위원회로부터 올해 더 뉴 EQA 차량 1대와 해당 차량의 3년간 자동차 보험료를 지원받은 장량 베다니동산 원장은 “발달장애인 거주시설은 대게 외곽에 위치해 교통 여건이 매우 취약하다”면서 “벤츠 사회공헌위원회의 차량 지원으로 시설 이용자들 모두 안전함과 안정감, VIP가 된 듯한 기분을 얻었다”고 말했다.벤츠 사회공헌위원회는 도움의 손길이 필요한 곳들을 대상으로, 차량 기증처럼 자동차 기업으로서 할 수 있는 지원을 계속 이어 나간다는 계획이다. 토마스 클라인 메르세데스-벤츠 사회공헌위원회 의장은 “차량 기증 사업은 안전하고 편리한 이동이 무엇보다도 중요한 사회 취약계층에 보다 직접적이고 실질적인 도움을 준다”면서 “차량 기증 사회공헌활동을 앞으로도 이어 나가 사회 저변에 도움을 확대하겠다”고 했다.벤츠 사회공헌위원회는 벤츠코리아 및 다임러 계열사 3개사와 11개 공식 딜러사가 모여 2014년 출범했다. 한국 사회의 일원으로 사회에 대한 책임을 추구하는 것이 기업시민의 의무라고 보고 있다. 국내에서 어린이 교통안전을 위한 ‘메르세데스-벤츠 모바일키즈’, 산학협동 프로그램 ‘메르세데스-벤츠 모바일 아카데미’, 임직원 참여형 봉사활동 ‘메르세데스-벤츠와 함께’, 스포츠와 기부를 결합한 나눔 확산 프로그램 ‘메르세데스-벤츠 기브’, 탄소중립 기후 행동 실천 프로그램 ‘메르세데스-벤츠 그린플러스’ 등을 펼쳐왔다."
18,2022.06.29. 오전 9:27,사회복지기관에 벤츠차·보험료 지원,"메르세데스-벤츠“발달장애인 거주시설은 외곽에 위치해 교통 여건이 취약합니다. 차가 없으면 통원치료가 힘든데 메르세데스-벤츠 차량 및 보험료 등을 지원해줘 VIP가 된 듯한 기분입니다.” 경기 광주시에 위치한 사회복지기관 베다니동산의 장량 원장은 올해 메르세데스-벤츠 사회공헌위원회로부터 ‘더 뉴 EQA’ 차량 1대와 3년간 자동차 보험료 등을 지원받은 후 이 같은 소회를 밝혔다.메르세데스-벤츠 사회공헌위원회가 10개 사회복지기관 및 시설에 ‘더 뉴 EQA’ 10대를 기증하고 있다.메르세데스-벤츠 사회공헌위원회는 이처럼 장애인과 아동의 이동편의성을 높이고, 의료 및 사회·문화활동 확대를 지원하기 위해 지난 2016년부터 전국 사회복지기관 및 시설에 차량을 기증하고 있다. 올해에는 전북 군산 발달장애대안학교 산돌학교, 부산 나사함발달장애인복지관 등 총 10곳의 사회복지기관 및 시설을 선정해 더 뉴 EQA 차량 10대 및 보험료 등 총 7억원 상당을 지원했다. 2016년부터 기증된 차량은 총 44대에 달한다.메르세데스-벤츠 사회공헌위원회는 한국 사회에 기여하고자 메르세데스-벤츠 코리아와 다임러 계열 3사 및 11개 딜러사와 함께 2014년 출범했다. "
19,2022.06.20. 오후 5:36,"엠브로컴퍼니 곱떡치떡, 발달장애 청년작가 박재영 작품으로 제품 패키지 제작","			㈜엠브로컴퍼니(대표 임형재)가 사단법인 한국자폐인사랑협회 부산지부 문화예술팀 '블루아트' 소속 발달장애 청년작가 박재영의 작품으로 제품 패키지를 제작했다고 20일 밝혔다.엠브로컴퍼니 곱떡치떡, 발달장애 청년작가 박재영 작품으로 제품 패키지 제작/사진제공=엠브로컴퍼니사단법인 한국자폐인사랑협회는 자폐성장애인과 가족의 권익을 대표하고 자폐에 의해 영향을 받는 지역사회 구성원들의 사회통합과 삶의 질 향상을 위한 복지사업을 수행하기 위해 2006년 12월 보건복지부의 인가를 받아 설립됐다. 특히, 한국자폐인사랑협회 부산지부 소속 발달장애 청년작가로 구성된 문화예술팀 '블루아트(BLUE ART)'는 온라인 전시회를 개최해 매월 발달장애를 가진 작가들의 작품을 대중에게 소개하고 지역사회와 연계하는 등 다양한 채널로써 작가들의 공공사회 활동과 재능 확대를 위한 창구 역할을 하고 있다. 이에 엠브로컴퍼니는 블루아트 지원의 일환으로 작가 스토리를 사회 곳곳에 전파하고자 자사 제품의 패키지를 박재영 작가(19세, 부산 해마루학교 3학년)의 작품으로 디자인했다. 어릴 적부터 교통수단과 지역명을 유난히 좋아했던 그는 기차, 지하철, 버스를 마음껏 그리며 행복을 찾는다. 비록 갈 수 없는 곳이라도 그곳으로 향하는 교통수단을 눈에 담고 캔버스에 옮겼다.박재영 작가는 장애인 창작아트페어전, '한젬마와 천재아티스트'전, 블루아트와 아르브뤼가 함께하는 '우리들의 이야기전', 발달장애인작가 그룹전 한새갤러리 인권전시회 ""이어지다"" 등에 참가했으며, '19회 전국장애청소년미술대전'에서 금상을 수상한 바 있다.엠브로컴퍼니 임형재 대표는 ""우수한 아티스트를 지원하고 그들이 가지고 있는 재능과 열정을 응원하며, 가치 있는 외식문화를 이끌어 내고자 시행하는 이번 활동에 많은 분들이 동참해주셔서 감사하다""며 ""예술은 '삶 속에 근본적 영역'으로서 뛰어난 발달장애 청년작가들과 다양한 형태의 소통과 긍정적인 시너지 효과를 기대한다""고 전했다.또한 미래전략기획실 홍석봉 실장은 ""작가의 작품을 알리는 이러한 활동이 최소한의 관심을 위한 마중물이 되기를 바란다""고 전했다.엠브로컴퍼니의 이러한 행보는 외식-문화 융합 프로젝트를 통칭하는 CCP(Change Chance Project)를 통해 획일적이고 경쟁적인 외식구조에서 벗어나 지역적으로 상생하는 외식문화를 지향하고 있다. 현재 브로컴퍼니는 '찜꽁찜닭' '곱떡치떡' '치꼬뱅' '더바른정국밥' '닭바를레옹' 등 각 분야마다 전문성을 갖춘 외식 브랜드를 운영하고 있다."
