,날짜,기사제목,기사내용
0,2020.01.29. 오후 6:01,코레일·부산교통公·전기안전公 1662명 채용,"			올해 2만5600여 명의 신입사원을 뽑는 공공기관들이 상반기 채용에 일제히 들어간다. 최대 규모인 1550명의 정규직을 뽑는 한국철도공사(코레일)를 비롯해 부산교통공사, 한국전기안전공사 등이 채용에 나선다.올해 공공기관 가운데 가장 많은 인원을 신규 채용하는 코레일은 다음달부터 본격적인 채용에 돌입한다. 코레일은 29일 상반기 채용 공고를 내고 “다음달 7일부터 10일까지 신입사원 채용을 위한 지원서를 받는다”고 발표했다.코레일은 사무, 운전, 차량, 토목, 건축, 전기통신 등 6개 분야에서 일반공채 660명, 보훈 140명, 장애인 50명 등 모두 850명(일반직 6급)을 뽑는다. 나머지 750명은 하반기에 선발할 예정이다. 코레일은 이번 채용 때 체험형 인턴 500명도 별도로 선발키로 했다. 코레일 합격자의 신입사원 연봉은 3300만원(상여금 제외) 수준으로 알려졌다. 코레일은 채용 규모가 큰 만큼 지원자도 많다. 1230명을 뽑은 지난해 하반기 채용에선 4만1014명이 지원해 평균 33 대 1의 경쟁률을 나타냈다.부산교통공사는 역대 최대 규모인 670명을 채용한다. 공채를 통해 운영(167명), 토목(3명), 건축(7명), 기계(45명), 전기(6명), 신호(38명), 통신직(50명) 등 모두 447명을 뽑는다. 이 밖에 경력자, 장애인 채용 등을 통해 223명을 선발한다. 지원서는 이달 31일부터 다음달 6일까지 받는다. 채용절차는 필기시험(2월 23일), 인성검사(3월 4~6일), 면접(3월 16~20일) 등이다. 최종합격자는 4월 6일 발표한다.한국전기안전공사도 142명의 신규 직원을 뽑는다. 2월 5일부터 11일까지 지원서를 받을 예정이다. 모집 분야는 신입직(경영관리 14명, 기술 106명, 기술취업지원대상자 16명, 연구직 3명)과 시간선택제 근로자 3명 등이다.공태윤 기자 trues@hankyung.com▶ 네이버에서 한국경제 뉴스를 받아보세요▶ 한경닷컴 바로가기  ▶ 모바일한경 구독신청 ⓒ 한국경제 & hankyung.com, 무단전재 및 재배포 금지		"
1,2020.01.25. 오전 5:26,휠체어 시외버스 단 '10대'…장애인들 멀고먼 고향가는 길,"법 제정 15년 됐지만 여전히 '시외 고속버스' 타기 힘든 장애인들""이동권은 기본적인 권리…우리도 버스 타고 고향 가고 싶다""3개월 전부터 '휠체어 탑승 고속버스' 시범사업 시작했지만…""갈 길 멀어""노선 겨우 4개에 전국 9000여대 버스 중 10대 뿐…'3일 전 예약' 등 문제점 다수국토부 ""개선해야 할 점 수시 청취중…시범사업 올 연말까지 연장 계획""[CBS노컷뉴스 서민선 기자]15년. 시외 고속버스까지 휠체어가 탑승 '가능'하게 되기까지 걸린 시간이다. '교통약자의 이동편의 증진법'이 2005년에 통과됐지만, 가장 보편적 도시 간 이동수단인 '시외 고속버스'까지 적용되는 데는 십수년이 걸렸다. 하지만 아직 갈 길이 멀다. 전국 9000여대 고속버스 중 고작 10대만 가능한 데다, 노선도 서울에서 각 지역을 오가는 4개밖에 없다. 장애인들은 '2020년'에도 여전히 자유롭게 이동하지 못하고 있다. ""우리도 설날에 버스 타고 고향 가고 싶다""고 외치는 이들의 목소리를 CBS노컷뉴스가 들어봤다.23일 서울역에서 만난 한국장애인자립생활센터협의회 최용기 회장이 활짝 웃고 있다./사진=서민선 기자◇서른 살 교통사고로 휠체어 생활 시작…""25년 동안 고향 못가""""저는 25년 전 교통사고로 신경이 손상돼 손과 발을 움직일 수가 없습니다. 아버지 산소가 고향인 전라북도 부안에 있는데, 사고 이후 한 번도 못 갔어요. 제가 탈 수 있는 교통편이 없거든요""설 연휴 하루 전인 지난 23일 서울역에서 만난 한국장애인자립생활센터협의회 최용기 회장(55)은 명절 계획을 묻자 이같이 말했다. 그는 ""사실 욕심 내서 고향에 가고 싶다고 하면 아예 불가능한 것만은 아니다. 근데 나를 도와주는 사람들에게 미안해지니까 자연스럽게 포기하고 있다""고 털어놨다.1995년 1월 16일. 서른 살이 된 지 보름이 갓 지난 그 날, 최 회장은 교통사고를 당했다. ""'블랙아이스'라고 하죠. 커브 길에서 브레이크를 밟는 순간 차가 밀리면서 사고가 났어요. 경추신경이 손상돼 사지가 마비돼서 손발을 전혀 움직일 수가 없습니다. 지금 휠체어를 타고 있고, 활동보조인이 없으면 일상생활이 어려운 중증장애인입니다""25년 동안 휠체어를 통해 이동하는 최 회장은 다친 이후 한 번도 고향에 내려가지 못했다. 마땅한 교통편이 없기 때문이다.""부안에서 고등학교 졸업하고 서울에서 군대 생활을 했어요. 다치기 전에는 명절 때면 기차 타고 버스 타고 가서 아버지 산소도 가고, 친구들도 만나고 그랬는데... 3시간 30분이면 가는 거리라 그때는 오히려 '귀찮아서' 안 갔죠. 그런데 지금은 가고 싶어도 대중교통으로는 못가니까 그냥 포기하고 살고 있어요""처음에는 '이동권'에 대해 깊이 생각해보지 않았다는 최 회장. ""장애가 없을 때는 솔직히 이동의 문제는 없었다. 하지만 장애가 있고 이동을 하려고 보니까 여러가지 제약들이 많이 있었다. 하다 못해 시내버스를 타려고 해도 저상버스가 도입이 안돼 있었고, 택시는 승차거부를 하더라""고 그는 말했다.이어 ""사회 구조상 장애인이 어딜 가고 싶다고 자유롭게 갈 수 있는 것도 아니다 보니까, 자주 포기하게 됐다""며 ""참는 것이 '미덕'인, 이를 강요하는 삶을 오래 살다보니까 점점 욕심이 없는 삶을 살았다""고 털어놨다.하지만 2001년 오이도역에서 장애인 승객이 리프트 추락사고로 사망하자, 적극적으로 이동권 투쟁에 뛰어들게 됐다. 그는 ""사고를 접하고 너무 끔찍하다는 생각이 들었다""며 ""결국 내 선택권과 결정권이 존중받으려면 이동과 같은 기본적인 권리가 보장돼야 하더라. 이동권 투쟁에 뛰어들게 된 계기""라고 말했다.지난 14일 전주에서 서울로 가는 고속버스에 승차하고 있는 고명진씨./사진=고명진씨 제공◇올 설에는 '휠체어 탑승 고속버스' 시범사업 중이지만…""갈 길 멀어""최 회장을 포함한 장애인들의 끈질긴 투쟁 끝에 2005년 교통수단에 장애인과 같은 약자에 대한 차별이 없도록 하는 법이 제정됐다. 지하철·시내버스·기차 등이 차례로 변화했지만, 여전히 갈 길은 멀다. 특히 민간에서 운영하는 '시외 고속버스'의 경우 휠체어 탄 장애인들이 이용하기 힘든 상황이다.국토교통부는 지난해 10월 28일부터 '휠체어 탑승 고속버스' 사업을 시범 운영 중이다. 고속버스 회사 10곳과 연계해 총 10대의 버스를 고쳐 휠체어가 탑승할 수 있도록 했다. 버스 한가운데 리프트를 달았고, 기존 좌석을 한쪽으로 밀어 공간을 마련하는 방식이다. 버스 한 대당 휠체어 총 2대까지 탑승이 가능하다.하지만 실제 장애인들이 '차별 없이' 버스를 자유롭게 이용하기 위해서는 넘어야 할 산이 많다. 서울에서 강릉·부산·전주·당진만을 오가는 적은 노선과 하루 1~2회라는 적은 운행 횟수가 가장 큰 걸림돌이다.휠체어를 탄 채로 고속버스에 탑승해 전주에서 서울로 이동해 본 경험이 있는 고명진씨는 ""일반 버스는 하루에 보통 10~20회 정도 운행하던데, 휠체어 탑승 버스는 오전과 오후 한 번씩 밖에 선택할 수 없었다""면서 ""집이 광주인데, 버스가 오전 7시에 출발하면 도저히 맞춰서 갈 수가 없다""고 토로했다.게다가 휠체어 탑승 버스를 이용하기 위해서는 3일 전에 예약해야만 한다. 취재진이 지난 22일 고속버스터미널에서 마주한 한 휠체어 탑승객은 예약을 하지 않아, 휠체어를 터미널에 세워둔 채로 일반 버스를 이용해야 했다. 급한 일정이 생겨도, 장애인들은 버스로 이동하지 못한다.인권 침해적인 요소도 있다. 고씨는 ""리프트가 올라갈 때 경보음 같은 소리가 계속 나더라. 사람들 시선이 집중돼서 기분이 좋지 않았다""며 ""안전문제라고는 하지만 기사님이 옆에 계속 지켜보는 상황인데, 그렇게 사람들이 딱 쳐다보게 만드는 소리를 굳이 내야 하는가 싶다""고 말했다.이어 ""버스 안에 일반 승객 자리를 접어둔 채 공간을 만드는 것이기 때문에 내부가 굉장히 좁다. 안전벨트를 매는데, 공간이 좁아 몸이 마치 결박당하는 것 같았다""고 기억했다.지난해 2월 1일 오전 서울 서초구 고속버스터미널에서 열린 ‘휠체어 탑승 가능 고속·시외버스 시승행사’ 에 참여한 한 장애인이 버스에 올라 출발을 기다리고 있다. 황진환기자◇국토부 ""시범사업 올 연말까지 연장 예정…부족한 점 수시로 청취 중""휴게소 이용 역시 개선해야 할 부분이 있다. 일반 버스의 경우 휴게 시간이 15분이지만 휠체어 탑승 버스는 30분이다. 휠체어 탑승객이 리프트로 오르고 내리는 시간 때문이다. 하지만 일반 승객과 함께 이용하는 상황이라 '눈치'가 보이기도 한다.강릉에서 서울까지 휠체어를 타고 고속버스를 이용해 본 경험이 있는 윤재선씨는 ""중간에 환승 구간에서 버스를 탄 일부 승객들이 '30분 휴게' 사실을 고지 못 받았는지, 기사님한테 빨리 가자고 재촉하더라""면서 ""나 때문인 것 같아 눈치가 보여 난처했던 경험이 있다""고 털어놨다.이어 ""이런 것은 일반 승객에게 배려만 바랄 것이 아니라, 미리 정확하게 안내를 하는 등 시스템적인 부분으로 개선할 수 있다고 생각한다""고 덧붙였다.심지어 연휴 때는 휴게소 화장실을 이용할 수 없을 수도 있다. 고속버스 예매 사이트인 '코버스'에 들어가 휠체어 탑승 버스를 예매하려고 하면 '설특별교통대책 기간 동안 고속도로 정체로 우회운행시 지정된 휴게소를 이용할 수 없어 장애인 화장실 이용이 불가할 수도 있습니다'는 안내 문구가 뜬다.이에 대해 고씨는 ""아무리 바쁜 기간이라지만 다른 것도 아니고 화장실을 이용하지 못할 수도 있다는 것은 '버스를 이용하지 말라'는 이야기로 밖에 안 들린다""고 토로했다.이외에도 '탑승장 20분 전 도착', '정해진 모델의 휠체어만 가능', '좌석 주변에 비상벨 없음' 등이 개선해야 할 문제로 꼽힌다.국토부는 시범사업을 올 연말까지 연장한다는 방침이다. 국토부 관계자는 ""원래 예정대로라면 이번 달 말에 시범사업이 끝나야 하지만 연말까지 연장하기로 했다""면서 ""개선이 필요한 부분에 대해서는 장애인 단체와 수시로 접촉해 의견을 듣고 있다""고 밝혔다.▶ 확 달라진 노컷뉴스▶ 인싸들의 선택, 노컷뉴스 구독 서비스▶ 노컷이 못한 일, 돈컷은 한다sms@cbs.co.kr저작권자 © CBS 노컷뉴스 무단전재 및 재배포 금지		"
2,2020.01.30. 오전 10:57,[부산 신종 코로나 현황] 의심증상 3명 검사 중(29일 오후 6시),"29일 오후 부산 금정구 부산교통공사 노포차량사업소에서 공사 관계자들이 신종 코로나바이러스 감염증(우한폐렴) 확산을 예방하기 위해 도시철도 전동차량 객실 방역 소독을 하고 있다. 방역소독은 ‘경계’ 단계에서는 3일에 1회 전 차량 방역 소독을 실시하고 ‘심각’ 단계가 되면 매일 실시하게 된다. 정종회 기자 jjh@부산 내 신종 코로나바이러스 감염증(우한 폐렴) 의심 증상으로 3명이 검사를 받고 있다고 30일 부산시가 밝혔다.부산시에 따르면 전날인 29일 오후 6시 기준으로 3명이 의사환자 또는 조사대상 유증상자로 분류돼 격리 조치된 뒤 신종 코로나바이러스 감염증 진단 검사를 받고 있다. 지금까지 부산에서 검사를 받고 음성으로 나타나 격리가 해제된 누적 인원은 모두 11명이다.같은 시각 기준 능동감시 대상자는 13명이다. 능동감시 대상자는 뚜렷한 증상이 없지만 신종 코로나바이러스 감염증 발원지인 중국 우한을 다녀온 뒤 관찰이 필요하거나 확진환자와 접촉한 사람이다. 잠복기로 판단되는 14일이 지나 능동감시가 해제된 누적인원은 모두 7명이다.부산시는 신종 코로나바이러스 감염증에 선제적으로 대응하기 위해 재난관리기금 3억 원을 투입하기로 했다고 밝혔다. 이 기금은 마스크와 손소독제 등을 구입해 노숙인, 장애인, 노인 등 재난 취약 계층과 버스, 택시 등 교통수단 방역에 지원된다.부산시 관계자는 ""중국을 다녀온 뒤 14일 이내 발열 또는 호흡기 증상이 나타난 경우 반드시 질병관리본부 콜센터(1339)나 관할 보건소로 먼저 연락해달라""고 말했다.최혜규 기자 iwill@busan.com▶ 네이버에서 부산일보 구독하기 클릭!▶ '터치 부산' 앱 출시, 부산일보 지면을 내 손 안에!▶ 부산일보 홈 바로가기"
3,2020.01.27. 오전 7:05,"장애인 대면낭독·정보검색 운영합니다, 부산 시민도서관","점자[부산=뉴시스] 하경민 기자 = 부산 시민도서관이 오는 3~12월 시각·발달 장애인에게 독서기회를 제공하기 위해 '장애인 대면낭독 및 정보검색 프로그램'을 운영한다.장애인과 자원봉사자 등 참가자들이 1대 1로 큰글자 도서, 촉각 도서, 점자 도서 등 대체자료를 활용해 대면낭독과 인터넷 정보검색 등의 활동을 하는 것이다.참가자들은 이 기간 주 1회 1시간씩 정해진 시간에 활동할 수 있다. 장애인 참가희망자는 2월9일까지 도서관을 방문하거나 전화로 신청하면 된다. 도서관은 프로그램 운영을 위해 성인을 대상으로 자원봉사자도 모집한다. 희망자는 2월9일까지 e-메일 또는 도서관을 방문해 신청서를 제출하면 된다. 자원봉사자에게는 교통비를 지급한다.임석규 시민도서관장은 ""이 프로그램이 장애인과 비장애인 간의 소통을 활성화하고, 정보 격차를 해소하는 데 많은 도움이 될 것""이라고 기대했다.☞공감언론 뉴시스 yulnetphoto@newsis.com▶ K-Artprice 오픈! 미술작품 가격을 공개합니다▶ 뉴시스 빅데이터 MSI 주가시세표 바로가기 <ⓒ 공감언론 뉴시스통신사. 무단전재-재배포 금지>		"
4,2020.01.24. 오후 3:32,"휠체어 타고 고향 가는 장애인들, 역에서 한발짝도 못 나가","[설맞이] 장애인의 '고향 가는 길', 올해는 수월한가요[오마이뉴스 박장식 기자]우리가 매일 이용하는 교통, 그리고 대중교통에 대한 최신 소식을 전합니다. 가려운 부분은 시원하게 긁어주고, 속터지는 부분은 가차없이 분노하는 칼럼도 써내려갑니다. 교통에 대한 모든 이야기를 전하는 곳, 여기는 <박장식의 환승센터>입니다. <기자말>이번 설날에는 장애인이 터미널에서 고속버스를 타고 고향에 갈 수 있게 되었다. 지난 10월 28일부터 휠체어 탑승이 가능한 고속버스가 서울고속버스터미널에서 부산과 강릉으로, 서울 센트럴시티터미널에서 당진과 전주로 운행되며 장애인의 이동권 향상에 첫 발을 뗀 것이다.그렇다면 장애인들이 고향에 가는 길은 이제 100% 편리해진 것일까. 일반인들에 비해 돌아가거나 시간적 손해를 보지 않고도 장거리 교통을 이용할 수 있을까. 터미널이나 역에 도착했을 때 목적지로 향할 교통편은 잘 되어 있을까. 2020년 설 연휴를 맞아 장애인의 '고향 가는 길'을 되짚었다.고속버스 4개 노선에 10대... 잠재수요에 비해 아쉬움 많아   ▲  휠체어를 탄 장애인의 승하차가 가능한 고속버스 플랫폼. ⓒ 박장식 장애인이 탑승할 수 있는 고속버스 노선 수는 모두 네 개. 수도권에서 강원, 영남, 충청, 호남 지역으로 향하는 노선이 하나씩 운영되고 있다. 하지만 실질적으로 장애인들에게 도움이 되는 노선이 많지 않아, 변화를 체감하기 어렵다는 것이 전국장애인철폐연대(이하 전장연) 조현수 정책실장의 설명이다.160여 개에 달하는 전국의 시군 중 사람이 타고 내릴 수 있는 기차역이 없는 지자체는 56개에 달한다. 전국 지자체 중 3분의 1이 사실상 장애인이 이동하는 데 제한이 걸린 셈이다. 이에 따라 2019년부터 운행되고 있는 것이 휠체어 대응이 가능한 고속버스이지만, 실제로는 56개 시군 중 당진시만이 해당 정책의 수혜를 입고 있다.조현수 정책실장은 ""전장연에서도 철도가 오가지 않거나, 울산광역시처럼 철도역에서 도심과의 접근성이 좋지 않은 지역에 먼저 운행하면 좋지 않냐고 요청했다. 하지만 터미널을 장애인 대응이 가능하도록 개조하거나, 우선사업자를 선정하는 데 문제가 있어 현재의 노선으로 확정된 것으로 안다""고 답했다.이미 운행 중인 노선도 운행 횟수가 하루 2회 정도로 적거나, 이동에 편리한 시간대가 아니라 장애인의 고속버스 이용을 꺼리게 하고 있다. 실제로 서울에서 부산으로 향하는 고속버스도 장애인 대응 고속버스는 오후 5시와 오후 7시 40분에 운행 중이다. 업무 등을 목적으로 선택하기에는 적합하지 않다.지역 - 지역 이동, 서울 거쳐가는 것이 더 편리할 때도   ▲  경북 예천터미널의 모습. 지방도시 터미널 중 상당수가 공간 및 예산의 부족을 이유로 장애인 대응 시설을 설치하는 데 어려움이 있다. ⓒ 박장식 휠체어가 대응할 수 있는 고속버스나, 휠체어 이용이 가능한 철도 서비스 역시 수도권을 중심으로 몰려 있다는 지적이 나온다. 실제로 휠체어를 사용하는 장애인이 지방 도시에서 다른 지방으로 이동할 때, 심지어는 같은 강원도인 강릉에서 춘천으로 갈 때마저 서울을 경유해 이동하는 경우가 허다하다.이러한 문제의 해결을 위해서는 서울 외 지역의 터미널에 적극적으로 휠체어 대응 설비를 설치하는 한편, 시외버스에도 고속버스와 동일한 장애인 리프트 등을 설치하는 대안이 필요하다. 다만 터미널 이용환경이 열악한 지방 터미널이 적잖아 많은 예산이 소요된다는 것이 걸림돌이다.조현수 정책실장은 ""아직 터미널 환경이 충분하지 못하고, 환승하는 데 어려움이 있어 국토교통부가 시외버스에 바로 도입을 하지 못하는 것으로 안다""라며, ""터미널 뿐만 아니라 중간정차지, 환승휴게소 등에서도 장애인이 타고 내릴 수 있도록 개선이 필요하다""고 덧붙였다.여객철도도 비슷한 성장통을 겪었다. 과거에는 휠체어 대응 시설이 있는 열차가 한정적이었다. 더욱이 휠체어 리프트 고장으로 인해 탑승객이 열차를 타고 내리지 못하거나 리프트가 떨어져 낙상사고를 입었던 사례도 있었지만, 현재에는 이러한 일이 크게 줄었다. 휠체어 대응 시외/고속버스도 같은 과정을 거쳐 정착될 수 있을까.고향에 도착해도 갈 길이 없다   ▲  경북 문경시에서 운행 중인 저상버스의 모습. 지방 중소도시에서의 저상버스는 '가뭄에 콩 나듯' 보이는 경우가 많다. ⓒ 박장식 고향에 도착해도 정상적으로 고향의 목적지로 향하기 어려운 점이 많다는 것 역시 장애인들의 귀성길을 꺼리게 하는 요인이다. 특히 군 지역에서는 장애인 탑승 가능 저상버스를 운행하지 않는 데다가, 장애인 콜택시도 없어 휠체어를 타고는 터미널 앞, 기차역 앞에서 한 발짝도 벗어날 수 없는 경우가 허다하다.조현수 정책실장은 ""시내버스나 농어촌버스 등 대중교통에는 100% 저상버스가 도입되어야 한다""며, ""휠체어 장애인들이 터미널, 역에 도착한 뒤 버스를 타고 자신이 가고자 하는 목적지에 도달해야 하는데, 특히 농어촌 지역에는 저상버스가 미비한 것이 사실""이라 설명했다.장애인콜택시가 있는 지역도 일반택시와는 다르게 지자체마다 탑승 규정이나 시계외 운행 등 규정이 제각각이다. 시계외 영업이 불가능해 다른 지역으로 나가지 못하는 경우도 있는가 하면, 아예 지역에 등록된 장애인 외에는 그 지역의 장애인콜택시 이용이 불가능한 경우도 있다.장애인을 위한 교통정책이 대도시를 넘어 중소도시에도 적용될 필요성이 대두된다.""너무 늦게 시작되었지만, 지금이라도 본사업 되었으면""   ▲  휠체어 장애인의 탑승이 가능한 고속버스 차량의 모습. ⓒ 박장식 올해 장애인 대응 고속버스 사업에 배정된 예산은 13억 원으로 지난해와 같다. 이 예산으로는 10대의 버스를 장애인에 맞게 개조할 수 있다. 하지만 3개월의 시범사업 이후 본사업으로 격상된다는 당초 계획과는 달리, 올해도 계속 시범사업으로 운영된다는 점이 불안요소이다.조현수 정책실장은 ""시외 이동권에 대한 문제제기를 2013년 설부터 했다. 햇수로만 따지면 문제제기 6년 만에 시범사업이라는 형태로 첫 시작을 하게 된 것이다""라며, ""모든 교통수단에 대해 이동권을 보장하는 교통약자법이 2006년부터 시행되었는데, 그 법제정으로부터는 14년만이기도 하다""라고 말했다.조 정책실장은 ""휠체어 고속버스 도입을 늦었지만 환영하지만 너무 늦게 시작한 점이 안타깝다""며, ""올해 하반기부터라도 예산을 확보하는 등 본사업으로 실시돼 예약에 어려움이 없이 탑승할 수 있도록 개선되기를 바란다""고 바람을 전했다.국토교통부 관계자는 시범사업의 연장에 대해 ""휠체어 고속버스 도입 이후 탑승인원 모니터링을 했는데 차량 대수나 노선이 적고, 선예매 제도에 불편을 느끼는 경우도 많아 탑승 인원이 많지 않다""라며, ""시범기간 3개월이 짧아 올해 말까지 시범기간을 연장하는 것이 옳다고 판단했다""라고 해명했다.이 관계자는 ""경과를 보고 보완을 해나가면서 노선 확대 등에 대해서도 진행시기를 맞추어나갈 계획이다""라며 덧붙였다.저작권자(c) 오마이뉴스(시민기자), 무단 전재 및 재배포 금지▶오마이뉴스에서는 누구나 기자가 될 수 있어요▶네이버에서 오마이뉴스 채널을 구독하세요▶용감하게 성교육 <이런 질문, 해도 되나요?>"
