,날짜,기사제목,기사내용
0,2016.03.28. 오후 4:39,"""장애인 유권자 권리 보장 위해 사회적 지원 절실""","총선장애인차별철폐연대(이하 총선연대) 회원들이 4일 오전 서울 종로구 와룡동 선거관리워원회 앞에서 '장애인 참정권 확보를 위한 정당한 편의 촉구 및 요구안 발표' 기자회견을 열었다.2016.3.4@News1 DB투표소 이동지원·편의, 투표교육 등 확대돼야(부산=뉴스1) 김민경 기자 = 민주주의의 꽃 선거가 17일 앞으로 다가왔다. 모든 사람이 동등하게 보장받아야할 권리 중 가장 기본이 되는 것이 투표할 권리이지만, 장애인들이 유권자로서의 권리를 보장받기 위한 사회적 지원은 여전히 미흡한 실정이다. 특히 장애인들이 정치에 대한 높은 관심과 참여의지를 가졌음에도 불편한 투표소 환경 등을 이유로 투표하지 않는 것으로 확인되면서, 장애인단체를 중심으로 Δ투표소 이동 지원 서비스 확충 Δ투표소 장애인 편의 증대 Δ장애인 대상 투표 교육 확대 등에 대한 요구가 잇따라 나오고있다. 한국장애인단체총연맹은 지난해 11월 제20대 총선을 앞두고 17개 시·도 장애인 유권자 602명을 대상으로 정치에 대한 관심도를 알아보기 위한 의식조사를 실시했다.   조사결과 78.5%가 4.13총선에서 투표에 참여하겠다고 답했다. 조사 대상자 중 2014년 6.4 지방선거에 투표했다고 응답한 이는 73.6%였다. 이는 당시 전국 투표율 56.8%보다 훨씬 높은 수치이다.  지방선거 투표에 참여하지 않았다고 답한 이들의 30%는 투표소 접근과 이동에 따른 어려움을 이유로 꼽았다.  김철수씨(가명·40대)는 “사고로 장애인이 되기 전에는 투표소에서 투표하는데 별다른 어려움이 없었다. 그러나 장애를 가진 후 투표소의 위치, 경사로, 작은 문턱 하나까지 모두 거대한 산”이라며 “장애인도 비장애인처럼 혼자 투표할 수 있는 환경이 마련되면 좋겠다”고 말했다.◇투표소 이동 지원 서비스 강화돼야부산시선거관리위원회는 내달 8∼9일 진행되는 사전투표일과 투표당일인 13일 장애인 콜택시와 두리발 등에 추가해 중증신체장애인을 대상으로 총 40대의 지원차량을 운행한다고 28일 밝혔다.   이 서비스는 ‘장애인 투표활동보조인 지원제도’에 따라 장애인의 투표권 행사에 필요한 편의를 제공하기 위한 것으로, 장애인의 신청을 받아 구 단위의 장애인 협회와 연계해 투표소 이동차량을 지원한다. 부산 16개 구·군에서 중구 1대, 진구 3대, 동구 4대, 해운대구 5대를 비롯해 나머지 11곳은 각각 2대씩 지원차량을 운행한다. 부산장애인차별철폐연대 신수현 대표는 “40대는 턱없이 부족하다. 시가 직접 나서 투표일의 투표소 지원차량 수를 확대 운행해야 한다”며 “특히 장애인의 사회활동을 돕기위한 장애인 콜택시와 같은 상시적인 이동권 보장 서비스와 투표소 이동 지원 차량의 수는 구분돼야 한다”고 지적했다.그렇지 않으면 투표당일 투표소가 아닌 다른 곳에 가고자 하는 장애인의 이동권이  심각하게 침해당할 수 있다는 설명이다.이어 “2만여 명에 달하는 부산지역 장애인들은 평소에도 공공기관의 이동지원 서비스를 이용하기 위해 3~4시간이 넘게 대기해야 하는실정”이라며 “투표 당일에는 경쟁이 더 치열해 질 것”이라고 말했다.  2014년 기준 부산지역 등록 장애인은 16만8663명으로, 이중 만19세 이상 투표권을 가진 이는 97%(16만3432명)에 달한다.  등록하지 않은 장애인 수를 감안하면 부산 지역 장애인 유권자 수는 이보다 많을 것으로 보인다.  투표소에 가기 위한 교통 편의뿐만 아니라 장애인들의 투표소의 편의도 보다 증대될 필요가 있다. 청각장애인 50대 남모씨는 “지방선거 때 여러 장의 투표용지를 받았다. 투표소에는 이와 관련해 수화로 설명해줄 선거요원이 없었다”며 “가족이나 보조인이 없었다면 투표를 제대로 하지 못했을 것”이라고 말했다.      시 선관위는 장애인들이 투표소에서 겪는 불편함을 해소하기 위해 투표소마다 장애인 기표소를 마련하고, 신체장애 때문에 정확한 기표가 어려운 이들을 위해 기표보조용구를 제작해 지원할 계획이다.이에 대해 복지전문가들은 “장애인을 위한 시설물을 설치하는 것이 능사가 아니다”며 “장애 특성에 맞게 투표 절차와 보조용구 등에 대해 안내해 줄 전담요원을 투표소마다 배치하는 것이 무엇보다 중요하다”고 말했다.      ◇장애인 대상 투표교육 보편화돼야부산시선거관리위원회는 지난 16일 발달장애인 거주시설인 연제구 성우원에서 발달장애 유권자 60여명을 대상으로 선거제도 교육과 모의체험 투표소를 운영했다.(부산시 선관위 제공)2016.3.28/ © News1김민경 기자유권자로서 소외당한 채 살아가는 장애인들도 있다. 바로 발달장애인들이다. 이들이 시민의 권리를 행사할 수 있도록 사회적 관심 제고와 맞춤형 투표교육 등이 절실하다.   2014년 ‘발달장애인 권리 보장 및 지원에 관한 법률’이 제정되고 작년 11월 본격적으로 시행되면서 발달 장애인의 기본적인 권리를 보장해야할 법적 근거가 생겼다.  이에 따라 부산시선거관리위원회는 올해 처음으로 지난 16일 발달장애인 거주시설인 연제구 성우원에서 발달장애 유권자 60여명을 대상으로 선거제도 교육과 모의체험 투표소를 운영했다. 모의체험투표소는 발달장애 선거인의 성명이 기재된 모의선거인 명부를 사용하는 등 실제 투표소와 동일하게 준비됐다. 발달장애인들은 신분증을 확인하는 절차부터 실제 투표하는 전 과정을 직접 체험했다.이날 교육을 맡은 부산지적발달장애인복지협회 조용선 사상구지부장은 “쉬운 단어와 그림 등 대체의사소통수단을 활용해 발달장애인들에게 선거 개념을 설명하고, 자신들이 원하는 후보를 뽑을 수 있는 환경을 사회가 제공해줘야 한다”며 “이런 교육이 보편화되는 것이 바람직한데, 시설 1곳에서만 진행돼 아쉽다”고 말했다.  이어 발달장애인의 경우 낯선 환경에 대한 두려움이 크기 때문에 모의투표소를 경험해보는 것은 실제 선거에서 투표권을 행사하는데 지대한 영향을 미친다고 설명했다. ㈔부산장애인부모회에 따르면 부산 지역 발달장애인은 2만여 명으로, 이들 중 60%가 19세 이상 성인 발달장애인으로 추정된다.tmk86400@▶ 핫이슈- 40대 산모 7번째 제왕절개로 출산…국내 최초 추정▶ 핫이슈- 윤상현 31.6% vs 김정심 11%…이상일 39% vs 표창원 32.8%▶ 뉴스1 100% 무료 만화 서비스 오픈!![© 뉴스1코리아(news1.kr), 무단 전재 및 재배포 금지]"
1,2016.03.30. 오후 7:30,"새누리 부산시당, 총선 출정식 열고 '총선 승리' 다짐","예비후보들, '초심' 새겨진 작업모 쓰고 지역별 공약 발표하며 지지 호소 [안정은 기자] 4.13 총선 새누리당 부산지역 후보들이 공식 선거운동을 하루 앞둔 30일 '일꾼론'을 앞세워 출정식을 갖고 승리를 다짐했다. 오후 2시 부산시의회 브리핑룸에서 개최된 이날 출정식에는 김무성 김척수 김도읍 김세연 예비후보를 제외한 부산지역 후보자 14명이 참석했다.  김정훈 공동 선거대책위원장은 ""과연 누가 우리 지역과 부산, 그리고 대한민국 국익을 위한 일꾼인가 잘 살펴 소중한 한표를 행사해 달라""고 지지를 호소했다.이어 현역 공천 탈락자가 전혀 없는 데 대한 민심 이반을 우려한 듯 ""공천과정에서 시민과 당원에게 심려를 끼쳐 진심으로 사과드린다""면서 ""밀실공천에서 벗어나 역대 최초로 민의를 반영한 시스템 공천으로 후보를 선출했다""고 강조했다.  김 위원장은 ""투표일은 문제를 만들기만 하는 정당과 문제를 해결하는 정당, 말만 하는 정당과 책임지는 정당, 발목 잡는 정당과 민생실천으로 희망을 만드는 정당, 일자리 방해 정당과 일자리 창출 정당을 판가름하는 날""이라며 야당을 겨냥해 비판의 목소리를 높였다.  '초심'이라는 글자가 새겨진 작업모를 쓰고 출정식에 참석한 후보들은 각 지역별 공약을 발표하고 부산발전을 견인하겠다며 유권자들에게 지지를 당부했다. 박민식 후보(북강서갑)는 “북구청 이전, 만덕 센텀 지하고속화도로 개통, 임기 내 제3만덕터널 완공”을 공약으로 내세웠다. 이진복 후보(동래)는 “사람이 많이 모이는 동래구의 접근성을 높이고 교통을 편리하게 재정비하고 문화 교육특구를 만들어 금강공원 야경전망대 케이블카 등 동래를 부산의 랜드마크로 탈바꿈시키겠다”고 약속했다.  나성린 후보(부산진갑)는 “국립아트센터 완공과 재래시장 활성화”를 공약으로 걸었다. 김희정 후보(연제구)는 “역대 최강의 부산의원을 만들고 연제구에 고용증진센터를 유치함과 동시에 온천천주변 캠핌장을 건설하겠다”는 뜻을 분명히 했다. 손수조 후보(사상)는 “지난 잃어버린 4년 동안 문재인 의원의 구치소이동 공약이 지켜지지 않았다”면서 “사상스마트시티산업과 사상공단을 바꾸고 관내 중고등학교 유치, 장애인 1대1 간병시스템도 구축하겠다”고 피력했다. 한편 새누리 예비후보들은 31일 오전 부산 중구 중앙공원 충혼탑을 찾아 합동 참배한 뒤 공식 선거운동을 시작한다. 다음은 30일 제20대 총선 새누리당 부산 후보자 합동기자회견 전문.존경하는 부산시민 여러분,  내일이면 제20대 국회의원 선거운동 기간이 시작됩니다. 이번 국회의원 선거는 박근혜 정부의 임기 마무리를 도와 안정적인 국정운영으로 대한민국과 부산의 발전에 도움을 줄 사람이냐, 아니면 사사건건 발목잡기로 국정운영을 어렵게 만들었던 사람이냐를 선택하는 선거입니다.  내일부터 돌입하는 선거운동 기간 동안 과연 누가 우리 지역과 부산, 그리고 대한민국 국익을 위해 활동할 일꾼인가를 잘 살펴서 선거일에 소중한 한 표를 꼭 행사해주시기 바랍니다.  지난 공천과정에서 우리 새누리당에 대해 많은 시민들과 당원들께서 걱정을 해주셨습니다.  심려를 끼쳐드려 머리숙여 진심으로 사과드립니다. 그 과정이 더 잘 하기 위한 일이라 생각하고 너그러이 용서해주시기 바랍니다. 이번 공천에서 크고 작은 불협화음이 있었던 것은 사실이지만, 우리 새누리당은 상향식 공천제를 통해 과거 특정인에 의해 좌지우지되는 밀실공천에서 벗어나, 역대 최초로 민의를 반영한 시스템 공천으로 후보를 선출했다는 점에서 시민 여러분들의 이해를 당부드립니다.   우리 새누리당 후보자 일동은 이로 인한 당내 분열이 더 이상 없도록 노력 할 것이며, 화합으로 시민들을 섬기며 선거에 임할 것을 다짐합니다. 과거 18대는 0곳, 19대는 44곳에서 경선을 치렀는데, 이번 20대에는 전체 253개 지역중 141곳이 경선지역으로 선정되어 약 60% 가까이 상향식 공천이 이뤄진 셈입니다.  이 때문에 현역의원 교체율이 다소 떨어진 측면이 있지만, 대다수 민의를 반영한 공천이었고, 우리 새누리당 부산 국회의원 후보들이 당선된다면 역량과 경험을 살려 부산발전과 예산확보에 더 큰 도움이 될 것이라고 확신합니다.  경선에서 떨어진 후보들도 한분, 한분 우리 새누리당의 소중한 자산입니다. 저희 새누리당 후보자 일동은 부산발전을 위해 하나 된 마음이 될 수 있도록 더 많은 위로와 격려로 이분들과 함께 힘을 모을 것입니다.  저희들은 이번 선거를 깨끗한 선거, 좋은 공약과 실천으로 승부하는 정책선거로 임할 것입니다. 어제 저희들은 시민들께 ‘20-20공약’을 발표했습니다.  그 속에는 해양, 금융, 첨단산업 등을 통한 일자리창출, 교통난 해소, 자영업자 지원, 문화육성, 복지, 주민자치, 안전 등에 대한 내용이 있고, 이를 반드시 실천해서 시민 여러분들께 희망의 부산, 경제가 살아나는 부산, 서민들이 함께 웃음 짓는 건강한 부산을 만들어 보답하겠습니다.  사전투표일인 4월 8일과 9일, 그리고 선거일인 4월 13일은 문제를 만들기만 하는 정당과 문제를 해결하는 정당, 말만 하는 정당과 책임지는 정당, 발목 잡는 정당과 민생실천으로 미래·희망을 만드는 정당, 일자리 방해 정당과 일자리 창출 정당을 판가름하는 날입니다.현명하신 부산시민 여러분, 우리 부산과 대한민국 발전을 위해 꼭 시간을 내어 그 3일중에서 귀중한 한 표를 행사해주시기를 당부드립니다.  시민 여러분들의 지지를 기대하기 이전에 저희 새누리당 부산 후보자 일동은 먼저 변화하고, 먼저 다가가는 노력을 아끼지 않겠습니다.  건강하고 상식적인 사람들이 자부심을 갖는 도시 ‘부산’을 만드는 데 전념하겠습니다.  우리 대한민국의 안보를 튼튼하게, 부산의 경제를 활기차게, 일자리를 풍성하게 만들 수 있도록 저희 새누리당 후보에게 많은 성원과 지지를 당부드립니다.  감사합니다.  안정은 기자 (news3@pressian.kr)프레시안 조합원, 후원회원으로 동참해주세요. 좌고우면하지 않고 '좋은 언론'을 만드는 길에 정진하겠습니다.(☞가입하기)▶아직도 프레시안조합원이 아니십니까?▶모바일 페이지 바로가기Copyrightsⓒ PRESSian.com 무단전재 및 재배포금지"
2,2016.03.30. 오후 7:10,[생활의 여유] 모집-부산,"쿠키클레이 자격증반 수업 장면.  사상여성인력개발센터 제공     쿠키클레이 지도사=사상여성인력개발센터. 4월 4일~5월 2일 매주 월요일 오전 10시~정오 사상여성인력개발센터 강의실. 쿠키클레이 지도사 자격증 취득을 위한 준비 교육 과정. 수강 인원 14명. 수강료 7만 원(재료비 6만 원). 051-326-7600.우리 반송 예체능 유급 자원봉사자 모집=운봉종합사회복지관. 4월 6일~11월 23일 매주 수요일 오후 4시~7시 운봉종합사회복지관 3층 체육실 및 인근 볼링장. 반송 지역 청소년과 볼링 및 탁구 활동 실시. 051-543-2431.제6기 YOU&I 대학생봉사단 모집=장선종합사회복지관. 3~12월 장선종합사회복지관 및 부산 지역. 대학생과 휴학생 10명. 다양한 경험과 폭넓은 인맥을 형성하고 싶은 대학생, 휴학생이라면 누구나 참여 가능. 24일까지 모집. 홈페이지(www.jsswc.or.kr)에서 신청서를 내려받아 이메일(jangsunswc@hanmail.net) 송부. 051-336-7007~9, 070-4825-8405.2016년 산재근로자 사회 적응 프로그램 '희망을 품은 우리'=해운대종합사회복지관. 4~6월(1기), 8~10월(2기) 매주 화·목요일, 산재근로자들을 대상으로 한 심리 치료, 사회성 향상, 직업 훈련 프로그램 제공을 통해 산재근로자의 성공적인 사회 복귀를 돕고 사회 구성원으로 자기실현을 할 수 있도록 지원하는 프로그램. 업무 중 산업 재해를 입고 장해등급(1~4) 판정일로부터 3년 이내인 자, 2년 이상 통원요양 중인 자 20명(1기-10명, 2기-10명). 무료. 교통비와 식비 지원. 선착순 전화 혹은 방문 접수. 051-782-5005~7. 산유화 어린이 민요합창단 모집=경상도민요보존회. 매주 금요일 오후 5시~8시 부산예술회관. 7~16세. 경상도 지역의 우리 소리와 춤을 배우고 널리 알리는데 이바지할 어린이 민요합창단 단원 모집. 1개월 10만 원. 010-3080-3397.제17기 장애인 운전면허 취득교육생 모집=㈔부산국제장애인협의회. 매주 3회(총 7주, 21회) 매주 월~금요일 부산도시철도 초량역 6번 출구 커피타운빌딩 702호. 1~6급 등록장애인. 운전면허 취득 교육. 무료. 051-469-3250.    		"
3,2016.03.22. 오후 2:32,"김기운 예비후보 ""교통약자 이동권 강화 앞장설 것""","[경남CBS 송봉준 기자](사진=송봉준 기자)김기운(더불어민주당.창원 의창구) 예비후보는 22일 창원시청에서 공약 발표 기자회견을 갖고 ""교통약자 이동권 강화를 위해 관련법을 정비해 전국적으로 운행대수 산정기준을 1급과 2급 장애인 100명당 1대로 낮춰 보다 많은 교통약자가 훨씬 편리하게 병원을 다니고 사회활동을 할 수 있도록 노력하겠다""고 밝혔다.현재 기준은 200명당 1대이다.김 후보는 ""거의 운영이 정지된 창원시 교통약자 콜택시 차량 40대를 원활히 운영할 수 있도록 국비를 받아 적극 지원하는 한편, 창원시 교통약자 콜택시기사 처우가 나빠지지 않게하고 부산광역시와 협상해 요금과 운영대수 등 상호균형이 이루어지도록 해 창원시민이 선의의 피해를 보지 않도록 하겠다""고 강조했다.또 2인 휠체어 탑승차량 도입과 콜센터 인력 보강, 바우처택시 도입 등도 검토하겠다는 공약을 제시했다.bjsong@cbs.co.kr저작권자 © CBS 노컷뉴스(www.nocutnews.co.kr) 무단전재 및 재배포 금지 "
4,2016.03.30. 오전 8:12,부산 장애인용 특장차·택시 콜센터 하나로 통합,"    (부산=연합뉴스) 김상현 기자 = 부산지역 교통약자를 위한 특별교통수단의 콜센터가 하나로 통합된다.     부산시는 현재 별도로 운영 중인 교통약자용 특장차(두리발)와 바우처택시(장애인콜택시)의 콜센터 통합작업을 마무리하고 다음 달 1일부터 통합콜센터로 운영한다고 30일 밝혔다.    교통약자용 특별교통수단은 장애인 등이 콜센터로 전화를 걸어 차량을 신청하면 우선 배차해 대중교통 이용이 어려운 교통약자들에게 교통수단을 제공하고 있다.     하지만 각각 콜센터를 운영하면서 효율적인 배차를 못하고, 이용이 몰리는 출퇴근 시간대 등에는 통화가 어려운 등 불편이 많았다.    앞으로는 두리발 고객과 장애인콜택시 고객이 통합 콜센터(☎051-466-2280)으로 연락하면 일괄 접수해 두리발 특장차나 일반 바우처택시를 배차받을 수 있다.    특히 두리발 특장차 이용객이 줄어드는 주말과 공휴일에 남는 차량을 장애인콜택시 고객에게 우선 배치해 이용편의도 높일 수 있을 것으로 기대된다.    두리발 특장차 배차건수는 평일 평균 1천건 안팎이고, 주말과 공휴일에는 500∼600건이다.    현재 부산에는 두리발 특장차 117대와 장애인콜택시 1천90대가 운영 중이다. joseph@yna.co.kr▶ [핫클릭] 서상사가 죽냐고? 직박구리가 복선이냐고?…'태후' 결말 어찌되나▶ [핫클릭] ""쾅하더니 와르르"" 대전 빌라 폭발현장 '아수라장'▶ [현장영상] 대만 타이베이서 4세 여아 '참수살해'…'충격'<저작권자(c) 연합뉴스, 무단 전재-재배포 금지>"
5,2016.03.28. 오후 6:23,부산교통공사 홈페이지 웹접근성 품질인증마크 획득,"			【부산=뉴시스】제갈수만 기자 = 부산교통공사 홈페이지(www.humetro.busan.kr)가 미래창조과학부 지정 인증기관인 웹와치로부터 웹 접근성 품질인증마크를 획득했다고 28일 밝혔다, 이는 전국 도시철도기관 최초로 웹 접근성과 웹 표준을 모두 준수한 반응형 홈페이지를 구축하게 됐다고 설명했다. 웹접근성 품질인증마크는 장애인과 고령자 등 홈페이지를 이용하는 모든 사람이 장애유무와 관계없이 편리하게 이용할 수 있는 우수 홈페이지임을 인증하는 제도로, 인증 유효기간은 1년이다.  공사는 한국형 웹 콘텐츠 접근성 지침에 의한 22개의 평가항목을 심사하는 전문가심사와 장애인 심사단이 직접 홈페이지를 심사하는 사용자심사에서 각각 준수율 100%를 받으며 웹접근성을 인증받았다.  공사는 지난 2015년 12월, 약 5개월간의 개편작업을 거쳐 공사 홈페이지를 전면 개편한 바 있다.  공사 홈페이지는 PC뿐만 아니라 휴대폰, 태블릿에서도 이용할 수 있도록 해상도에 따라 자동으로 최적화되는 반응형 구조를 채택해 모든 브라우저에서 편리하게 이용할 수 있도록 웹표준을 준수해 이용자의 접근성을 높여 좋은 평가를 받았다. 부산교통공사 박종흠 사장은 ""앞으로도 웹과 모바일 서비스를 통해 고객이 도시철도를 더욱 편리하게 이용할 수 있도록 노력하겠다""고 말했다. jgsm@newsis.com★ 세상에 이런일이 -  ´대학 女탈의실 몰카´ 재학생 소행…제적 ★ 오늘의 핫 포토 -  제시, 가슴골 노출 아슬 아슬한 드레스 ★ 뉴시스 뉴스, 이젠 네이버 뉴스 스탠드에서도 만나세요★ 손 안에서 보는 세상, 모바일 뉴시스<저작권자ⓒ 공감언론 뉴시스통신사. 무단전재-재배포 금지.>"
7,2016.03.14. 오후 4:15,"""다리 아파하지 마세요"" 부산 중구, 육교 승강기 설치","[부산CBS 박중석 기자]부산 중구 영주동 봉래초등학교 앞 육교에 승강기가 설치됐다. (사진=중구청 제공)부산 중구청은 교통약자의 이동권 확보를 위해 영주동 봉래초등학교 앞 횡단 육교에 승강기를 설치했다고 14일 밝혔다.구청은 이와 함께 2억 원의 예산을 들여 육교가 위치한 대영로 주변 보행 환경 개선 사업을 추진하고 있다. 중구청 관계자는 ""육교 승강기를 통해 계단 이용이 어려운 장애인과 고령자, 임산부 등 교통약자의 보행환경이 좀 더 나아질 것으로 기대한다""고 말했다.jspark@cbs.co.kr저작권자 © CBS 노컷뉴스(www.nocutnews.co.kr) 무단전재 및 재배포 금지 "
8,2016.03.02. 오전 9:02,부산 공공기관 중증장애인생산품 구매율 '증가는 했지만…',"법이 정한 기준에 못 미쳐도 별 불이익 없어, 기관마다 차이 커[부산CBS 박중석 기자]관련법에 따라 공공기관은 총 구매물품 중 1%를 중증장애인생산품으로 사야한다. (부산CBS/박중석 기자)부산시를 비롯한 부산지역 공공기관의 중증장애인생산품 구매 비율이 다소 증가했지만, 아직 법이 정한 기준에 못 미치는 공공기관도 적지 않아 제도 보완이 필요해 보인다. 중증장애인생산품우선구매 특별법에 따라 공공기관은 전체 물품 구매액의 1% 이상을 중증장애인생산품으로 사야 한다. 장애인들의 사회활동을 돕기 위한 방안의 일환인데, 지난해 부산시와 지역 16개 구·군청이 구매한 5천 4백여억 원 어치의 물품 중 중증장애인생산품 구매비율은 1.49%로 나타났다. 지난 2014년 1.27%에서 0.2% 가량이 증가한 수치다. 연제구가 전체 구매액 97억 2천여만 원 중 1.78%인 1억 4천여만 원 어치를 구매해 가장 높았고, 남구 1.66%, 동래구 1.5%의 순이었다. 반면, 기장군은 전체 42억 천여만 원 어치 중 중 0.14%인 5천9백여만 원 어치를 중증장애인생산품으로 구매하는 등 16개 구·군청 중 5곳이 법이 정한 기준에 도달하지 못했다.부산시 역시 중증장애인생산품 구매비율이 0.43%에 불과했다. 공공기관으로 범위를 넓혀보면 장애인단체에 도시철도역 청소용역을 맡기고 있는 부산교통공사가 4.45%로 가장 높은 반면, 부산도시공사와 부산환경공단은 각각 0.12%와0.98%로 저조했다. 중증장애인생산품 구매 비율을 충족하지 못한 기관들은 구매할 수 있는 물건의 종류가제한적이라는 점을 이유로 들었다. 모 기관 관계자는 ""총 구매 범위가 광범위한 반면 중증장애인 생산품은 복사용지와 장갑 등으로 제한적이다""며 ""비율을 맞추기 위해 필요없는 물건을 많이 살 수는 없지 않나?""고 말했다.또, 법이 정한 기준에 충족하지 않았다고 하더라도 해당 기관에 이렇다 할 불이익이 없는 것도 원인으로 지적된다.부산시는 공공기관의 중증장애인생산품 구매 기준을 충족하지 못한 기관으로부터 미도달 사유를 받는 한편 홍보활동을 통해 구매 비율을 높여간다는 계획이다.jspark@cbs.co.kr저작권자 © CBS 노컷뉴스(www.nocutnews.co.kr) 무단전재 및 재배포 금지 "
